[
  {
    "cv_id": "CV_000",
    "skills": [
      "Rust",
      "PostgreSQL",
      "SQL",
      "Git",
      "C++",
      "Docker",
      "Risk Management",
      "Strategic Planning"
    ],
    "experience_years": 13,
    "education": [
      "BS Computer Science",
      "MS AI",
      "PhD Computer Science"
    ],
    "seniority": "senior",
    "domain": "tech",
    "experiences": [
      {
        "title": "Project/Position 1",
        "duration_years": 2.3,
        "skills_used": [
          "Git",
          "Risk Management",
          "Strategic Planning"
        ],
        "description": "Worked on Git, Risk Management and related technologies"
      },
      {
        "title": "Project/Position 2",
        "duration_years": 2.5,
        "skills_used": [
          "SQL",
          "PostgreSQL",
          "C++",
          "Docker",
          "Git"
        ],
        "description": "Worked on SQL, PostgreSQL and related technologies"
      },
      {
        "title": "Project/Position 3",
        "duration_years": 2.5,
        "skills_used": [
          "C++",
          "Strategic Planning"
        ],
        "description": "Worked on C++, Strategic Planning and related technologies"
      },
      {
        "title": "Project/Position 4",
        "duration_years": 2.9,
        "skills_used": [
          "PostgreSQL",
          "Git",
          "Strategic Planning",
          "SQL",
          "Docker"
        ],
        "description": "Worked on PostgreSQL, Git and related technologies"
      },
      {
        "title": "Project/Position 5",
        "duration_years": 0.7,
        "skills_used": [
          "Docker",
          "Rust",
          "Strategic Planning",
          "Git"
        ],
        "description": "Worked on Docker, Rust and related technologies"
      },
      {
        "title": "Project/Position 6",
        "duration_years": 2.3,
        "skills_used": [
          "Strategic Planning",
          "C++",
          "SQL",
          "Rust"
        ],
        "description": "Worked on Strategic Planning, C++ and related technologies"
      }
    ],
    "raw_text": "CV ID: CV_000\n\nPROFESSIONAL SUMMARY:\nSenior professional with 13 years of experience in tech. \nExpertise in Rust, PostgreSQL, SQL and related technologies.\n\nEDUCATION:\n- BS Computer Science\n- MS AI\n- PhD Computer Science\n\nSKILLS:\nRust, PostgreSQL, SQL, Git, C++, Docker, Risk Management, Strategic Planning\n\nEXPERIENCE:\n\n- Project/Position 1 (2.3 years)\n  Skills: Git, Risk Management, Strategic Planning\n  Worked on Git, Risk Management and related technologies\n\n- Project/Position 2 (2.5 years)\n  Skills: SQL, PostgreSQL, C++, Docker, Git\n  Worked on SQL, PostgreSQL and related technologies\n\n- Project/Position 3 (2.5 years)\n  Skills: C++, Strategic Planning\n  Worked on C++, Strategic Planning and related technologies\n\n- Project/Position 4 (2.9 years)\n  Skills: PostgreSQL, Git, Strategic Planning, SQL, Docker\n  Worked on PostgreSQL, Git and related technologies\n\n- Project/Position 5 (0.7 years)\n  Skills: Docker, Rust, Strategic Planning, Git\n  Worked on Docker, Rust and related technologies\n\n- Project/Position 6 (2.3 years)\n  Skills: Strategic Planning, C++, SQL, Rust\n  Worked on Strategic Planning, C++ and related technologies\n"
  },
  {
    "cv_id": "CV_001",
    "skills": [
      "Computer Vision",
      "JavaScript",
      "Flask",
      "Leadership",
      "Forecasting"
    ],
    "experience_years": 3,
    "education": [
      "BS Information Technology"
    ],
    "seniority": "junior",
    "domain": "tech",
    "experiences": [
      {
        "title": "Project/Position 1",
        "duration_years": 2.4,
        "skills_used": [
          "Leadership",
          "JavaScript"
        ],
        "description": "Worked on Leadership, JavaScript and related technologies"
      },
      {
        "title": "Project/Position 2",
        "duration_years": 2.7,
        "skills_used": [
          "Computer Vision",
          "Flask"
        ],
        "description": "Worked on Computer Vision, Flask and related technologies"
      }
    ],
    "raw_text": "CV ID: CV_001\n\nPROFESSIONAL SUMMARY:\nJunior professional with 3 years of experience in tech. \nExpertise in Computer Vision, JavaScript, Flask and related technologies.\n\nEDUCATION:\n- BS Information Technology\n\nSKILLS:\nComputer Vision, JavaScript, Flask, Leadership, Forecasting\n\nEXPERIENCE:\n\n- Project/Position 1 (2.4 years)\n  Skills: Leadership, JavaScript\n  Worked on Leadership, JavaScript and related technologies\n\n- Project/Position 2 (2.7 years)\n  Skills: Computer Vision, Flask\n  Worked on Computer Vision, Flask and related technologies\n"
  },
  {
    "cv_id": "CV_002",
    "skills": [
      "REST APIs",
      "NLP",
      "R",
      "MongoDB",
      "PostgreSQL",
      "Go",
      "Negotiation",
      "Strategic Planning",
      "Sales"
    ],
    "experience_years": 16,
    "education": [
      "BS Physics",
      "PhD Physics"
    ],
    "seniority": "senior",
    "domain": "tech",
    "experiences": [
      {
        "title": "Project/Position 1",
        "duration_years": 2.5,
        "skills_used": [
          "Negotiation",
          "REST APIs",
          "NLP",
          "Sales"
        ],
        "description": "Worked on Negotiation, REST APIs and related technologies"
      },
      {
        "title": "Project/Position 2",
        "duration_years": 2.7,
        "skills_used": [
          "REST APIs",
          "Go",
          "NLP",
          "R",
          "Sales"
        ],
        "description": "Worked on REST APIs, Go and related technologies"
      },
      {
        "title": "Project/Position 3",
        "duration_years": 1.5,
        "skills_used": [
          "PostgreSQL",
          "MongoDB",
          "Negotiation",
          "Sales"
        ],
        "description": "Worked on PostgreSQL, MongoDB and related technologies"
      },
      {
        "title": "Project/Position 4",
        "duration_years": 2.4,
        "skills_used": [
          "R",
          "MongoDB",
          "Sales",
          "NLP",
          "Negotiation"
        ],
        "description": "Worked on R, MongoDB and related technologies"
      },
      {
        "title": "Project/Position 5",
        "duration_years": 1.4,
        "skills_used": [
          "Go",
          "Strategic Planning",
          "PostgreSQL",
          "MongoDB"
        ],
        "description": "Worked on Go, Strategic Planning and related technologies"
      },
      {
        "title": "Project/Position 6",
        "duration_years": 2.4,
        "skills_used": [
          "Strategic Planning",
          "Sales",
          "REST APIs"
        ],
        "description": "Worked on Strategic Planning, Sales and related technologies"
      }
    ],
    "raw_text": "CV ID: CV_002\n\nPROFESSIONAL SUMMARY:\nSenior professional with 16 years of experience in tech. \nExpertise in REST APIs, NLP, R and related technologies.\n\nEDUCATION:\n- BS Physics\n- PhD Physics\n\nSKILLS:\nREST APIs, NLP, R, MongoDB, PostgreSQL, Go, Negotiation, Strategic Planning, Sales\n\nEXPERIENCE:\n\n- Project/Position 1 (2.5 years)\n  Skills: Negotiation, REST APIs, NLP, Sales\n  Worked on Negotiation, REST APIs and related technologies\n\n- Project/Position 2 (2.7 years)\n  Skills: REST APIs, Go, NLP, R, Sales\n  Worked on REST APIs, Go and related technologies\n\n- Project/Position 3 (1.5 years)\n  Skills: PostgreSQL, MongoDB, Negotiation, Sales\n  Worked on PostgreSQL, MongoDB and related technologies\n\n- Project/Position 4 (2.4 years)\n  Skills: R, MongoDB, Sales, NLP, Negotiation\n  Worked on R, MongoDB and related technologies\n\n- Project/Position 5 (1.4 years)\n  Skills: Go, Strategic Planning, PostgreSQL, MongoDB\n  Worked on Go, Strategic Planning and related technologies\n\n- Project/Position 6 (2.4 years)\n  Skills: Strategic Planning, Sales, REST APIs\n  Worked on Strategic Planning, Sales and related technologies\n"
  },
  {
    "cv_id": "CV_003",
    "skills": [
      "Agile",
      "Docker",
      "TensorFlow",
      "Node.js",
      "JavaScript",
      "Computer Vision",
      "PowerPoint",
      "Forecasting"
    ],
    "experience_years": 14,
    "education": [
      "BS Computer Science",
      "MS AI",
      "PhD Computer Science"
    ],
    "seniority": "senior",
    "domain": "tech",
    "experiences": [
      {
        "title": "Project/Position 1",
        "duration_years": 0.8,
        "skills_used": [
          "Docker",
          "Forecasting",
          "PowerPoint",
          "Node.js"
        ],
        "description": "Worked on Docker, Forecasting and related technologies"
      },
      {
        "title": "Project/Position 2",
        "duration_years": 2.9,
        "skills_used": [
          "Node.js",
          "Docker",
          "JavaScript",
          "Agile",
          "TensorFlow"
        ],
        "description": "Worked on Node.js, Docker and related technologies"
      },
      {
        "title": "Project/Position 3",
        "duration_years": 2.7,
        "skills_used": [
          "Computer Vision",
          "JavaScript",
          "Agile"
        ],
        "description": "Worked on Computer Vision, JavaScript and related technologies"
      },
      {
        "title": "Project/Position 4",
        "duration_years": 2.0,
        "skills_used": [
          "Agile",
          "Forecasting",
          "PowerPoint",
          "Computer Vision"
        ],
        "description": "Worked on Agile, Forecasting and related technologies"
      },
      {
        "title": "Project/Position 5",
        "duration_years": 1.8,
        "skills_used": [
          "PowerPoint",
          "TensorFlow",
          "Docker"
        ],
        "description": "Worked on PowerPoint, TensorFlow and related technologies"
      },
      {
        "title": "Project/Position 6",
        "duration_years": 1.3,
        "skills_used": [
          "TensorFlow",
          "Computer Vision"
        ],
        "description": "Worked on TensorFlow, Computer Vision and related technologies"
      }
    ],
    "raw_text": "CV ID: CV_003\n\nPROFESSIONAL SUMMARY:\nSenior professional with 14 years of experience in tech. \nExpertise in Agile, Docker, TensorFlow and related technologies.\n\nEDUCATION:\n- BS Computer Science\n- MS AI\n- PhD Computer Science\n\nSKILLS:\nAgile, Docker, TensorFlow, Node.js, JavaScript, Computer Vision, PowerPoint, Forecasting\n\nEXPERIENCE:\n\n- Project/Position 1 (0.8 years)\n  Skills: Docker, Forecasting, PowerPoint, Node.js\n  Worked on Docker, Forecasting and related technologies\n\n- Project/Position 2 (2.9 years)\n  Skills: Node.js, Docker, JavaScript, Agile, TensorFlow\n  Worked on Node.js, Docker and related technologies\n\n- Project/Position 3 (2.7 years)\n  Skills: Computer Vision, JavaScript, Agile\n  Worked on Computer Vision, JavaScript and related technologies\n\n- Project/Position 4 (2.0 years)\n  Skills: Agile, Forecasting, PowerPoint, Computer Vision\n  Worked on Agile, Forecasting and related technologies\n\n- Project/Position 5 (1.8 years)\n  Skills: PowerPoint, TensorFlow, Docker\n  Worked on PowerPoint, TensorFlow and related technologies\n\n- Project/Position 6 (1.3 years)\n  Skills: TensorFlow, Computer Vision\n  Worked on TensorFlow, Computer Vision and related technologies\n"
  },
  {
    "cv_id": "CV_004",
    "skills": [
      "Hypothesis Testing",
      "Data Collection",
      "Statistical Analysis",
      "Rust",
      "MongoDB"
    ],
    "experience_years": 1,
    "education": [
      "BS Computer Science"
    ],
    "seniority": "junior",
    "domain": "research",
    "experiences": [
      {
        "title": "Project/Position 1",
        "duration_years": 0.8,
        "skills_used": [
          "Statistical Analysis",
          "Data Collection"
        ],
        "description": "Worked on Statistical Analysis, Data Collection and related technologies"
      },
      {
        "title": "Project/Position 2",
        "duration_years": 2.8,
        "skills_used": [
          "Data Collection",
          "Statistical Analysis",
          "MongoDB",
          "Rust",
          "Hypothesis Testing"
        ],
        "description": "Worked on Data Collection, Statistical Analysis and related technologies"
      }
    ],
    "raw_text": "CV ID: CV_004\n\nPROFESSIONAL SUMMARY:\nJunior professional with 1 years of experience in research. \nExpertise in Hypothesis Testing, Data Collection, Statistical Analysis and related technologies.\n\nEDUCATION:\n- BS Computer Science\n\nSKILLS:\nHypothesis Testing, Data Collection, Statistical Analysis, Rust, MongoDB\n\nEXPERIENCE:\n\n- Project/Position 1 (0.8 years)\n  Skills: Statistical Analysis, Data Collection\n  Worked on Statistical Analysis, Data Collection and related technologies\n\n- Project/Position 2 (2.8 years)\n  Skills: Data Collection, Statistical Analysis, MongoDB, Rust, Hypothesis Testing\n  Worked on Data Collection, Statistical Analysis and related technologies\n"
  },
  {
    "cv_id": "CV_005",
    "skills": [
      "Docker",
      "AWS",
      "NLP",
      "PyTorch",
      "Django",
      "REST APIs",
      "Financial Analysis",
      "Customer Relations",
      "Forecasting"
    ],
    "experience_years": 5,
    "education": [
      "BS Engineering",
      "MS Computer Science"
    ],
    "seniority": "mid",
    "domain": "tech",
    "experiences": [
      {
        "title": "Project/Position 1",
        "duration_years": 2.3,
        "skills_used": [
          "PyTorch",
          "AWS"
        ],
        "description": "Worked on PyTorch, AWS and related technologies"
      },
      {
        "title": "Project/Position 2",
        "duration_years": 0.7,
        "skills_used": [
          "Financial Analysis",
          "PyTorch"
        ],
        "description": "Worked on Financial Analysis, PyTorch and related technologies"
      }
    ],
    "raw_text": "CV ID: CV_005\n\nPROFESSIONAL SUMMARY:\nMid professional with 5 years of experience in tech. \nExpertise in Docker, AWS, NLP and related technologies.\n\nEDUCATION:\n- BS Engineering\n- MS Computer Science\n\nSKILLS:\nDocker, AWS, NLP, PyTorch, Django, REST APIs, Financial Analysis, Customer Relations, Forecasting\n\nEXPERIENCE:\n\n- Project/Position 1 (2.3 years)\n  Skills: PyTorch, AWS\n  Worked on PyTorch, AWS and related technologies\n\n- Project/Position 2 (0.7 years)\n  Skills: Financial Analysis, PyTorch\n  Worked on Financial Analysis, PyTorch and related technologies\n"
  },
  {
    "cv_id": "CV_006",
    "skills": [
      "Customer Relations",
      "Negotiation",
      "CRM",
      "Marketing",
      "Flask",
      "SQL"
    ],
    "experience_years": 0,
    "education": [
      "BS Computer Science"
    ],
    "seniority": "junior",
    "domain": "business",
    "experiences": [
      {
        "title": "Project/Position 1",
        "duration_years": 1.4,
        "skills_used": [
          "CRM",
          "Negotiation",
          "Customer Relations",
          "Flask",
          "SQL"
        ],
        "description": "Worked on CRM, Negotiation and related technologies"
      },
      {
        "title": "Project/Position 2",
        "duration_years": 0.7,
        "skills_used": [
          "Negotiation",
          "Flask",
          "Customer Relations",
          "Marketing",
          "SQL"
        ],
        "description": "Worked on Negotiation, Flask and related technologies"
      }
    ],
    "raw_text": "CV ID: CV_006\n\nPROFESSIONAL SUMMARY:\nJunior professional with 0 years of experience in business. \nExpertise in Customer Relations, Negotiation, CRM and related technologies.\n\nEDUCATION:\n- BS Computer Science\n\nSKILLS:\nCustomer Relations, Negotiation, CRM, Marketing, Flask, SQL\n\nEXPERIENCE:\n\n- Project/Position 1 (1.4 years)\n  Skills: CRM, Negotiation, Customer Relations, Flask, SQL\n  Worked on CRM, Negotiation and related technologies\n\n- Project/Position 2 (0.7 years)\n  Skills: Negotiation, Flask, Customer Relations, Marketing, SQL\n  Worked on Negotiation, Flask and related technologies\n"
  },
  {
    "cv_id": "CV_007",
    "skills": [
      "Go",
      "Flask",
      "PyTorch",
      "SQL",
      "TensorFlow",
      "Sales",
      "Negotiation"
    ],
    "experience_years": 6,
    "education": [
      "BS Mathematics",
      "MS Statistics"
    ],
    "seniority": "mid",
    "domain": "tech",
    "experiences": [
      {
        "title": "Project/Position 1",
        "duration_years": 3.0,
        "skills_used": [
          "Sales",
          "Negotiation"
        ],
        "description": "Worked on Sales, Negotiation and related technologies"
      },
      {
        "title": "Project/Position 2",
        "duration_years": 2.8,
        "skills_used": [
          "TensorFlow",
          "Go"
        ],
        "description": "Worked on TensorFlow, Go and related technologies"
      },
      {
        "title": "Project/Position 3",
        "duration_years": 1.7,
        "skills_used": [
          "PyTorch",
          "Flask",
          "TensorFlow"
        ],
        "description": "Worked on PyTorch, Flask and related technologies"
      }
    ],
    "raw_text": "CV ID: CV_007\n\nPROFESSIONAL SUMMARY:\nMid professional with 6 years of experience in tech. \nExpertise in Go, Flask, PyTorch and related technologies.\n\nEDUCATION:\n- BS Mathematics\n- MS Statistics\n\nSKILLS:\nGo, Flask, PyTorch, SQL, TensorFlow, Sales, Negotiation\n\nEXPERIENCE:\n\n- Project/Position 1 (3.0 years)\n  Skills: Sales, Negotiation\n  Worked on Sales, Negotiation and related technologies\n\n- Project/Position 2 (2.8 years)\n  Skills: TensorFlow, Go\n  Worked on TensorFlow, Go and related technologies\n\n- Project/Position 3 (1.7 years)\n  Skills: PyTorch, Flask, TensorFlow\n  Worked on PyTorch, Flask and related technologies\n"
  },
  {
    "cv_id": "CV_008",
    "skills": [
      "Sales",
      "PowerPoint",
      "Project Management",
      "Forecasting",
      "Negotiation",
      "Power BI",
      "Market Research",
      "TensorFlow",
      "Kubernetes"
    ],
    "experience_years": 12,
    "education": [
      "BS Engineering",
      "MS Engineering",
      "MBA"
    ],
    "seniority": "senior",
    "domain": "business",
    "experiences": [
      {
        "title": "Project/Position 1",
        "duration_years": 1.7,
        "skills_used": [
          "Forecasting",
          "Sales",
          "Kubernetes",
          "Power BI"
        ],
        "description": "Worked on Forecasting, Sales and related technologies"
      },
      {
        "title": "Project/Position 2",
        "duration_years": 0.7,
        "skills_used": [
          "Negotiation",
          "Sales",
          "Power BI"
        ],
        "description": "Worked on Negotiation, Sales and related technologies"
      },
      {
        "title": "Project/Position 3",
        "duration_years": 0.7,
        "skills_used": [
          "Sales",
          "Project Management",
          "Power BI"
        ],
        "description": "Worked on Sales, Project Management and related technologies"
      },
      {
        "title": "Project/Position 4",
        "duration_years": 2.9,
        "skills_used": [
          "Power BI",
          "TensorFlow",
          "Sales"
        ],
        "description": "Worked on Power BI, TensorFlow and related technologies"
      },
      {
        "title": "Project/Position 5",
        "duration_years": 0.7,
        "skills_used": [
          "Project Management",
          "Sales",
          "Power BI"
        ],
        "description": "Worked on Project Management, Sales and related technologies"
      },
      {
        "title": "Project/Position 6",
        "duration_years": 2.3,
        "skills_used": [
          "Market Research",
          "Negotiation",
          "PowerPoint",
          "Power BI"
        ],
        "description": "Worked on Market Research, Negotiation and related technologies"
      }
    ],
    "raw_text": "CV ID: CV_008\n\nPROFESSIONAL SUMMARY:\nSenior professional with 12 years of experience in business. \nExpertise in Sales, PowerPoint, Project Management and related technologies.\n\nEDUCATION:\n- BS Engineering\n- MS Engineering\n- MBA\n\nSKILLS:\nSales, PowerPoint, Project Management, Forecasting, Negotiation, Power BI, Market Research, TensorFlow, Kubernetes\n\nEXPERIENCE:\n\n- Project/Position 1 (1.7 years)\n  Skills: Forecasting, Sales, Kubernetes, Power BI\n  Worked on Forecasting, Sales and related technologies\n\n- Project/Position 2 (0.7 years)\n  Skills: Negotiation, Sales, Power BI\n  Worked on Negotiation, Sales and related technologies\n\n- Project/Position 3 (0.7 years)\n  Skills: Sales, Project Management, Power BI\n  Worked on Sales, Project Management and related technologies\n\n- Project/Position 4 (2.9 years)\n  Skills: Power BI, TensorFlow, Sales\n  Worked on Power BI, TensorFlow and related technologies\n\n- Project/Position 5 (0.7 years)\n  Skills: Project Management, Sales, Power BI\n  Worked on Project Management, Sales and related technologies\n\n- Project/Position 6 (2.3 years)\n  Skills: Market Research, Negotiation, PowerPoint, Power BI\n  Worked on Market Research, Negotiation and related technologies\n"
  },
  {
    "cv_id": "CV_009",
    "skills": [
      "Process Improvement",
      "Leadership",
      "Power BI",
      "Communication",
      "PostgreSQL",
      "CI/CD"
    ],
    "experience_years": 0,
    "education": [
      "BS Engineering"
    ],
    "seniority": "junior",
    "domain": "business",
    "experiences": [
      {
        "title": "Project/Position 1",
        "duration_years": 1.0,
        "skills_used": [
          "Leadership",
          "CI/CD"
        ],
        "description": "Worked on Leadership, CI/CD and related technologies"
      },
      {
        "title": "Project/Position 2",
        "duration_years": 2.7,
        "skills_used": [
          "PostgreSQL",
          "Leadership",
          "Power BI",
          "Process Improvement"
        ],
        "description": "Worked on PostgreSQL, Leadership and related technologies"
      }
    ],
    "raw_text": "CV ID: CV_009\n\nPROFESSIONAL SUMMARY:\nJunior professional with 0 years of experience in business. \nExpertise in Process Improvement, Leadership, Power BI and related technologies.\n\nEDUCATION:\n- BS Engineering\n\nSKILLS:\nProcess Improvement, Leadership, Power BI, Communication, PostgreSQL, CI/CD\n\nEXPERIENCE:\n\n- Project/Position 1 (1.0 years)\n  Skills: Leadership, CI/CD\n  Worked on Leadership, CI/CD and related technologies\n\n- Project/Position 2 (2.7 years)\n  Skills: PostgreSQL, Leadership, Power BI, Process Improvement\n  Worked on PostgreSQL, Leadership and related technologies\n"
  },
  {
    "cv_id": "CV_010",
    "skills": [
      "Risk Management",
      "Leadership",
      "ERP",
      "Project Management",
      "Docker",
      "REST APIs"
    ],
    "experience_years": 1,
    "education": [
      "BS Mathematics"
    ],
    "seniority": "junior",
    "domain": "business",
    "experiences": [
      {
        "title": "Project/Position 1",
        "duration_years": 2.4,
        "skills_used": [
          "REST APIs",
          "Risk Management"
        ],
        "description": "Worked on REST APIs, Risk Management and related technologies"
      },
      {
        "title": "Project/Position 2",
        "duration_years": 2.0,
        "skills_used": [
          "Leadership",
          "Project Management",
          "REST APIs"
        ],
        "description": "Worked on Leadership, Project Management and related technologies"
      }
    ],
    "raw_text": "CV ID: CV_010\n\nPROFESSIONAL SUMMARY:\nJunior professional with 1 years of experience in business. \nExpertise in Risk Management, Leadership, ERP and related technologies.\n\nEDUCATION:\n- BS Mathematics\n\nSKILLS:\nRisk Management, Leadership, ERP, Project Management, Docker, REST APIs\n\nEXPERIENCE:\n\n- Project/Position 1 (2.4 years)\n  Skills: REST APIs, Risk Management\n  Worked on REST APIs, Risk Management and related technologies\n\n- Project/Position 2 (2.0 years)\n  Skills: Leadership, Project Management, REST APIs\n  Worked on Leadership, Project Management and related technologies\n"
  },
  {
    "cv_id": "CV_011",
    "skills": [
      "Negotiation",
      "ERP",
      "CRM",
      "Process Improvement",
      "Business Analysis",
      "JavaScript",
      "AWS"
    ],
    "experience_years": 5,
    "education": [
      "BS Mathematics",
      "MS Statistics"
    ],
    "seniority": "mid",
    "domain": "business",
    "experiences": [
      {
        "title": "Project/Position 1",
        "duration_years": 1.9,
        "skills_used": [
          "JavaScript",
          "ERP",
          "Process Improvement",
          "Business Analysis"
        ],
        "description": "Worked on JavaScript, ERP and related technologies"
      },
      {
        "title": "Project/Position 2",
        "duration_years": 2.9,
        "skills_used": [
          "AWS",
          "Negotiation"
        ],
        "description": "Worked on AWS, Negotiation and related technologies"
      }
    ],
    "raw_text": "CV ID: CV_011\n\nPROFESSIONAL SUMMARY:\nMid professional with 5 years of experience in business. \nExpertise in Negotiation, ERP, CRM and related technologies.\n\nEDUCATION:\n- BS Mathematics\n- MS Statistics\n\nSKILLS:\nNegotiation, ERP, CRM, Process Improvement, Business Analysis, JavaScript, AWS\n\nEXPERIENCE:\n\n- Project/Position 1 (1.9 years)\n  Skills: JavaScript, ERP, Process Improvement, Business Analysis\n  Worked on JavaScript, ERP and related technologies\n\n- Project/Position 2 (2.9 years)\n  Skills: AWS, Negotiation\n  Worked on AWS, Negotiation and related technologies\n"
  },
  {
    "cv_id": "CV_012",
    "skills": [
      "NLP",
      "React",
      "Flask",
      "SQL",
      "TensorFlow",
      "REST APIs",
      "Business Analysis",
      "Leadership",
      "Excel"
    ],
    "experience_years": 7,
    "education": [
      "BS Engineering",
      "MS Computer Science"
    ],
    "seniority": "mid",
    "domain": "tech",
    "experiences": [
      {
        "title": "Project/Position 1",
        "duration_years": 0.9,
        "skills_used": [
          "SQL",
          "TensorFlow",
          "Leadership"
        ],
        "description": "Worked on SQL, TensorFlow and related technologies"
      },
      {
        "title": "Project/Position 2",
        "duration_years": 0.9,
        "skills_used": [
          "Flask",
          "Leadership",
          "NLP"
        ],
        "description": "Worked on Flask, Leadership and related technologies"
      },
      {
        "title": "Project/Position 3",
        "duration_years": 2.7,
        "skills_used": [
          "TensorFlow",
          "Leadership",
          "Excel",
          "Business Analysis"
        ],
        "description": "Worked on TensorFlow, Leadership and related technologies"
      }
    ],
    "raw_text": "CV ID: CV_012\n\nPROFESSIONAL SUMMARY:\nMid professional with 7 years of experience in tech. \nExpertise in NLP, React, Flask and related technologies.\n\nEDUCATION:\n- BS Engineering\n- MS Computer Science\n\nSKILLS:\nNLP, React, Flask, SQL, TensorFlow, REST APIs, Business Analysis, Leadership, Excel\n\nEXPERIENCE:\n\n- Project/Position 1 (0.9 years)\n  Skills: SQL, TensorFlow, Leadership\n  Worked on SQL, TensorFlow and related technologies\n\n- Project/Position 2 (0.9 years)\n  Skills: Flask, Leadership, NLP\n  Worked on Flask, Leadership and related technologies\n\n- Project/Position 3 (2.7 years)\n  Skills: TensorFlow, Leadership, Excel, Business Analysis\n  Worked on TensorFlow, Leadership and related technologies\n"
  },
  {
    "cv_id": "CV_013",
    "skills": [
      "Kubernetes",
      "C++",
      "Computer Vision",
      "GraphQL",
      "Java",
      "CRM",
      "Customer Relations",
      "Marketing"
    ],
    "experience_years": 3,
    "education": [
      "BS Engineering",
      "MS Computer Science"
    ],
    "seniority": "mid",
    "domain": "tech",
    "experiences": [
      {
        "title": "Project/Position 1",
        "duration_years": 1.4,
        "skills_used": [
          "GraphQL",
          "Computer Vision",
          "Marketing",
          "Kubernetes",
          "Customer Relations"
        ],
        "description": "Worked on GraphQL, Computer Vision and related technologies"
      },
      {
        "title": "Project/Position 2",
        "duration_years": 0.8,
        "skills_used": [
          "CRM",
          "Customer Relations",
          "Java",
          "Computer Vision",
          "Kubernetes"
        ],
        "description": "Worked on CRM, Customer Relations and related technologies"
      }
    ],
    "raw_text": "CV ID: CV_013\n\nPROFESSIONAL SUMMARY:\nMid professional with 3 years of experience in tech. \nExpertise in Kubernetes, C++, Computer Vision and related technologies.\n\nEDUCATION:\n- BS Engineering\n- MS Computer Science\n\nSKILLS:\nKubernetes, C++, Computer Vision, GraphQL, Java, CRM, Customer Relations, Marketing\n\nEXPERIENCE:\n\n- Project/Position 1 (1.4 years)\n  Skills: GraphQL, Computer Vision, Marketing, Kubernetes, Customer Relations\n  Worked on GraphQL, Computer Vision and related technologies\n\n- Project/Position 2 (0.8 years)\n  Skills: CRM, Customer Relations, Java, Computer Vision, Kubernetes\n  Worked on CRM, Customer Relations and related technologies\n"
  },
  {
    "cv_id": "CV_014",
    "skills": [
      "Negotiation",
      "Business Analysis",
      "Financial Analysis",
      "Node.js",
      "TensorFlow"
    ],
    "experience_years": 2,
    "education": [
      "BS Mathematics"
    ],
    "seniority": "junior",
    "domain": "business",
    "experiences": [
      {
        "title": "Project/Position 1",
        "duration_years": 0.5,
        "skills_used": [
          "Node.js",
          "Business Analysis",
          "TensorFlow",
          "Negotiation",
          "Financial Analysis"
        ],
        "description": "Worked on Node.js, Business Analysis and related technologies"
      },
      {
        "title": "Project/Position 2",
        "duration_years": 0.7,
        "skills_used": [
          "Negotiation",
          "Node.js",
          "Financial Analysis"
        ],
        "description": "Worked on Negotiation, Node.js and related technologies"
      }
    ],
    "raw_text": "CV ID: CV_014\n\nPROFESSIONAL SUMMARY:\nJunior professional with 2 years of experience in business. \nExpertise in Negotiation, Business Analysis, Financial Analysis and related technologies.\n\nEDUCATION:\n- BS Mathematics\n\nSKILLS:\nNegotiation, Business Analysis, Financial Analysis, Node.js, TensorFlow\n\nEXPERIENCE:\n\n- Project/Position 1 (0.5 years)\n  Skills: Node.js, Business Analysis, TensorFlow, Negotiation, Financial Analysis\n  Worked on Node.js, Business Analysis and related technologies\n\n- Project/Position 2 (0.7 years)\n  Skills: Negotiation, Node.js, Financial Analysis\n  Worked on Negotiation, Node.js and related technologies\n"
  },
  {
    "cv_id": "CV_015",
    "skills": [
      "GraphQL",
      "C++",
      "Git",
      "MongoDB",
      "Deep Learning",
      "ERP",
      "Leadership"
    ],
    "experience_years": 2,
    "education": [
      "BS Mathematics"
    ],
    "seniority": "junior",
    "domain": "tech",
    "experiences": [
      {
        "title": "Project/Position 1",
        "duration_years": 2.2,
        "skills_used": [
          "GraphQL",
          "Git",
          "Deep Learning"
        ],
        "description": "Worked on GraphQL, Git and related technologies"
      },
      {
        "title": "Project/Position 2",
        "duration_years": 1.9,
        "skills_used": [
          "C++",
          "Leadership",
          "Git",
          "MongoDB",
          "ERP"
        ],
        "description": "Worked on C++, Leadership and related technologies"
      }
    ],
    "raw_text": "CV ID: CV_015\n\nPROFESSIONAL SUMMARY:\nJunior professional with 2 years of experience in tech. \nExpertise in GraphQL, C++, Git and related technologies.\n\nEDUCATION:\n- BS Mathematics\n\nSKILLS:\nGraphQL, C++, Git, MongoDB, Deep Learning, ERP, Leadership\n\nEXPERIENCE:\n\n- Project/Position 1 (2.2 years)\n  Skills: GraphQL, Git, Deep Learning\n  Worked on GraphQL, Git and related technologies\n\n- Project/Position 2 (1.9 years)\n  Skills: C++, Leadership, Git, MongoDB, ERP\n  Worked on C++, Leadership and related technologies\n"
  },
  {
    "cv_id": "CV_016",
    "skills": [
      "TensorFlow",
      "Agile",
      "React",
      "Node.js",
      "AWS",
      "Communication",
      "Power BI",
      "Forecasting"
    ],
    "experience_years": 3,
    "education": [
      "BS Computer Science",
      "MS Data Science"
    ],
    "seniority": "mid",
    "domain": "tech",
    "experiences": [
      {
        "title": "Project/Position 1",
        "duration_years": 1.8,
        "skills_used": [
          "Power BI",
          "React"
        ],
        "description": "Worked on Power BI, React and related technologies"
      },
      {
        "title": "Project/Position 2",
        "duration_years": 1.1,
        "skills_used": [
          "TensorFlow",
          "Agile",
          "React",
          "Node.js"
        ],
        "description": "Worked on TensorFlow, Agile and related technologies"
      }
    ],
    "raw_text": "CV ID: CV_016\n\nPROFESSIONAL SUMMARY:\nMid professional with 3 years of experience in tech. \nExpertise in TensorFlow, Agile, React and related technologies.\n\nEDUCATION:\n- BS Computer Science\n- MS Data Science\n\nSKILLS:\nTensorFlow, Agile, React, Node.js, AWS, Communication, Power BI, Forecasting\n\nEXPERIENCE:\n\n- Project/Position 1 (1.8 years)\n  Skills: Power BI, React\n  Worked on Power BI, React and related technologies\n\n- Project/Position 2 (1.1 years)\n  Skills: TensorFlow, Agile, React, Node.js\n  Worked on TensorFlow, Agile and related technologies\n"
  },
  {
    "cv_id": "CV_017",
    "skills": [
      "Data Collection",
      "Grant Writing",
      "SPSS",
      "Publication",
      "TensorFlow",
      "MongoDB",
      "AWS"
    ],
    "experience_years": 4,
    "education": [
      "BS Engineering",
      "MS Computer Science"
    ],
    "seniority": "mid",
    "domain": "research",
    "experiences": [
      {
        "title": "Project/Position 1",
        "duration_years": 2.7,
        "skills_used": [
          "SPSS",
          "AWS",
          "Data Collection"
        ],
        "description": "Worked on SPSS, AWS and related technologies"
      },
      {
        "title": "Project/Position 2",
        "duration_years": 1.0,
        "skills_used": [
          "Data Collection",
          "TensorFlow"
        ],
        "description": "Worked on Data Collection, TensorFlow and related technologies"
      }
    ],
    "raw_text": "CV ID: CV_017\n\nPROFESSIONAL SUMMARY:\nMid professional with 4 years of experience in research. \nExpertise in Data Collection, Grant Writing, SPSS and related technologies.\n\nEDUCATION:\n- BS Engineering\n- MS Computer Science\n\nSKILLS:\nData Collection, Grant Writing, SPSS, Publication, TensorFlow, MongoDB, AWS\n\nEXPERIENCE:\n\n- Project/Position 1 (2.7 years)\n  Skills: SPSS, AWS, Data Collection\n  Worked on SPSS, AWS and related technologies\n\n- Project/Position 2 (1.0 years)\n  Skills: Data Collection, TensorFlow\n  Worked on Data Collection, TensorFlow and related technologies\n"
  },
  {
    "cv_id": "CV_018",
    "skills": [
      "Rust",
      "PostgreSQL",
      "GraphQL",
      "C++",
      "PyTorch",
      "Market Research",
      "Power BI",
      "ERP"
    ],
    "experience_years": 6,
    "education": [
      "BS Physics",
      "MS Machine Learning"
    ],
    "seniority": "mid",
    "domain": "tech",
    "experiences": [
      {
        "title": "Project/Position 1",
        "duration_years": 1.6,
        "skills_used": [
          "Rust",
          "Power BI",
          "PyTorch"
        ],
        "description": "Worked on Rust, Power BI and related technologies"
      },
      {
        "title": "Project/Position 2",
        "duration_years": 1.2,
        "skills_used": [
          "PostgreSQL",
          "ERP",
          "Power BI"
        ],
        "description": "Worked on PostgreSQL, ERP and related technologies"
      },
      {
        "title": "Project/Position 3",
        "duration_years": 0.7,
        "skills_used": [
          "GraphQL",
          "Power BI",
          "PostgreSQL",
          "C++",
          "PyTorch"
        ],
        "description": "Worked on GraphQL, Power BI and related technologies"
      }
    ],
    "raw_text": "CV ID: CV_018\n\nPROFESSIONAL SUMMARY:\nMid professional with 6 years of experience in tech. \nExpertise in Rust, PostgreSQL, GraphQL and related technologies.\n\nEDUCATION:\n- BS Physics\n- MS Machine Learning\n\nSKILLS:\nRust, PostgreSQL, GraphQL, C++, PyTorch, Market Research, Power BI, ERP\n\nEXPERIENCE:\n\n- Project/Position 1 (1.6 years)\n  Skills: Rust, Power BI, PyTorch\n  Worked on Rust, Power BI and related technologies\n\n- Project/Position 2 (1.2 years)\n  Skills: PostgreSQL, ERP, Power BI\n  Worked on PostgreSQL, ERP and related technologies\n\n- Project/Position 3 (0.7 years)\n  Skills: GraphQL, Power BI, PostgreSQL, C++, PyTorch\n  Worked on GraphQL, Power BI and related technologies\n"
  },
  {
    "cv_id": "CV_019",
    "skills": [
      "Data Analysis",
      "MongoDB",
      "Flask",
      "JavaScript",
      "SQL",
      "Market Research",
      "Customer Relations",
      "PowerPoint"
    ],
    "experience_years": 10,
    "education": [
      "BS Mathematics",
      "MS Statistics",
      "PhD Statistics"
    ],
    "seniority": "senior",
    "domain": "tech",
    "experiences": [
      {
        "title": "Project/Position 1",
        "duration_years": 1.5,
        "skills_used": [
          "SQL",
          "JavaScript",
          "Data Analysis",
          "MongoDB",
          "PowerPoint"
        ],
        "description": "Worked on SQL, JavaScript and related technologies"
      },
      {
        "title": "Project/Position 2",
        "duration_years": 2.7,
        "skills_used": [
          "PowerPoint",
          "Customer Relations"
        ],
        "description": "Worked on PowerPoint, Customer Relations and related technologies"
      },
      {
        "title": "Project/Position 3",
        "duration_years": 2.4,
        "skills_used": [
          "Customer Relations",
          "JavaScript",
          "Data Analysis",
          "Flask",
          "SQL"
        ],
        "description": "Worked on Customer Relations, JavaScript and related technologies"
      },
      {
        "title": "Project/Position 4",
        "duration_years": 1.7,
        "skills_used": [
          "JavaScript",
          "Market Research",
          "Customer Relations",
          "PowerPoint",
          "MongoDB"
        ],
        "description": "Worked on JavaScript, Market Research and related technologies"
      },
      {
        "title": "Project/Position 5",
        "duration_years": 1.5,
        "skills_used": [
          "Data Analysis",
          "SQL",
          "PowerPoint",
          "MongoDB"
        ],
        "description": "Worked on Data Analysis, SQL and related technologies"
      }
    ],
    "raw_text": "CV ID: CV_019\n\nPROFESSIONAL SUMMARY:\nSenior professional with 10 years of experience in tech. \nExpertise in Data Analysis, MongoDB, Flask and related technologies.\n\nEDUCATION:\n- BS Mathematics\n- MS Statistics\n- PhD Statistics\n\nSKILLS:\nData Analysis, MongoDB, Flask, JavaScript, SQL, Market Research, Customer Relations, PowerPoint\n\nEXPERIENCE:\n\n- Project/Position 1 (1.5 years)\n  Skills: SQL, JavaScript, Data Analysis, MongoDB, PowerPoint\n  Worked on SQL, JavaScript and related technologies\n\n- Project/Position 2 (2.7 years)\n  Skills: PowerPoint, Customer Relations\n  Worked on PowerPoint, Customer Relations and related technologies\n\n- Project/Position 3 (2.4 years)\n  Skills: Customer Relations, JavaScript, Data Analysis, Flask, SQL\n  Worked on Customer Relations, JavaScript and related technologies\n\n- Project/Position 4 (1.7 years)\n  Skills: JavaScript, Market Research, Customer Relations, PowerPoint, MongoDB\n  Worked on JavaScript, Market Research and related technologies\n\n- Project/Position 5 (1.5 years)\n  Skills: Data Analysis, SQL, PowerPoint, MongoDB\n  Worked on Data Analysis, SQL and related technologies\n"
  },
  {
    "cv_id": "CV_020",
    "skills": [
      "Publication",
      "Python",
      "Research Design",
      "Quantitative Research",
      "Hypothesis Testing",
      "React",
      "Docker"
    ],
    "experience_years": 3,
    "education": [
      "BS Data Science"
    ],
    "seniority": "junior",
    "domain": "research",
    "experiences": [
      {
        "title": "Project/Position 1",
        "duration_years": 1.4,
        "skills_used": [
          "Research Design",
          "Quantitative Research"
        ],
        "description": "Worked on Research Design, Quantitative Research and related technologies"
      },
      {
        "title": "Project/Position 2",
        "duration_years": 1.3,
        "skills_used": [
          "React",
          "Quantitative Research",
          "Research Design"
        ],
        "description": "Worked on React, Quantitative Research and related technologies"
      }
    ],
    "raw_text": "CV ID: CV_020\n\nPROFESSIONAL SUMMARY:\nJunior professional with 3 years of experience in research. \nExpertise in Publication, Python, Research Design and related technologies.\n\nEDUCATION:\n- BS Data Science\n\nSKILLS:\nPublication, Python, Research Design, Quantitative Research, Hypothesis Testing, React, Docker\n\nEXPERIENCE:\n\n- Project/Position 1 (1.4 years)\n  Skills: Research Design, Quantitative Research\n  Worked on Research Design, Quantitative Research and related technologies\n\n- Project/Position 2 (1.3 years)\n  Skills: React, Quantitative Research, Research Design\n  Worked on React, Quantitative Research and related technologies\n"
  },
  {
    "cv_id": "CV_021",
    "skills": [
      "Survey Design",
      "Experiment Design",
      "SPSS",
      "Grant Writing",
      "Python",
      "Git"
    ],
    "experience_years": 2,
    "education": [
      "BS Data Science"
    ],
    "seniority": "junior",
    "domain": "research",
    "experiences": [
      {
        "title": "Project/Position 1",
        "duration_years": 2.9,
        "skills_used": [
          "Experiment Design",
          "Survey Design"
        ],
        "description": "Worked on Experiment Design, Survey Design and related technologies"
      },
      {
        "title": "Project/Position 2",
        "duration_years": 1.1,
        "skills_used": [
          "Grant Writing",
          "Survey Design",
          "Experiment Design"
        ],
        "description": "Worked on Grant Writing, Survey Design and related technologies"
      }
    ],
    "raw_text": "CV ID: CV_021\n\nPROFESSIONAL SUMMARY:\nJunior professional with 2 years of experience in research. \nExpertise in Survey Design, Experiment Design, SPSS and related technologies.\n\nEDUCATION:\n- BS Data Science\n\nSKILLS:\nSurvey Design, Experiment Design, SPSS, Grant Writing, Python, Git\n\nEXPERIENCE:\n\n- Project/Position 1 (2.9 years)\n  Skills: Experiment Design, Survey Design\n  Worked on Experiment Design, Survey Design and related technologies\n\n- Project/Position 2 (1.1 years)\n  Skills: Grant Writing, Survey Design, Experiment Design\n  Worked on Grant Writing, Survey Design and related technologies\n"
  },
  {
    "cv_id": "CV_022",
    "skills": [
      "Go",
      "PyTorch",
      "Kubernetes",
      "Machine Learning",
      "Excel",
      "Sales",
      "Financial Analysis"
    ],
    "experience_years": 2,
    "education": [
      "BS Data Science"
    ],
    "seniority": "junior",
    "domain": "tech",
    "experiences": [
      {
        "title": "Project/Position 1",
        "duration_years": 2.9,
        "skills_used": [
          "Sales",
          "Excel",
          "Machine Learning",
          "Financial Analysis"
        ],
        "description": "Worked on Sales, Excel and related technologies"
      },
      {
        "title": "Project/Position 2",
        "duration_years": 2.2,
        "skills_used": [
          "Machine Learning",
          "Go",
          "Sales"
        ],
        "description": "Worked on Machine Learning, Go and related technologies"
      }
    ],
    "raw_text": "CV ID: CV_022\n\nPROFESSIONAL SUMMARY:\nJunior professional with 2 years of experience in tech. \nExpertise in Go, PyTorch, Kubernetes and related technologies.\n\nEDUCATION:\n- BS Data Science\n\nSKILLS:\nGo, PyTorch, Kubernetes, Machine Learning, Excel, Sales, Financial Analysis\n\nEXPERIENCE:\n\n- Project/Position 1 (2.9 years)\n  Skills: Sales, Excel, Machine Learning, Financial Analysis\n  Worked on Sales, Excel and related technologies\n\n- Project/Position 2 (2.2 years)\n  Skills: Machine Learning, Go, Sales\n  Worked on Machine Learning, Go and related technologies\n"
  },
  {
    "cv_id": "CV_023",
    "skills": [
      "Deep Learning",
      "GraphQL",
      "Docker",
      "Forecasting",
      "Financial Analysis"
    ],
    "experience_years": 2,
    "education": [
      "BS Engineering"
    ],
    "seniority": "junior",
    "domain": "tech",
    "experiences": [
      {
        "title": "Project/Position 1",
        "duration_years": 0.5,
        "skills_used": [
          "Forecasting",
          "Deep Learning",
          "Docker",
          "GraphQL"
        ],
        "description": "Worked on Forecasting, Deep Learning and related technologies"
      },
      {
        "title": "Project/Position 2",
        "duration_years": 2.1,
        "skills_used": [
          "Docker",
          "Financial Analysis",
          "Deep Learning",
          "GraphQL",
          "Forecasting"
        ],
        "description": "Worked on Docker, Financial Analysis and related technologies"
      }
    ],
    "raw_text": "CV ID: CV_023\n\nPROFESSIONAL SUMMARY:\nJunior professional with 2 years of experience in tech. \nExpertise in Deep Learning, GraphQL, Docker and related technologies.\n\nEDUCATION:\n- BS Engineering\n\nSKILLS:\nDeep Learning, GraphQL, Docker, Forecasting, Financial Analysis\n\nEXPERIENCE:\n\n- Project/Position 1 (0.5 years)\n  Skills: Forecasting, Deep Learning, Docker, GraphQL\n  Worked on Forecasting, Deep Learning and related technologies\n\n- Project/Position 2 (2.1 years)\n  Skills: Docker, Financial Analysis, Deep Learning, GraphQL, Forecasting\n  Worked on Docker, Financial Analysis and related technologies\n"
  },
  {
    "cv_id": "CV_024",
    "skills": [
      "R",
      "Git",
      "Django",
      "AWS",
      "Machine Learning",
      "Node.js",
      "Risk Management",
      "CRM",
      "Power BI"
    ],
    "experience_years": 7,
    "education": [
      "BS Business",
      "MBA"
    ],
    "seniority": "mid",
    "domain": "tech",
    "experiences": [
      {
        "title": "Project/Position 1",
        "duration_years": 2.6,
        "skills_used": [
          "AWS",
          "CRM",
          "Django",
          "R",
          "Machine Learning"
        ],
        "description": "Worked on AWS, CRM and related technologies"
      },
      {
        "title": "Project/Position 2",
        "duration_years": 1.4,
        "skills_used": [
          "CRM",
          "Power BI",
          "Git"
        ],
        "description": "Worked on CRM, Power BI and related technologies"
      },
      {
        "title": "Project/Position 3",
        "duration_years": 2.3,
        "skills_used": [
          "Node.js",
          "Risk Management",
          "Django",
          "Machine Learning"
        ],
        "description": "Worked on Node.js, Risk Management and related technologies"
      }
    ],
    "raw_text": "CV ID: CV_024\n\nPROFESSIONAL SUMMARY:\nMid professional with 7 years of experience in tech. \nExpertise in R, Git, Django and related technologies.\n\nEDUCATION:\n- BS Business\n- MBA\n\nSKILLS:\nR, Git, Django, AWS, Machine Learning, Node.js, Risk Management, CRM, Power BI\n\nEXPERIENCE:\n\n- Project/Position 1 (2.6 years)\n  Skills: AWS, CRM, Django, R, Machine Learning\n  Worked on AWS, CRM and related technologies\n\n- Project/Position 2 (1.4 years)\n  Skills: CRM, Power BI, Git\n  Worked on CRM, Power BI and related technologies\n\n- Project/Position 3 (2.3 years)\n  Skills: Node.js, Risk Management, Django, Machine Learning\n  Worked on Node.js, Risk Management and related technologies\n"
  },
  {
    "cv_id": "CV_025",
    "skills": [
      "Literature Review",
      "SPSS",
      "Data Collection",
      "Survey Design",
      "Peer Review",
      "Experiment Design",
      "CI/CD",
      "Rust",
      "Kubernetes"
    ],
    "experience_years": 8,
    "education": [
      "BS Mathematics",
      "MS Statistics"
    ],
    "seniority": "mid",
    "domain": "research",
    "experiences": [
      {
        "title": "Project/Position 1",
        "duration_years": 2.0,
        "skills_used": [
          "CI/CD",
          "Peer Review",
          "Experiment Design"
        ],
        "description": "Worked on CI/CD, Peer Review and related technologies"
      },
      {
        "title": "Project/Position 2",
        "duration_years": 1.3,
        "skills_used": [
          "SPSS",
          "CI/CD",
          "Peer Review",
          "Kubernetes",
          "Experiment Design"
        ],
        "description": "Worked on SPSS, CI/CD and related technologies"
      },
      {
        "title": "Project/Position 3",
        "duration_years": 0.8,
        "skills_used": [
          "Peer Review",
          "Experiment Design",
          "Data Collection",
          "Rust",
          "SPSS"
        ],
        "description": "Worked on Peer Review, Experiment Design and related technologies"
      },
      {
        "title": "Project/Position 4",
        "duration_years": 2.4,
        "skills_used": [
          "Data Collection",
          "CI/CD",
          "Literature Review"
        ],
        "description": "Worked on Data Collection, CI/CD and related technologies"
      }
    ],
    "raw_text": "CV ID: CV_025\n\nPROFESSIONAL SUMMARY:\nMid professional with 8 years of experience in research. \nExpertise in Literature Review, SPSS, Data Collection and related technologies.\n\nEDUCATION:\n- BS Mathematics\n- MS Statistics\n\nSKILLS:\nLiterature Review, SPSS, Data Collection, Survey Design, Peer Review, Experiment Design, CI/CD, Rust, Kubernetes\n\nEXPERIENCE:\n\n- Project/Position 1 (2.0 years)\n  Skills: CI/CD, Peer Review, Experiment Design\n  Worked on CI/CD, Peer Review and related technologies\n\n- Project/Position 2 (1.3 years)\n  Skills: SPSS, CI/CD, Peer Review, Kubernetes, Experiment Design\n  Worked on SPSS, CI/CD and related technologies\n\n- Project/Position 3 (0.8 years)\n  Skills: Peer Review, Experiment Design, Data Collection, Rust, SPSS\n  Worked on Peer Review, Experiment Design and related technologies\n\n- Project/Position 4 (2.4 years)\n  Skills: Data Collection, CI/CD, Literature Review\n  Worked on Data Collection, CI/CD and related technologies\n"
  },
  {
    "cv_id": "CV_026",
    "skills": [
      "Scikit-learn",
      "Machine Learning",
      "Git",
      "React",
      "CI/CD",
      "ERP",
      "Forecasting"
    ],
    "experience_years": 6,
    "education": [
      "BS Engineering",
      "MS Computer Science"
    ],
    "seniority": "mid",
    "domain": "tech",
    "experiences": [
      {
        "title": "Project/Position 1",
        "duration_years": 2.3,
        "skills_used": [
          "React",
          "Git",
          "Scikit-learn"
        ],
        "description": "Worked on React, Git and related technologies"
      },
      {
        "title": "Project/Position 2",
        "duration_years": 2.9,
        "skills_used": [
          "CI/CD",
          "Git",
          "Scikit-learn"
        ],
        "description": "Worked on CI/CD, Git and related technologies"
      },
      {
        "title": "Project/Position 3",
        "duration_years": 0.8,
        "skills_used": [
          "ERP",
          "Forecasting",
          "Machine Learning",
          "React"
        ],
        "description": "Worked on ERP, Forecasting and related technologies"
      }
    ],
    "raw_text": "CV ID: CV_026\n\nPROFESSIONAL SUMMARY:\nMid professional with 6 years of experience in tech. \nExpertise in Scikit-learn, Machine Learning, Git and related technologies.\n\nEDUCATION:\n- BS Engineering\n- MS Computer Science\n\nSKILLS:\nScikit-learn, Machine Learning, Git, React, CI/CD, ERP, Forecasting\n\nEXPERIENCE:\n\n- Project/Position 1 (2.3 years)\n  Skills: React, Git, Scikit-learn\n  Worked on React, Git and related technologies\n\n- Project/Position 2 (2.9 years)\n  Skills: CI/CD, Git, Scikit-learn\n  Worked on CI/CD, Git and related technologies\n\n- Project/Position 3 (0.8 years)\n  Skills: ERP, Forecasting, Machine Learning, React\n  Worked on ERP, Forecasting and related technologies\n"
  },
  {
    "cv_id": "CV_027",
    "skills": [
      "Grant Writing",
      "Publication",
      "Regression Analysis",
      "Academic Writing",
      "Research Design",
      "Python",
      "GraphQL",
      "Scikit-learn",
      "C++"
    ],
    "experience_years": 9,
    "education": [
      "BS Computer Science",
      "MS Data Science"
    ],
    "seniority": "mid",
    "domain": "research",
    "experiences": [
      {
        "title": "Project/Position 1",
        "duration_years": 1.9,
        "skills_used": [
          "C++",
          "Publication",
          "Scikit-learn",
          "Grant Writing"
        ],
        "description": "Worked on C++, Publication and related technologies"
      },
      {
        "title": "Project/Position 2",
        "duration_years": 1.6,
        "skills_used": [
          "Regression Analysis",
          "Research Design",
          "Scikit-learn",
          "Python",
          "C++"
        ],
        "description": "Worked on Regression Analysis, Research Design and related technologies"
      },
      {
        "title": "Project/Position 3",
        "duration_years": 1.3,
        "skills_used": [
          "Scikit-learn",
          "Research Design",
          "GraphQL",
          "C++",
          "Academic Writing"
        ],
        "description": "Worked on Scikit-learn, Research Design and related technologies"
      },
      {
        "title": "Project/Position 4",
        "duration_years": 2.9,
        "skills_used": [
          "Python",
          "Publication"
        ],
        "description": "Worked on Python, Publication and related technologies"
      }
    ],
    "raw_text": "CV ID: CV_027\n\nPROFESSIONAL SUMMARY:\nMid professional with 9 years of experience in research. \nExpertise in Grant Writing, Publication, Regression Analysis and related technologies.\n\nEDUCATION:\n- BS Computer Science\n- MS Data Science\n\nSKILLS:\nGrant Writing, Publication, Regression Analysis, Academic Writing, Research Design, Python, GraphQL, Scikit-learn, C++\n\nEXPERIENCE:\n\n- Project/Position 1 (1.9 years)\n  Skills: C++, Publication, Scikit-learn, Grant Writing\n  Worked on C++, Publication and related technologies\n\n- Project/Position 2 (1.6 years)\n  Skills: Regression Analysis, Research Design, Scikit-learn, Python, C++\n  Worked on Regression Analysis, Research Design and related technologies\n\n- Project/Position 3 (1.3 years)\n  Skills: Scikit-learn, Research Design, GraphQL, C++, Academic Writing\n  Worked on Scikit-learn, Research Design and related technologies\n\n- Project/Position 4 (2.9 years)\n  Skills: Python, Publication\n  Worked on Python, Publication and related technologies\n"
  },
  {
    "cv_id": "CV_028",
    "skills": [
      "Strategic Planning",
      "Sales",
      "Customer Relations",
      "Forecasting",
      "Process Improvement",
      "Risk Management",
      "Python",
      "TensorFlow",
      "PyTorch"
    ],
    "experience_years": 6,
    "education": [
      "BS Engineering",
      "MS Computer Science"
    ],
    "seniority": "mid",
    "domain": "business",
    "experiences": [
      {
        "title": "Project/Position 1",
        "duration_years": 2.8,
        "skills_used": [
          "Python",
          "Forecasting"
        ],
        "description": "Worked on Python, Forecasting and related technologies"
      },
      {
        "title": "Project/Position 2",
        "duration_years": 1.9,
        "skills_used": [
          "Risk Management",
          "TensorFlow",
          "Strategic Planning"
        ],
        "description": "Worked on Risk Management, TensorFlow and related technologies"
      },
      {
        "title": "Project/Position 3",
        "duration_years": 0.9,
        "skills_used": [
          "Forecasting",
          "Risk Management",
          "TensorFlow"
        ],
        "description": "Worked on Forecasting, Risk Management and related technologies"
      }
    ],
    "raw_text": "CV ID: CV_028\n\nPROFESSIONAL SUMMARY:\nMid professional with 6 years of experience in business. \nExpertise in Strategic Planning, Sales, Customer Relations and related technologies.\n\nEDUCATION:\n- BS Engineering\n- MS Computer Science\n\nSKILLS:\nStrategic Planning, Sales, Customer Relations, Forecasting, Process Improvement, Risk Management, Python, TensorFlow, PyTorch\n\nEXPERIENCE:\n\n- Project/Position 1 (2.8 years)\n  Skills: Python, Forecasting\n  Worked on Python, Forecasting and related technologies\n\n- Project/Position 2 (1.9 years)\n  Skills: Risk Management, TensorFlow, Strategic Planning\n  Worked on Risk Management, TensorFlow and related technologies\n\n- Project/Position 3 (0.9 years)\n  Skills: Forecasting, Risk Management, TensorFlow\n  Worked on Forecasting, Risk Management and related technologies\n"
  },
  {
    "cv_id": "CV_029",
    "skills": [
      "Node.js",
      "Git",
      "REST APIs",
      "React",
      "PostgreSQL",
      "Leadership",
      "Power BI"
    ],
    "experience_years": 5,
    "education": [
      "BS Computer Science",
      "MS Data Science"
    ],
    "seniority": "mid",
    "domain": "tech",
    "experiences": [
      {
        "title": "Project/Position 1",
        "duration_years": 2.3,
        "skills_used": [
          "Power BI",
          "Node.js",
          "PostgreSQL",
          "Leadership",
          "Git"
        ],
        "description": "Worked on Power BI, Node.js and related technologies"
      },
      {
        "title": "Project/Position 2",
        "duration_years": 2.9,
        "skills_used": [
          "PostgreSQL",
          "Node.js",
          "Power BI",
          "Git"
        ],
        "description": "Worked on PostgreSQL, Node.js and related technologies"
      }
    ],
    "raw_text": "CV ID: CV_029\n\nPROFESSIONAL SUMMARY:\nMid professional with 5 years of experience in tech. \nExpertise in Node.js, Git, REST APIs and related technologies.\n\nEDUCATION:\n- BS Computer Science\n- MS Data Science\n\nSKILLS:\nNode.js, Git, REST APIs, React, PostgreSQL, Leadership, Power BI\n\nEXPERIENCE:\n\n- Project/Position 1 (2.3 years)\n  Skills: Power BI, Node.js, PostgreSQL, Leadership, Git\n  Worked on Power BI, Node.js and related technologies\n\n- Project/Position 2 (2.9 years)\n  Skills: PostgreSQL, Node.js, Power BI, Git\n  Worked on PostgreSQL, Node.js and related technologies\n"
  },
  {
    "cv_id": "CV_030",
    "skills": [
      "Experiment Design",
      "Statistical Analysis",
      "Academic Writing",
      "Grant Writing",
      "LaTeX",
      "AWS",
      "PyTorch"
    ],
    "experience_years": 3,
    "education": [
      "BS Information Technology"
    ],
    "seniority": "junior",
    "domain": "research",
    "experiences": [
      {
        "title": "Project/Position 1",
        "duration_years": 1.4,
        "skills_used": [
          "Experiment Design",
          "LaTeX"
        ],
        "description": "Worked on Experiment Design, LaTeX and related technologies"
      },
      {
        "title": "Project/Position 2",
        "duration_years": 1.3,
        "skills_used": [
          "AWS",
          "Academic Writing",
          "Experiment Design",
          "Statistical Analysis"
        ],
        "description": "Worked on AWS, Academic Writing and related technologies"
      }
    ],
    "raw_text": "CV ID: CV_030\n\nPROFESSIONAL SUMMARY:\nJunior professional with 3 years of experience in research. \nExpertise in Experiment Design, Statistical Analysis, Academic Writing and related technologies.\n\nEDUCATION:\n- BS Information Technology\n\nSKILLS:\nExperiment Design, Statistical Analysis, Academic Writing, Grant Writing, LaTeX, AWS, PyTorch\n\nEXPERIENCE:\n\n- Project/Position 1 (1.4 years)\n  Skills: Experiment Design, LaTeX\n  Worked on Experiment Design, LaTeX and related technologies\n\n- Project/Position 2 (1.3 years)\n  Skills: AWS, Academic Writing, Experiment Design, Statistical Analysis\n  Worked on AWS, Academic Writing and related technologies\n"
  },
  {
    "cv_id": "CV_031",
    "skills": [
      "Computer Vision",
      "REST APIs",
      "CI/CD",
      "Flask",
      "Business Analysis",
      "Power BI"
    ],
    "experience_years": 1,
    "education": [
      "BS Data Science"
    ],
    "seniority": "junior",
    "domain": "tech",
    "experiences": [
      {
        "title": "Project/Position 1",
        "duration_years": 1.5,
        "skills_used": [
          "Flask",
          "Power BI",
          "Computer Vision",
          "CI/CD",
          "REST APIs"
        ],
        "description": "Worked on Flask, Power BI and related technologies"
      },
      {
        "title": "Project/Position 2",
        "duration_years": 2.1,
        "skills_used": [
          "Power BI",
          "Business Analysis",
          "CI/CD"
        ],
        "description": "Worked on Power BI, Business Analysis and related technologies"
      }
    ],
    "raw_text": "CV ID: CV_031\n\nPROFESSIONAL SUMMARY:\nJunior professional with 1 years of experience in tech. \nExpertise in Computer Vision, REST APIs, CI/CD and related technologies.\n\nEDUCATION:\n- BS Data Science\n\nSKILLS:\nComputer Vision, REST APIs, CI/CD, Flask, Business Analysis, Power BI\n\nEXPERIENCE:\n\n- Project/Position 1 (1.5 years)\n  Skills: Flask, Power BI, Computer Vision, CI/CD, REST APIs\n  Worked on Flask, Power BI and related technologies\n\n- Project/Position 2 (2.1 years)\n  Skills: Power BI, Business Analysis, CI/CD\n  Worked on Power BI, Business Analysis and related technologies\n"
  },
  {
    "cv_id": "CV_032",
    "skills": [
      "Java",
      "Go",
      "Machine Learning",
      "Flask",
      "SQL",
      "Leadership",
      "Power BI"
    ],
    "experience_years": 2,
    "education": [
      "BS Data Science"
    ],
    "seniority": "junior",
    "domain": "tech",
    "experiences": [
      {
        "title": "Project/Position 1",
        "duration_years": 0.5,
        "skills_used": [
          "Go",
          "Flask",
          "Leadership"
        ],
        "description": "Worked on Go, Flask and related technologies"
      },
      {
        "title": "Project/Position 2",
        "duration_years": 2.9,
        "skills_used": [
          "Power BI",
          "Java",
          "Go",
          "Leadership",
          "SQL"
        ],
        "description": "Worked on Power BI, Java and related technologies"
      }
    ],
    "raw_text": "CV ID: CV_032\n\nPROFESSIONAL SUMMARY:\nJunior professional with 2 years of experience in tech. \nExpertise in Java, Go, Machine Learning and related technologies.\n\nEDUCATION:\n- BS Data Science\n\nSKILLS:\nJava, Go, Machine Learning, Flask, SQL, Leadership, Power BI\n\nEXPERIENCE:\n\n- Project/Position 1 (0.5 years)\n  Skills: Go, Flask, Leadership\n  Worked on Go, Flask and related technologies\n\n- Project/Position 2 (2.9 years)\n  Skills: Power BI, Java, Go, Leadership, SQL\n  Worked on Power BI, Java and related technologies\n"
  },
  {
    "cv_id": "CV_033",
    "skills": [
      "Hypothesis Testing",
      "Peer Review",
      "Experiment Design",
      "Survey Design",
      "REST APIs",
      "Scikit-learn"
    ],
    "experience_years": 2,
    "education": [
      "BS Engineering"
    ],
    "seniority": "junior",
    "domain": "research",
    "experiences": [
      {
        "title": "Project/Position 1",
        "duration_years": 2.4,
        "skills_used": [
          "REST APIs",
          "Peer Review",
          "Scikit-learn",
          "Hypothesis Testing",
          "Survey Design"
        ],
        "description": "Worked on REST APIs, Peer Review and related technologies"
      },
      {
        "title": "Project/Position 2",
        "duration_years": 2.3,
        "skills_used": [
          "Hypothesis Testing",
          "Survey Design",
          "Scikit-learn",
          "Peer Review",
          "Experiment Design"
        ],
        "description": "Worked on Hypothesis Testing, Survey Design and related technologies"
      }
    ],
    "raw_text": "CV ID: CV_033\n\nPROFESSIONAL SUMMARY:\nJunior professional with 2 years of experience in research. \nExpertise in Hypothesis Testing, Peer Review, Experiment Design and related technologies.\n\nEDUCATION:\n- BS Engineering\n\nSKILLS:\nHypothesis Testing, Peer Review, Experiment Design, Survey Design, REST APIs, Scikit-learn\n\nEXPERIENCE:\n\n- Project/Position 1 (2.4 years)\n  Skills: REST APIs, Peer Review, Scikit-learn, Hypothesis Testing, Survey Design\n  Worked on REST APIs, Peer Review and related technologies\n\n- Project/Position 2 (2.3 years)\n  Skills: Hypothesis Testing, Survey Design, Scikit-learn, Peer Review, Experiment Design\n  Worked on Hypothesis Testing, Survey Design and related technologies\n"
  },
  {
    "cv_id": "CV_034",
    "skills": [
      "Grant Writing",
      "Python",
      "Publication",
      "LaTeX",
      "Academic Writing",
      "Peer Review",
      "Experiment Design",
      "CI/CD",
      "Flask"
    ],
    "experience_years": 4,
    "education": [
      "BS Physics",
      "MS Machine Learning"
    ],
    "seniority": "mid",
    "domain": "research",
    "experiences": [
      {
        "title": "Project/Position 1",
        "duration_years": 2.4,
        "skills_used": [
          "Flask",
          "Peer Review"
        ],
        "description": "Worked on Flask, Peer Review and related technologies"
      },
      {
        "title": "Project/Position 2",
        "duration_years": 1.7,
        "skills_used": [
          "Academic Writing",
          "CI/CD",
          "Experiment Design",
          "Flask",
          "Python"
        ],
        "description": "Worked on Academic Writing, CI/CD and related technologies"
      }
    ],
    "raw_text": "CV ID: CV_034\n\nPROFESSIONAL SUMMARY:\nMid professional with 4 years of experience in research. \nExpertise in Grant Writing, Python, Publication and related technologies.\n\nEDUCATION:\n- BS Physics\n- MS Machine Learning\n\nSKILLS:\nGrant Writing, Python, Publication, LaTeX, Academic Writing, Peer Review, Experiment Design, CI/CD, Flask\n\nEXPERIENCE:\n\n- Project/Position 1 (2.4 years)\n  Skills: Flask, Peer Review\n  Worked on Flask, Peer Review and related technologies\n\n- Project/Position 2 (1.7 years)\n  Skills: Academic Writing, CI/CD, Experiment Design, Flask, Python\n  Worked on Academic Writing, CI/CD and related technologies\n"
  },
  {
    "cv_id": "CV_035",
    "skills": [
      "React",
      "Data Analysis",
      "GraphQL",
      "C++",
      "PyTorch",
      "Financial Analysis",
      "ERP"
    ],
    "experience_years": 5,
    "education": [
      "BS Computer Science",
      "MS Data Science"
    ],
    "seniority": "mid",
    "domain": "tech",
    "experiences": [
      {
        "title": "Project/Position 1",
        "duration_years": 2.5,
        "skills_used": [
          "PyTorch",
          "C++"
        ],
        "description": "Worked on PyTorch, C++ and related technologies"
      },
      {
        "title": "Project/Position 2",
        "duration_years": 2.1,
        "skills_used": [
          "Financial Analysis",
          "GraphQL",
          "PyTorch",
          "C++"
        ],
        "description": "Worked on Financial Analysis, GraphQL and related technologies"
      }
    ],
    "raw_text": "CV ID: CV_035\n\nPROFESSIONAL SUMMARY:\nMid professional with 5 years of experience in tech. \nExpertise in React, Data Analysis, GraphQL and related technologies.\n\nEDUCATION:\n- BS Computer Science\n- MS Data Science\n\nSKILLS:\nReact, Data Analysis, GraphQL, C++, PyTorch, Financial Analysis, ERP\n\nEXPERIENCE:\n\n- Project/Position 1 (2.5 years)\n  Skills: PyTorch, C++\n  Worked on PyTorch, C++ and related technologies\n\n- Project/Position 2 (2.1 years)\n  Skills: Financial Analysis, GraphQL, PyTorch, C++\n  Worked on Financial Analysis, GraphQL and related technologies\n"
  },
  {
    "cv_id": "CV_036",
    "skills": [
      "Quantitative Research",
      "Regression Analysis",
      "Grant Writing",
      "Statistical Analysis",
      "Hypothesis Testing",
      "Peer Review",
      "R",
      "AWS",
      "Docker",
      "PostgreSQL"
    ],
    "experience_years": 12,
    "education": [
      "BS Mathematics",
      "MS Statistics",
      "PhD Statistics"
    ],
    "seniority": "senior",
    "domain": "research",
    "experiences": [
      {
        "title": "Project/Position 1",
        "duration_years": 1.3,
        "skills_used": [
          "Grant Writing",
          "Quantitative Research"
        ],
        "description": "Worked on Grant Writing, Quantitative Research and related technologies"
      },
      {
        "title": "Project/Position 2",
        "duration_years": 1.4,
        "skills_used": [
          "AWS",
          "Hypothesis Testing"
        ],
        "description": "Worked on AWS, Hypothesis Testing and related technologies"
      },
      {
        "title": "Project/Position 3",
        "duration_years": 1.9,
        "skills_used": [
          "PostgreSQL",
          "Grant Writing",
          "Statistical Analysis",
          "Hypothesis Testing",
          "AWS"
        ],
        "description": "Worked on PostgreSQL, Grant Writing and related technologies"
      },
      {
        "title": "Project/Position 4",
        "duration_years": 0.7,
        "skills_used": [
          "R",
          "Grant Writing",
          "PostgreSQL"
        ],
        "description": "Worked on R, Grant Writing and related technologies"
      },
      {
        "title": "Project/Position 5",
        "duration_years": 1.1,
        "skills_used": [
          "Peer Review",
          "Statistical Analysis",
          "Docker",
          "Hypothesis Testing",
          "Regression Analysis"
        ],
        "description": "Worked on Peer Review, Statistical Analysis and related technologies"
      },
      {
        "title": "Project/Position 6",
        "duration_years": 0.5,
        "skills_used": [
          "Quantitative Research",
          "Docker",
          "Peer Review",
          "R"
        ],
        "description": "Worked on Quantitative Research, Docker and related technologies"
      }
    ],
    "raw_text": "CV ID: CV_036\n\nPROFESSIONAL SUMMARY:\nSenior professional with 12 years of experience in research. \nExpertise in Quantitative Research, Regression Analysis, Grant Writing and related technologies.\n\nEDUCATION:\n- BS Mathematics\n- MS Statistics\n- PhD Statistics\n\nSKILLS:\nQuantitative Research, Regression Analysis, Grant Writing, Statistical Analysis, Hypothesis Testing, Peer Review, R, AWS, Docker, PostgreSQL\n\nEXPERIENCE:\n\n- Project/Position 1 (1.3 years)\n  Skills: Grant Writing, Quantitative Research\n  Worked on Grant Writing, Quantitative Research and related technologies\n\n- Project/Position 2 (1.4 years)\n  Skills: AWS, Hypothesis Testing\n  Worked on AWS, Hypothesis Testing and related technologies\n\n- Project/Position 3 (1.9 years)\n  Skills: PostgreSQL, Grant Writing, Statistical Analysis, Hypothesis Testing, AWS\n  Worked on PostgreSQL, Grant Writing and related technologies\n\n- Project/Position 4 (0.7 years)\n  Skills: R, Grant Writing, PostgreSQL\n  Worked on R, Grant Writing and related technologies\n\n- Project/Position 5 (1.1 years)\n  Skills: Peer Review, Statistical Analysis, Docker, Hypothesis Testing, Regression Analysis\n  Worked on Peer Review, Statistical Analysis and related technologies\n\n- Project/Position 6 (0.5 years)\n  Skills: Quantitative Research, Docker, Peer Review, R\n  Worked on Quantitative Research, Docker and related technologies\n"
  },
  {
    "cv_id": "CV_037",
    "skills": [
      "Sales",
      "Strategic Planning",
      "Power BI",
      "Excel",
      "React",
      "Deep Learning"
    ],
    "experience_years": 1,
    "education": [
      "BS Data Science"
    ],
    "seniority": "junior",
    "domain": "business",
    "experiences": [
      {
        "title": "Project/Position 1",
        "duration_years": 0.8,
        "skills_used": [
          "Sales",
          "React",
          "Deep Learning"
        ],
        "description": "Worked on Sales, React and related technologies"
      },
      {
        "title": "Project/Position 2",
        "duration_years": 3.0,
        "skills_used": [
          "React",
          "Deep Learning",
          "Power BI",
          "Excel",
          "Strategic Planning"
        ],
        "description": "Worked on React, Deep Learning and related technologies"
      }
    ],
    "raw_text": "CV ID: CV_037\n\nPROFESSIONAL SUMMARY:\nJunior professional with 1 years of experience in business. \nExpertise in Sales, Strategic Planning, Power BI and related technologies.\n\nEDUCATION:\n- BS Data Science\n\nSKILLS:\nSales, Strategic Planning, Power BI, Excel, React, Deep Learning\n\nEXPERIENCE:\n\n- Project/Position 1 (0.8 years)\n  Skills: Sales, React, Deep Learning\n  Worked on Sales, React and related technologies\n\n- Project/Position 2 (3.0 years)\n  Skills: React, Deep Learning, Power BI, Excel, Strategic Planning\n  Worked on React, Deep Learning and related technologies\n"
  },
  {
    "cv_id": "CV_038",
    "skills": [
      "Docker",
      "Computer Vision",
      "Machine Learning",
      "Python",
      "React",
      "Business Analysis",
      "Forecasting"
    ],
    "experience_years": 5,
    "education": [
      "BS Mathematics",
      "MS Statistics"
    ],
    "seniority": "mid",
    "domain": "tech",
    "experiences": [
      {
        "title": "Project/Position 1",
        "duration_years": 2.1,
        "skills_used": [
          "Docker",
          "Forecasting",
          "Machine Learning"
        ],
        "description": "Worked on Docker, Forecasting and related technologies"
      },
      {
        "title": "Project/Position 2",
        "duration_years": 2.8,
        "skills_used": [
          "Forecasting",
          "Business Analysis",
          "Docker"
        ],
        "description": "Worked on Forecasting, Business Analysis and related technologies"
      }
    ],
    "raw_text": "CV ID: CV_038\n\nPROFESSIONAL SUMMARY:\nMid professional with 5 years of experience in tech. \nExpertise in Docker, Computer Vision, Machine Learning and related technologies.\n\nEDUCATION:\n- BS Mathematics\n- MS Statistics\n\nSKILLS:\nDocker, Computer Vision, Machine Learning, Python, React, Business Analysis, Forecasting\n\nEXPERIENCE:\n\n- Project/Position 1 (2.1 years)\n  Skills: Docker, Forecasting, Machine Learning\n  Worked on Docker, Forecasting and related technologies\n\n- Project/Position 2 (2.8 years)\n  Skills: Forecasting, Business Analysis, Docker\n  Worked on Forecasting, Business Analysis and related technologies\n"
  },
  {
    "cv_id": "CV_039",
    "skills": [
      "Business Analysis",
      "Budgeting",
      "Excel",
      "Market Research",
      "Strategic Planning",
      "Leadership",
      "Data Analysis",
      "Git"
    ],
    "experience_years": 6,
    "education": [
      "BS Computer Science",
      "MS Data Science"
    ],
    "seniority": "mid",
    "domain": "business",
    "experiences": [
      {
        "title": "Project/Position 1",
        "duration_years": 2.9,
        "skills_used": [
          "Business Analysis",
          "Market Research",
          "Strategic Planning"
        ],
        "description": "Worked on Business Analysis, Market Research and related technologies"
      },
      {
        "title": "Project/Position 2",
        "duration_years": 1.7,
        "skills_used": [
          "Strategic Planning",
          "Data Analysis",
          "Excel",
          "Business Analysis"
        ],
        "description": "Worked on Strategic Planning, Data Analysis and related technologies"
      },
      {
        "title": "Project/Position 3",
        "duration_years": 2.4,
        "skills_used": [
          "Market Research",
          "Budgeting"
        ],
        "description": "Worked on Market Research, Budgeting and related technologies"
      }
    ],
    "raw_text": "CV ID: CV_039\n\nPROFESSIONAL SUMMARY:\nMid professional with 6 years of experience in business. \nExpertise in Business Analysis, Budgeting, Excel and related technologies.\n\nEDUCATION:\n- BS Computer Science\n- MS Data Science\n\nSKILLS:\nBusiness Analysis, Budgeting, Excel, Market Research, Strategic Planning, Leadership, Data Analysis, Git\n\nEXPERIENCE:\n\n- Project/Position 1 (2.9 years)\n  Skills: Business Analysis, Market Research, Strategic Planning\n  Worked on Business Analysis, Market Research and related technologies\n\n- Project/Position 2 (1.7 years)\n  Skills: Strategic Planning, Data Analysis, Excel, Business Analysis\n  Worked on Strategic Planning, Data Analysis and related technologies\n\n- Project/Position 3 (2.4 years)\n  Skills: Market Research, Budgeting\n  Worked on Market Research, Budgeting and related technologies\n"
  },
  {
    "cv_id": "CV_040",
    "skills": [
      "Computer Vision",
      "GraphQL",
      "Agile",
      "Flask",
      "NLP",
      "JavaScript",
      "PostgreSQL",
      "Project Management",
      "Negotiation",
      "Risk Management"
    ],
    "experience_years": 6,
    "education": [
      "BS Engineering",
      "MS Engineering",
      "MBA"
    ],
    "seniority": "senior",
    "domain": "tech",
    "experiences": [
      {
        "title": "Project/Position 1",
        "duration_years": 1.7,
        "skills_used": [
          "Computer Vision",
          "NLP"
        ],
        "description": "Worked on Computer Vision, NLP and related technologies"
      },
      {
        "title": "Project/Position 2",
        "duration_years": 2.6,
        "skills_used": [
          "Risk Management",
          "Flask",
          "GraphQL",
          "JavaScript"
        ],
        "description": "Worked on Risk Management, Flask and related technologies"
      },
      {
        "title": "Project/Position 3",
        "duration_years": 0.6,
        "skills_used": [
          "NLP",
          "Project Management",
          "GraphQL",
          "Negotiation"
        ],
        "description": "Worked on NLP, Project Management and related technologies"
      }
    ],
    "raw_text": "CV ID: CV_040\n\nPROFESSIONAL SUMMARY:\nSenior professional with 6 years of experience in tech. \nExpertise in Computer Vision, GraphQL, Agile and related technologies.\n\nEDUCATION:\n- BS Engineering\n- MS Engineering\n- MBA\n\nSKILLS:\nComputer Vision, GraphQL, Agile, Flask, NLP, JavaScript, PostgreSQL, Project Management, Negotiation, Risk Management\n\nEXPERIENCE:\n\n- Project/Position 1 (1.7 years)\n  Skills: Computer Vision, NLP\n  Worked on Computer Vision, NLP and related technologies\n\n- Project/Position 2 (2.6 years)\n  Skills: Risk Management, Flask, GraphQL, JavaScript\n  Worked on Risk Management, Flask and related technologies\n\n- Project/Position 3 (0.6 years)\n  Skills: NLP, Project Management, GraphQL, Negotiation\n  Worked on NLP, Project Management and related technologies\n"
  },
  {
    "cv_id": "CV_041",
    "skills": [
      "C++",
      "Rust",
      "MongoDB",
      "Flask",
      "Market Research",
      "PowerPoint"
    ],
    "experience_years": 1,
    "education": [
      "BS Computer Science"
    ],
    "seniority": "junior",
    "domain": "tech",
    "experiences": [
      {
        "title": "Project/Position 1",
        "duration_years": 2.8,
        "skills_used": [
          "Rust",
          "C++",
          "Market Research",
          "Flask",
          "MongoDB"
        ],
        "description": "Worked on Rust, C++ and related technologies"
      },
      {
        "title": "Project/Position 2",
        "duration_years": 1.6,
        "skills_used": [
          "C++",
          "Rust",
          "Flask",
          "PowerPoint"
        ],
        "description": "Worked on C++, Rust and related technologies"
      }
    ],
    "raw_text": "CV ID: CV_041\n\nPROFESSIONAL SUMMARY:\nJunior professional with 1 years of experience in tech. \nExpertise in C++, Rust, MongoDB and related technologies.\n\nEDUCATION:\n- BS Computer Science\n\nSKILLS:\nC++, Rust, MongoDB, Flask, Market Research, PowerPoint\n\nEXPERIENCE:\n\n- Project/Position 1 (2.8 years)\n  Skills: Rust, C++, Market Research, Flask, MongoDB\n  Worked on Rust, C++ and related technologies\n\n- Project/Position 2 (1.6 years)\n  Skills: C++, Rust, Flask, PowerPoint\n  Worked on C++, Rust and related technologies\n"
  },
  {
    "cv_id": "CV_042",
    "skills": [
      "Excel",
      "Risk Management",
      "Process Improvement",
      "Business Analysis",
      "PowerPoint",
      "Machine Learning",
      "Go",
      "C++"
    ],
    "experience_years": 5,
    "education": [
      "BS Engineering",
      "MS Computer Science"
    ],
    "seniority": "mid",
    "domain": "business",
    "experiences": [
      {
        "title": "Project/Position 1",
        "duration_years": 1.0,
        "skills_used": [
          "Process Improvement",
          "Risk Management",
          "Machine Learning"
        ],
        "description": "Worked on Process Improvement, Risk Management and related technologies"
      },
      {
        "title": "Project/Position 2",
        "duration_years": 2.5,
        "skills_used": [
          "PowerPoint",
          "Machine Learning",
          "Risk Management"
        ],
        "description": "Worked on PowerPoint, Machine Learning and related technologies"
      }
    ],
    "raw_text": "CV ID: CV_042\n\nPROFESSIONAL SUMMARY:\nMid professional with 5 years of experience in business. \nExpertise in Excel, Risk Management, Process Improvement and related technologies.\n\nEDUCATION:\n- BS Engineering\n- MS Computer Science\n\nSKILLS:\nExcel, Risk Management, Process Improvement, Business Analysis, PowerPoint, Machine Learning, Go, C++\n\nEXPERIENCE:\n\n- Project/Position 1 (1.0 years)\n  Skills: Process Improvement, Risk Management, Machine Learning\n  Worked on Process Improvement, Risk Management and related technologies\n\n- Project/Position 2 (2.5 years)\n  Skills: PowerPoint, Machine Learning, Risk Management\n  Worked on PowerPoint, Machine Learning and related technologies\n"
  },
  {
    "cv_id": "CV_043",
    "skills": [
      "Agile",
      "MongoDB",
      "Node.js",
      "Python",
      "Machine Learning",
      "SQL",
      "Market Research",
      "Risk Management"
    ],
    "experience_years": 6,
    "education": [
      "BS Engineering",
      "MS Computer Science"
    ],
    "seniority": "mid",
    "domain": "tech",
    "experiences": [
      {
        "title": "Project/Position 1",
        "duration_years": 1.3,
        "skills_used": [
          "SQL",
          "Risk Management",
          "MongoDB",
          "Machine Learning"
        ],
        "description": "Worked on SQL, Risk Management and related technologies"
      },
      {
        "title": "Project/Position 2",
        "duration_years": 0.8,
        "skills_used": [
          "Node.js",
          "Python",
          "Agile"
        ],
        "description": "Worked on Node.js, Python and related technologies"
      },
      {
        "title": "Project/Position 3",
        "duration_years": 1.6,
        "skills_used": [
          "Python",
          "SQL",
          "Agile",
          "Market Research",
          "Machine Learning"
        ],
        "description": "Worked on Python, SQL and related technologies"
      }
    ],
    "raw_text": "CV ID: CV_043\n\nPROFESSIONAL SUMMARY:\nMid professional with 6 years of experience in tech. \nExpertise in Agile, MongoDB, Node.js and related technologies.\n\nEDUCATION:\n- BS Engineering\n- MS Computer Science\n\nSKILLS:\nAgile, MongoDB, Node.js, Python, Machine Learning, SQL, Market Research, Risk Management\n\nEXPERIENCE:\n\n- Project/Position 1 (1.3 years)\n  Skills: SQL, Risk Management, MongoDB, Machine Learning\n  Worked on SQL, Risk Management and related technologies\n\n- Project/Position 2 (0.8 years)\n  Skills: Node.js, Python, Agile\n  Worked on Node.js, Python and related technologies\n\n- Project/Position 3 (1.6 years)\n  Skills: Python, SQL, Agile, Market Research, Machine Learning\n  Worked on Python, SQL and related technologies\n"
  },
  {
    "cv_id": "CV_044",
    "skills": [
      "Publication",
      "Peer Review",
      "Data Collection",
      "Statistical Analysis",
      "Qualitative Research",
      "Agile",
      "PostgreSQL"
    ],
    "experience_years": 3,
    "education": [
      "BS Mathematics"
    ],
    "seniority": "junior",
    "domain": "research",
    "experiences": [
      {
        "title": "Project/Position 1",
        "duration_years": 2.6,
        "skills_used": [
          "Statistical Analysis",
          "Qualitative Research"
        ],
        "description": "Worked on Statistical Analysis, Qualitative Research and related technologies"
      },
      {
        "title": "Project/Position 2",
        "duration_years": 2.8,
        "skills_used": [
          "Publication",
          "PostgreSQL",
          "Peer Review",
          "Qualitative Research",
          "Statistical Analysis"
        ],
        "description": "Worked on Publication, PostgreSQL and related technologies"
      }
    ],
    "raw_text": "CV ID: CV_044\n\nPROFESSIONAL SUMMARY:\nJunior professional with 3 years of experience in research. \nExpertise in Publication, Peer Review, Data Collection and related technologies.\n\nEDUCATION:\n- BS Mathematics\n\nSKILLS:\nPublication, Peer Review, Data Collection, Statistical Analysis, Qualitative Research, Agile, PostgreSQL\n\nEXPERIENCE:\n\n- Project/Position 1 (2.6 years)\n  Skills: Statistical Analysis, Qualitative Research\n  Worked on Statistical Analysis, Qualitative Research and related technologies\n\n- Project/Position 2 (2.8 years)\n  Skills: Publication, PostgreSQL, Peer Review, Qualitative Research, Statistical Analysis\n  Worked on Publication, PostgreSQL and related technologies\n"
  },
  {
    "cv_id": "CV_045",
    "skills": [
      "SQL",
      "JavaScript",
      "Machine Learning",
      "Node.js",
      "AWS",
      "Budgeting",
      "Risk Management"
    ],
    "experience_years": 7,
    "education": [
      "BS Computer Science",
      "MS Data Science"
    ],
    "seniority": "mid",
    "domain": "tech",
    "experiences": [
      {
        "title": "Project/Position 1",
        "duration_years": 0.8,
        "skills_used": [
          "SQL",
          "Risk Management"
        ],
        "description": "Worked on SQL, Risk Management and related technologies"
      },
      {
        "title": "Project/Position 2",
        "duration_years": 2.7,
        "skills_used": [
          "AWS",
          "Node.js",
          "Risk Management"
        ],
        "description": "Worked on AWS, Node.js and related technologies"
      },
      {
        "title": "Project/Position 3",
        "duration_years": 2.3,
        "skills_used": [
          "JavaScript",
          "Node.js",
          "AWS",
          "Budgeting",
          "Machine Learning"
        ],
        "description": "Worked on JavaScript, Node.js and related technologies"
      }
    ],
    "raw_text": "CV ID: CV_045\n\nPROFESSIONAL SUMMARY:\nMid professional with 7 years of experience in tech. \nExpertise in SQL, JavaScript, Machine Learning and related technologies.\n\nEDUCATION:\n- BS Computer Science\n- MS Data Science\n\nSKILLS:\nSQL, JavaScript, Machine Learning, Node.js, AWS, Budgeting, Risk Management\n\nEXPERIENCE:\n\n- Project/Position 1 (0.8 years)\n  Skills: SQL, Risk Management\n  Worked on SQL, Risk Management and related technologies\n\n- Project/Position 2 (2.7 years)\n  Skills: AWS, Node.js, Risk Management\n  Worked on AWS, Node.js and related technologies\n\n- Project/Position 3 (2.3 years)\n  Skills: JavaScript, Node.js, AWS, Budgeting, Machine Learning\n  Worked on JavaScript, Node.js and related technologies\n"
  },
  {
    "cv_id": "CV_046",
    "skills": [
      "Machine Learning",
      "NLP",
      "SQL",
      "Docker",
      "PostgreSQL",
      "CRM",
      "Strategic Planning",
      "Forecasting"
    ],
    "experience_years": 7,
    "education": [
      "BS Mathematics",
      "MS Statistics"
    ],
    "seniority": "mid",
    "domain": "tech",
    "experiences": [
      {
        "title": "Project/Position 1",
        "duration_years": 1.4,
        "skills_used": [
          "Forecasting",
          "CRM",
          "Machine Learning",
          "Docker"
        ],
        "description": "Worked on Forecasting, CRM and related technologies"
      },
      {
        "title": "Project/Position 2",
        "duration_years": 2.0,
        "skills_used": [
          "CRM",
          "Forecasting",
          "Strategic Planning",
          "Machine Learning",
          "SQL"
        ],
        "description": "Worked on CRM, Forecasting and related technologies"
      },
      {
        "title": "Project/Position 3",
        "duration_years": 1.0,
        "skills_used": [
          "PostgreSQL",
          "Machine Learning",
          "CRM",
          "Strategic Planning"
        ],
        "description": "Worked on PostgreSQL, Machine Learning and related technologies"
      }
    ],
    "raw_text": "CV ID: CV_046\n\nPROFESSIONAL SUMMARY:\nMid professional with 7 years of experience in tech. \nExpertise in Machine Learning, NLP, SQL and related technologies.\n\nEDUCATION:\n- BS Mathematics\n- MS Statistics\n\nSKILLS:\nMachine Learning, NLP, SQL, Docker, PostgreSQL, CRM, Strategic Planning, Forecasting\n\nEXPERIENCE:\n\n- Project/Position 1 (1.4 years)\n  Skills: Forecasting, CRM, Machine Learning, Docker\n  Worked on Forecasting, CRM and related technologies\n\n- Project/Position 2 (2.0 years)\n  Skills: CRM, Forecasting, Strategic Planning, Machine Learning, SQL\n  Worked on CRM, Forecasting and related technologies\n\n- Project/Position 3 (1.0 years)\n  Skills: PostgreSQL, Machine Learning, CRM, Strategic Planning\n  Worked on PostgreSQL, Machine Learning and related technologies\n"
  },
  {
    "cv_id": "CV_047",
    "skills": [
      "NLP",
      "GraphQL",
      "Flask",
      "PostgreSQL",
      "C++",
      "CI/CD",
      "Negotiation",
      "Budgeting"
    ],
    "experience_years": 18,
    "education": [
      "BS Physics",
      "PhD Physics"
    ],
    "seniority": "senior",
    "domain": "tech",
    "experiences": [
      {
        "title": "Project/Position 1",
        "duration_years": 1.2,
        "skills_used": [
          "CI/CD",
          "GraphQL"
        ],
        "description": "Worked on CI/CD, GraphQL and related technologies"
      },
      {
        "title": "Project/Position 2",
        "duration_years": 1.0,
        "skills_used": [
          "GraphQL",
          "PostgreSQL",
          "Budgeting",
          "NLP"
        ],
        "description": "Worked on GraphQL, PostgreSQL and related technologies"
      },
      {
        "title": "Project/Position 3",
        "duration_years": 1.5,
        "skills_used": [
          "Flask",
          "CI/CD",
          "Negotiation"
        ],
        "description": "Worked on Flask, CI/CD and related technologies"
      },
      {
        "title": "Project/Position 4",
        "duration_years": 2.9,
        "skills_used": [
          "NLP",
          "Negotiation",
          "Budgeting"
        ],
        "description": "Worked on NLP, Negotiation and related technologies"
      },
      {
        "title": "Project/Position 5",
        "duration_years": 1.8,
        "skills_used": [
          "C++",
          "Negotiation"
        ],
        "description": "Worked on C++, Negotiation and related technologies"
      },
      {
        "title": "Project/Position 6",
        "duration_years": 1.4,
        "skills_used": [
          "Budgeting",
          "PostgreSQL",
          "Negotiation",
          "Flask",
          "GraphQL"
        ],
        "description": "Worked on Budgeting, PostgreSQL and related technologies"
      }
    ],
    "raw_text": "CV ID: CV_047\n\nPROFESSIONAL SUMMARY:\nSenior professional with 18 years of experience in tech. \nExpertise in NLP, GraphQL, Flask and related technologies.\n\nEDUCATION:\n- BS Physics\n- PhD Physics\n\nSKILLS:\nNLP, GraphQL, Flask, PostgreSQL, C++, CI/CD, Negotiation, Budgeting\n\nEXPERIENCE:\n\n- Project/Position 1 (1.2 years)\n  Skills: CI/CD, GraphQL\n  Worked on CI/CD, GraphQL and related technologies\n\n- Project/Position 2 (1.0 years)\n  Skills: GraphQL, PostgreSQL, Budgeting, NLP\n  Worked on GraphQL, PostgreSQL and related technologies\n\n- Project/Position 3 (1.5 years)\n  Skills: Flask, CI/CD, Negotiation\n  Worked on Flask, CI/CD and related technologies\n\n- Project/Position 4 (2.9 years)\n  Skills: NLP, Negotiation, Budgeting\n  Worked on NLP, Negotiation and related technologies\n\n- Project/Position 5 (1.8 years)\n  Skills: C++, Negotiation\n  Worked on C++, Negotiation and related technologies\n\n- Project/Position 6 (1.4 years)\n  Skills: Budgeting, PostgreSQL, Negotiation, Flask, GraphQL\n  Worked on Budgeting, PostgreSQL and related technologies\n"
  },
  {
    "cv_id": "CV_048",
    "skills": [
      "MongoDB",
      "Java",
      "SQL",
      "R",
      "CI/CD",
      "Forecasting",
      "Business Analysis"
    ],
    "experience_years": 2,
    "education": [
      "BS Mathematics"
    ],
    "seniority": "junior",
    "domain": "tech",
    "experiences": [
      {
        "title": "Project/Position 1",
        "duration_years": 1.0,
        "skills_used": [
          "Business Analysis",
          "CI/CD",
          "R",
          "Forecasting",
          "Java"
        ],
        "description": "Worked on Business Analysis, CI/CD and related technologies"
      },
      {
        "title": "Project/Position 2",
        "duration_years": 1.6,
        "skills_used": [
          "Java",
          "R"
        ],
        "description": "Worked on Java, R and related technologies"
      }
    ],
    "raw_text": "CV ID: CV_048\n\nPROFESSIONAL SUMMARY:\nJunior professional with 2 years of experience in tech. \nExpertise in MongoDB, Java, SQL and related technologies.\n\nEDUCATION:\n- BS Mathematics\n\nSKILLS:\nMongoDB, Java, SQL, R, CI/CD, Forecasting, Business Analysis\n\nEXPERIENCE:\n\n- Project/Position 1 (1.0 years)\n  Skills: Business Analysis, CI/CD, R, Forecasting, Java\n  Worked on Business Analysis, CI/CD and related technologies\n\n- Project/Position 2 (1.6 years)\n  Skills: Java, R\n  Worked on Java, R and related technologies\n"
  },
  {
    "cv_id": "CV_049",
    "skills": [
      "CRM",
      "ERP",
      "Leadership",
      "Business Analysis",
      "Customer Relations",
      "Computer Vision",
      "Node.js"
    ],
    "experience_years": 1,
    "education": [
      "BS Mathematics"
    ],
    "seniority": "junior",
    "domain": "business",
    "experiences": [
      {
        "title": "Project/Position 1",
        "duration_years": 0.5,
        "skills_used": [
          "Customer Relations",
          "Leadership",
          "Node.js",
          "CRM"
        ],
        "description": "Worked on Customer Relations, Leadership and related technologies"
      },
      {
        "title": "Project/Position 2",
        "duration_years": 2.3,
        "skills_used": [
          "Business Analysis",
          "ERP",
          "Node.js",
          "Customer Relations",
          "Leadership"
        ],
        "description": "Worked on Business Analysis, ERP and related technologies"
      }
    ],
    "raw_text": "CV ID: CV_049\n\nPROFESSIONAL SUMMARY:\nJunior professional with 1 years of experience in business. \nExpertise in CRM, ERP, Leadership and related technologies.\n\nEDUCATION:\n- BS Mathematics\n\nSKILLS:\nCRM, ERP, Leadership, Business Analysis, Customer Relations, Computer Vision, Node.js\n\nEXPERIENCE:\n\n- Project/Position 1 (0.5 years)\n  Skills: Customer Relations, Leadership, Node.js, CRM\n  Worked on Customer Relations, Leadership and related technologies\n\n- Project/Position 2 (2.3 years)\n  Skills: Business Analysis, ERP, Node.js, Customer Relations, Leadership\n  Worked on Business Analysis, ERP and related technologies\n"
  },
  {
    "cv_id": "CV_050",
    "skills": [
      "Excel",
      "Strategic Planning",
      "PowerPoint",
      "Business Analysis",
      "Tableau",
      "Python",
      "PyTorch"
    ],
    "experience_years": 0,
    "education": [
      "BS Information Technology"
    ],
    "seniority": "junior",
    "domain": "business",
    "experiences": [
      {
        "title": "Project/Position 1",
        "duration_years": 2.9,
        "skills_used": [
          "PyTorch",
          "PowerPoint",
          "Excel",
          "Business Analysis",
          "Tableau"
        ],
        "description": "Worked on PyTorch, PowerPoint and related technologies"
      },
      {
        "title": "Project/Position 2",
        "duration_years": 2.6,
        "skills_used": [
          "Strategic Planning",
          "Python",
          "Tableau"
        ],
        "description": "Worked on Strategic Planning, Python and related technologies"
      }
    ],
    "raw_text": "CV ID: CV_050\n\nPROFESSIONAL SUMMARY:\nJunior professional with 0 years of experience in business. \nExpertise in Excel, Strategic Planning, PowerPoint and related technologies.\n\nEDUCATION:\n- BS Information Technology\n\nSKILLS:\nExcel, Strategic Planning, PowerPoint, Business Analysis, Tableau, Python, PyTorch\n\nEXPERIENCE:\n\n- Project/Position 1 (2.9 years)\n  Skills: PyTorch, PowerPoint, Excel, Business Analysis, Tableau\n  Worked on PyTorch, PowerPoint and related technologies\n\n- Project/Position 2 (2.6 years)\n  Skills: Strategic Planning, Python, Tableau\n  Worked on Strategic Planning, Python and related technologies\n"
  },
  {
    "cv_id": "CV_051",
    "skills": [
      "Financial Analysis",
      "Customer Relations",
      "Tableau",
      "PowerPoint",
      "ERP",
      "JavaScript",
      "Computer Vision"
    ],
    "experience_years": 6,
    "education": [
      "BS Mathematics",
      "MS Statistics"
    ],
    "seniority": "mid",
    "domain": "business",
    "experiences": [
      {
        "title": "Project/Position 1",
        "duration_years": 2.1,
        "skills_used": [
          "ERP",
          "JavaScript"
        ],
        "description": "Worked on ERP, JavaScript and related technologies"
      },
      {
        "title": "Project/Position 2",
        "duration_years": 2.3,
        "skills_used": [
          "Financial Analysis",
          "PowerPoint",
          "Computer Vision"
        ],
        "description": "Worked on Financial Analysis, PowerPoint and related technologies"
      },
      {
        "title": "Project/Position 3",
        "duration_years": 0.9,
        "skills_used": [
          "PowerPoint",
          "Customer Relations",
          "Financial Analysis"
        ],
        "description": "Worked on PowerPoint, Customer Relations and related technologies"
      }
    ],
    "raw_text": "CV ID: CV_051\n\nPROFESSIONAL SUMMARY:\nMid professional with 6 years of experience in business. \nExpertise in Financial Analysis, Customer Relations, Tableau and related technologies.\n\nEDUCATION:\n- BS Mathematics\n- MS Statistics\n\nSKILLS:\nFinancial Analysis, Customer Relations, Tableau, PowerPoint, ERP, JavaScript, Computer Vision\n\nEXPERIENCE:\n\n- Project/Position 1 (2.1 years)\n  Skills: ERP, JavaScript\n  Worked on ERP, JavaScript and related technologies\n\n- Project/Position 2 (2.3 years)\n  Skills: Financial Analysis, PowerPoint, Computer Vision\n  Worked on Financial Analysis, PowerPoint and related technologies\n\n- Project/Position 3 (0.9 years)\n  Skills: PowerPoint, Customer Relations, Financial Analysis\n  Worked on PowerPoint, Customer Relations and related technologies\n"
  },
  {
    "cv_id": "CV_052",
    "skills": [
      "SPSS",
      "Academic Writing",
      "Grant Writing",
      "PyTorch",
      "CI/CD"
    ],
    "experience_years": 1,
    "education": [
      "BS Engineering"
    ],
    "seniority": "junior",
    "domain": "research",
    "experiences": [
      {
        "title": "Project/Position 1",
        "duration_years": 1.7,
        "skills_used": [
          "SPSS",
          "Grant Writing",
          "CI/CD",
          "Academic Writing"
        ],
        "description": "Worked on SPSS, Grant Writing and related technologies"
      },
      {
        "title": "Project/Position 2",
        "duration_years": 1.4,
        "skills_used": [
          "Academic Writing",
          "PyTorch",
          "CI/CD",
          "SPSS"
        ],
        "description": "Worked on Academic Writing, PyTorch and related technologies"
      }
    ],
    "raw_text": "CV ID: CV_052\n\nPROFESSIONAL SUMMARY:\nJunior professional with 1 years of experience in research. \nExpertise in SPSS, Academic Writing, Grant Writing and related technologies.\n\nEDUCATION:\n- BS Engineering\n\nSKILLS:\nSPSS, Academic Writing, Grant Writing, PyTorch, CI/CD\n\nEXPERIENCE:\n\n- Project/Position 1 (1.7 years)\n  Skills: SPSS, Grant Writing, CI/CD, Academic Writing\n  Worked on SPSS, Grant Writing and related technologies\n\n- Project/Position 2 (1.4 years)\n  Skills: Academic Writing, PyTorch, CI/CD, SPSS\n  Worked on Academic Writing, PyTorch and related technologies\n"
  },
  {
    "cv_id": "CV_053",
    "skills": [
      "Statistical Analysis",
      "LaTeX",
      "Qualitative Research",
      "Hypothesis Testing",
      "MATLAB",
      "Regression Analysis",
      "GraphQL",
      "JavaScript",
      "Node.js"
    ],
    "experience_years": 11,
    "education": [
      "BS Computer Science",
      "MS AI",
      "PhD Computer Science"
    ],
    "seniority": "senior",
    "domain": "research",
    "experiences": [
      {
        "title": "Project/Position 1",
        "duration_years": 2.9,
        "skills_used": [
          "Qualitative Research",
          "Node.js",
          "Regression Analysis",
          "LaTeX"
        ],
        "description": "Worked on Qualitative Research, Node.js and related technologies"
      },
      {
        "title": "Project/Position 2",
        "duration_years": 1.8,
        "skills_used": [
          "JavaScript",
          "LaTeX",
          "GraphQL",
          "Qualitative Research",
          "Statistical Analysis"
        ],
        "description": "Worked on JavaScript, LaTeX and related technologies"
      },
      {
        "title": "Project/Position 3",
        "duration_years": 2.3,
        "skills_used": [
          "LaTeX",
          "Statistical Analysis",
          "Qualitative Research"
        ],
        "description": "Worked on LaTeX, Statistical Analysis and related technologies"
      },
      {
        "title": "Project/Position 4",
        "duration_years": 1.5,
        "skills_used": [
          "Statistical Analysis",
          "Hypothesis Testing",
          "Node.js",
          "JavaScript",
          "GraphQL"
        ],
        "description": "Worked on Statistical Analysis, Hypothesis Testing and related technologies"
      },
      {
        "title": "Project/Position 5",
        "duration_years": 2.1,
        "skills_used": [
          "Regression Analysis",
          "Statistical Analysis",
          "JavaScript",
          "GraphQL"
        ],
        "description": "Worked on Regression Analysis, Statistical Analysis and related technologies"
      }
    ],
    "raw_text": "CV ID: CV_053\n\nPROFESSIONAL SUMMARY:\nSenior professional with 11 years of experience in research. \nExpertise in Statistical Analysis, LaTeX, Qualitative Research and related technologies.\n\nEDUCATION:\n- BS Computer Science\n- MS AI\n- PhD Computer Science\n\nSKILLS:\nStatistical Analysis, LaTeX, Qualitative Research, Hypothesis Testing, MATLAB, Regression Analysis, GraphQL, JavaScript, Node.js\n\nEXPERIENCE:\n\n- Project/Position 1 (2.9 years)\n  Skills: Qualitative Research, Node.js, Regression Analysis, LaTeX\n  Worked on Qualitative Research, Node.js and related technologies\n\n- Project/Position 2 (1.8 years)\n  Skills: JavaScript, LaTeX, GraphQL, Qualitative Research, Statistical Analysis\n  Worked on JavaScript, LaTeX and related technologies\n\n- Project/Position 3 (2.3 years)\n  Skills: LaTeX, Statistical Analysis, Qualitative Research\n  Worked on LaTeX, Statistical Analysis and related technologies\n\n- Project/Position 4 (1.5 years)\n  Skills: Statistical Analysis, Hypothesis Testing, Node.js, JavaScript, GraphQL\n  Worked on Statistical Analysis, Hypothesis Testing and related technologies\n\n- Project/Position 5 (2.1 years)\n  Skills: Regression Analysis, Statistical Analysis, JavaScript, GraphQL\n  Worked on Regression Analysis, Statistical Analysis and related technologies\n"
  },
  {
    "cv_id": "CV_054",
    "skills": [
      "Docker",
      "Computer Vision",
      "Deep Learning",
      "Machine Learning",
      "Git",
      "Forecasting",
      "Market Research",
      "Communication"
    ],
    "experience_years": 6,
    "education": [
      "BS Computer Science",
      "MS Data Science"
    ],
    "seniority": "mid",
    "domain": "tech",
    "experiences": [
      {
        "title": "Project/Position 1",
        "duration_years": 2.8,
        "skills_used": [
          "Docker",
          "Forecasting",
          "Market Research"
        ],
        "description": "Worked on Docker, Forecasting and related technologies"
      },
      {
        "title": "Project/Position 2",
        "duration_years": 2.5,
        "skills_used": [
          "Machine Learning",
          "Forecasting",
          "Git",
          "Deep Learning"
        ],
        "description": "Worked on Machine Learning, Forecasting and related technologies"
      },
      {
        "title": "Project/Position 3",
        "duration_years": 2.2,
        "skills_used": [
          "Market Research",
          "Forecasting"
        ],
        "description": "Worked on Market Research, Forecasting and related technologies"
      }
    ],
    "raw_text": "CV ID: CV_054\n\nPROFESSIONAL SUMMARY:\nMid professional with 6 years of experience in tech. \nExpertise in Docker, Computer Vision, Deep Learning and related technologies.\n\nEDUCATION:\n- BS Computer Science\n- MS Data Science\n\nSKILLS:\nDocker, Computer Vision, Deep Learning, Machine Learning, Git, Forecasting, Market Research, Communication\n\nEXPERIENCE:\n\n- Project/Position 1 (2.8 years)\n  Skills: Docker, Forecasting, Market Research\n  Worked on Docker, Forecasting and related technologies\n\n- Project/Position 2 (2.5 years)\n  Skills: Machine Learning, Forecasting, Git, Deep Learning\n  Worked on Machine Learning, Forecasting and related technologies\n\n- Project/Position 3 (2.2 years)\n  Skills: Market Research, Forecasting\n  Worked on Market Research, Forecasting and related technologies\n"
  },
  {
    "cv_id": "CV_055",
    "skills": [
      "Leadership",
      "Sales",
      "Marketing",
      "Communication",
      "CI/CD",
      "Scikit-learn"
    ],
    "experience_years": 3,
    "education": [
      "BS Information Technology"
    ],
    "seniority": "junior",
    "domain": "business",
    "experiences": [
      {
        "title": "Project/Position 1",
        "duration_years": 1.3,
        "skills_used": [
          "Communication",
          "Leadership",
          "Scikit-learn",
          "Marketing"
        ],
        "description": "Worked on Communication, Leadership and related technologies"
      },
      {
        "title": "Project/Position 2",
        "duration_years": 0.9,
        "skills_used": [
          "Marketing",
          "Scikit-learn",
          "CI/CD"
        ],
        "description": "Worked on Marketing, Scikit-learn and related technologies"
      }
    ],
    "raw_text": "CV ID: CV_055\n\nPROFESSIONAL SUMMARY:\nJunior professional with 3 years of experience in business. \nExpertise in Leadership, Sales, Marketing and related technologies.\n\nEDUCATION:\n- BS Information Technology\n\nSKILLS:\nLeadership, Sales, Marketing, Communication, CI/CD, Scikit-learn\n\nEXPERIENCE:\n\n- Project/Position 1 (1.3 years)\n  Skills: Communication, Leadership, Scikit-learn, Marketing\n  Worked on Communication, Leadership and related technologies\n\n- Project/Position 2 (0.9 years)\n  Skills: Marketing, Scikit-learn, CI/CD\n  Worked on Marketing, Scikit-learn and related technologies\n"
  },
  {
    "cv_id": "CV_056",
    "skills": [
      "Agile",
      "MongoDB",
      "R",
      "Git",
      "PyTorch",
      "Java",
      "TensorFlow",
      "Excel",
      "Customer Relations",
      "Power BI"
    ],
    "experience_years": 12,
    "education": [
      "BS Engineering",
      "MS Engineering",
      "MBA"
    ],
    "seniority": "senior",
    "domain": "tech",
    "experiences": [
      {
        "title": "Project/Position 1",
        "duration_years": 1.2,
        "skills_used": [
          "Git",
          "Customer Relations",
          "Power BI",
          "Excel"
        ],
        "description": "Worked on Git, Customer Relations and related technologies"
      },
      {
        "title": "Project/Position 2",
        "duration_years": 2.5,
        "skills_used": [
          "Agile",
          "Power BI",
          "Excel",
          "R",
          "Customer Relations"
        ],
        "description": "Worked on Agile, Power BI and related technologies"
      },
      {
        "title": "Project/Position 3",
        "duration_years": 2.1,
        "skills_used": [
          "Java",
          "PyTorch",
          "Agile"
        ],
        "description": "Worked on Java, PyTorch and related technologies"
      },
      {
        "title": "Project/Position 4",
        "duration_years": 2.6,
        "skills_used": [
          "R",
          "Power BI",
          "MongoDB",
          "TensorFlow"
        ],
        "description": "Worked on R, Power BI and related technologies"
      },
      {
        "title": "Project/Position 5",
        "duration_years": 0.7,
        "skills_used": [
          "TensorFlow",
          "PyTorch"
        ],
        "description": "Worked on TensorFlow, PyTorch and related technologies"
      },
      {
        "title": "Project/Position 6",
        "duration_years": 2.8,
        "skills_used": [
          "Customer Relations",
          "PyTorch",
          "Excel"
        ],
        "description": "Worked on Customer Relations, PyTorch and related technologies"
      }
    ],
    "raw_text": "CV ID: CV_056\n\nPROFESSIONAL SUMMARY:\nSenior professional with 12 years of experience in tech. \nExpertise in Agile, MongoDB, R and related technologies.\n\nEDUCATION:\n- BS Engineering\n- MS Engineering\n- MBA\n\nSKILLS:\nAgile, MongoDB, R, Git, PyTorch, Java, TensorFlow, Excel, Customer Relations, Power BI\n\nEXPERIENCE:\n\n- Project/Position 1 (1.2 years)\n  Skills: Git, Customer Relations, Power BI, Excel\n  Worked on Git, Customer Relations and related technologies\n\n- Project/Position 2 (2.5 years)\n  Skills: Agile, Power BI, Excel, R, Customer Relations\n  Worked on Agile, Power BI and related technologies\n\n- Project/Position 3 (2.1 years)\n  Skills: Java, PyTorch, Agile\n  Worked on Java, PyTorch and related technologies\n\n- Project/Position 4 (2.6 years)\n  Skills: R, Power BI, MongoDB, TensorFlow\n  Worked on R, Power BI and related technologies\n\n- Project/Position 5 (0.7 years)\n  Skills: TensorFlow, PyTorch\n  Worked on TensorFlow, PyTorch and related technologies\n\n- Project/Position 6 (2.8 years)\n  Skills: Customer Relations, PyTorch, Excel\n  Worked on Customer Relations, PyTorch and related technologies\n"
  },
  {
    "cv_id": "CV_057",
    "skills": [
      "PostgreSQL",
      "Rust",
      "REST APIs",
      "PyTorch",
      "MongoDB",
      "Excel",
      "Project Management",
      "Tableau"
    ],
    "experience_years": 7,
    "education": [
      "BS Engineering",
      "MS Computer Science"
    ],
    "seniority": "mid",
    "domain": "tech",
    "experiences": [
      {
        "title": "Project/Position 1",
        "duration_years": 2.8,
        "skills_used": [
          "Excel",
          "Rust",
          "PostgreSQL",
          "REST APIs"
        ],
        "description": "Worked on Excel, Rust and related technologies"
      },
      {
        "title": "Project/Position 2",
        "duration_years": 0.6,
        "skills_used": [
          "Tableau",
          "Project Management",
          "Rust",
          "Excel"
        ],
        "description": "Worked on Tableau, Project Management and related technologies"
      },
      {
        "title": "Project/Position 3",
        "duration_years": 2.0,
        "skills_used": [
          "Project Management",
          "Excel",
          "Rust",
          "PyTorch",
          "MongoDB"
        ],
        "description": "Worked on Project Management, Excel and related technologies"
      }
    ],
    "raw_text": "CV ID: CV_057\n\nPROFESSIONAL SUMMARY:\nMid professional with 7 years of experience in tech. \nExpertise in PostgreSQL, Rust, REST APIs and related technologies.\n\nEDUCATION:\n- BS Engineering\n- MS Computer Science\n\nSKILLS:\nPostgreSQL, Rust, REST APIs, PyTorch, MongoDB, Excel, Project Management, Tableau\n\nEXPERIENCE:\n\n- Project/Position 1 (2.8 years)\n  Skills: Excel, Rust, PostgreSQL, REST APIs\n  Worked on Excel, Rust and related technologies\n\n- Project/Position 2 (0.6 years)\n  Skills: Tableau, Project Management, Rust, Excel\n  Worked on Tableau, Project Management and related technologies\n\n- Project/Position 3 (2.0 years)\n  Skills: Project Management, Excel, Rust, PyTorch, MongoDB\n  Worked on Project Management, Excel and related technologies\n"
  },
  {
    "cv_id": "CV_058",
    "skills": [
      "Market Research",
      "Risk Management",
      "ERP",
      "Tableau",
      "Financial Analysis",
      "CI/CD",
      "Deep Learning",
      "Rust"
    ],
    "experience_years": 12,
    "education": [
      "BS Computer Science",
      "MS AI",
      "PhD Computer Science"
    ],
    "seniority": "senior",
    "domain": "business",
    "experiences": [
      {
        "title": "Project/Position 1",
        "duration_years": 2.6,
        "skills_used": [
          "CI/CD",
          "Market Research"
        ],
        "description": "Worked on CI/CD, Market Research and related technologies"
      },
      {
        "title": "Project/Position 2",
        "duration_years": 2.3,
        "skills_used": [
          "Rust",
          "Financial Analysis",
          "Deep Learning",
          "Market Research",
          "Risk Management"
        ],
        "description": "Worked on Rust, Financial Analysis and related technologies"
      },
      {
        "title": "Project/Position 3",
        "duration_years": 1.4,
        "skills_used": [
          "ERP",
          "Financial Analysis",
          "Market Research",
          "CI/CD"
        ],
        "description": "Worked on ERP, Financial Analysis and related technologies"
      },
      {
        "title": "Project/Position 4",
        "duration_years": 0.7,
        "skills_used": [
          "Tableau",
          "Risk Management",
          "Deep Learning",
          "Market Research",
          "ERP"
        ],
        "description": "Worked on Tableau, Risk Management and related technologies"
      },
      {
        "title": "Project/Position 5",
        "duration_years": 2.7,
        "skills_used": [
          "Risk Management",
          "Financial Analysis"
        ],
        "description": "Worked on Risk Management, Financial Analysis and related technologies"
      },
      {
        "title": "Project/Position 6",
        "duration_years": 1.5,
        "skills_used": [
          "Deep Learning",
          "CI/CD"
        ],
        "description": "Worked on Deep Learning, CI/CD and related technologies"
      }
    ],
    "raw_text": "CV ID: CV_058\n\nPROFESSIONAL SUMMARY:\nSenior professional with 12 years of experience in business. \nExpertise in Market Research, Risk Management, ERP and related technologies.\n\nEDUCATION:\n- BS Computer Science\n- MS AI\n- PhD Computer Science\n\nSKILLS:\nMarket Research, Risk Management, ERP, Tableau, Financial Analysis, CI/CD, Deep Learning, Rust\n\nEXPERIENCE:\n\n- Project/Position 1 (2.6 years)\n  Skills: CI/CD, Market Research\n  Worked on CI/CD, Market Research and related technologies\n\n- Project/Position 2 (2.3 years)\n  Skills: Rust, Financial Analysis, Deep Learning, Market Research, Risk Management\n  Worked on Rust, Financial Analysis and related technologies\n\n- Project/Position 3 (1.4 years)\n  Skills: ERP, Financial Analysis, Market Research, CI/CD\n  Worked on ERP, Financial Analysis and related technologies\n\n- Project/Position 4 (0.7 years)\n  Skills: Tableau, Risk Management, Deep Learning, Market Research, ERP\n  Worked on Tableau, Risk Management and related technologies\n\n- Project/Position 5 (2.7 years)\n  Skills: Risk Management, Financial Analysis\n  Worked on Risk Management, Financial Analysis and related technologies\n\n- Project/Position 6 (1.5 years)\n  Skills: Deep Learning, CI/CD\n  Worked on Deep Learning, CI/CD and related technologies\n"
  },
  {
    "cv_id": "CV_059",
    "skills": [
      "Excel",
      "Strategic Planning",
      "Process Improvement",
      "Customer Relations",
      "Git",
      "Docker"
    ],
    "experience_years": 2,
    "education": [
      "BS Mathematics"
    ],
    "seniority": "junior",
    "domain": "business",
    "experiences": [
      {
        "title": "Project/Position 1",
        "duration_years": 0.9,
        "skills_used": [
          "Strategic Planning",
          "Docker",
          "Customer Relations",
          "Git"
        ],
        "description": "Worked on Strategic Planning, Docker and related technologies"
      },
      {
        "title": "Project/Position 2",
        "duration_years": 2.3,
        "skills_used": [
          "Customer Relations",
          "Git",
          "Strategic Planning",
          "Excel",
          "Process Improvement"
        ],
        "description": "Worked on Customer Relations, Git and related technologies"
      }
    ],
    "raw_text": "CV ID: CV_059\n\nPROFESSIONAL SUMMARY:\nJunior professional with 2 years of experience in business. \nExpertise in Excel, Strategic Planning, Process Improvement and related technologies.\n\nEDUCATION:\n- BS Mathematics\n\nSKILLS:\nExcel, Strategic Planning, Process Improvement, Customer Relations, Git, Docker\n\nEXPERIENCE:\n\n- Project/Position 1 (0.9 years)\n  Skills: Strategic Planning, Docker, Customer Relations, Git\n  Worked on Strategic Planning, Docker and related technologies\n\n- Project/Position 2 (2.3 years)\n  Skills: Customer Relations, Git, Strategic Planning, Excel, Process Improvement\n  Worked on Customer Relations, Git and related technologies\n"
  },
  {
    "cv_id": "CV_060",
    "skills": [
      "Java",
      "Agile",
      "Go",
      "MongoDB",
      "Data Analysis",
      "Leadership",
      "ERP",
      "PowerPoint"
    ],
    "experience_years": 12,
    "education": [
      "BS Physics",
      "PhD Physics"
    ],
    "seniority": "senior",
    "domain": "tech",
    "experiences": [
      {
        "title": "Project/Position 1",
        "duration_years": 1.6,
        "skills_used": [
          "MongoDB",
          "Go",
          "Java",
          "PowerPoint"
        ],
        "description": "Worked on MongoDB, Go and related technologies"
      },
      {
        "title": "Project/Position 2",
        "duration_years": 2.9,
        "skills_used": [
          "Leadership",
          "ERP",
          "MongoDB",
          "PowerPoint",
          "Go"
        ],
        "description": "Worked on Leadership, ERP and related technologies"
      },
      {
        "title": "Project/Position 3",
        "duration_years": 2.5,
        "skills_used": [
          "Data Analysis",
          "ERP",
          "MongoDB",
          "Go",
          "Leadership"
        ],
        "description": "Worked on Data Analysis, ERP and related technologies"
      },
      {
        "title": "Project/Position 4",
        "duration_years": 1.9,
        "skills_used": [
          "ERP",
          "Java",
          "MongoDB",
          "Data Analysis",
          "Agile"
        ],
        "description": "Worked on ERP, Java and related technologies"
      },
      {
        "title": "Project/Position 5",
        "duration_years": 2.2,
        "skills_used": [
          "Agile",
          "Java",
          "PowerPoint",
          "MongoDB"
        ],
        "description": "Worked on Agile, Java and related technologies"
      },
      {
        "title": "Project/Position 6",
        "duration_years": 0.9,
        "skills_used": [
          "Java",
          "Data Analysis",
          "Leadership",
          "PowerPoint"
        ],
        "description": "Worked on Java, Data Analysis and related technologies"
      }
    ],
    "raw_text": "CV ID: CV_060\n\nPROFESSIONAL SUMMARY:\nSenior professional with 12 years of experience in tech. \nExpertise in Java, Agile, Go and related technologies.\n\nEDUCATION:\n- BS Physics\n- PhD Physics\n\nSKILLS:\nJava, Agile, Go, MongoDB, Data Analysis, Leadership, ERP, PowerPoint\n\nEXPERIENCE:\n\n- Project/Position 1 (1.6 years)\n  Skills: MongoDB, Go, Java, PowerPoint\n  Worked on MongoDB, Go and related technologies\n\n- Project/Position 2 (2.9 years)\n  Skills: Leadership, ERP, MongoDB, PowerPoint, Go\n  Worked on Leadership, ERP and related technologies\n\n- Project/Position 3 (2.5 years)\n  Skills: Data Analysis, ERP, MongoDB, Go, Leadership\n  Worked on Data Analysis, ERP and related technologies\n\n- Project/Position 4 (1.9 years)\n  Skills: ERP, Java, MongoDB, Data Analysis, Agile\n  Worked on ERP, Java and related technologies\n\n- Project/Position 5 (2.2 years)\n  Skills: Agile, Java, PowerPoint, MongoDB\n  Worked on Agile, Java and related technologies\n\n- Project/Position 6 (0.9 years)\n  Skills: Java, Data Analysis, Leadership, PowerPoint\n  Worked on Java, Data Analysis and related technologies\n"
  },
  {
    "cv_id": "CV_061",
    "skills": [
      "Git",
      "GraphQL",
      "PostgreSQL",
      "NLP",
      "Forecasting",
      "Tableau"
    ],
    "experience_years": 1,
    "education": [
      "BS Data Science"
    ],
    "seniority": "junior",
    "domain": "tech",
    "experiences": [
      {
        "title": "Project/Position 1",
        "duration_years": 0.9,
        "skills_used": [
          "NLP",
          "Tableau",
          "GraphQL",
          "Git"
        ],
        "description": "Worked on NLP, Tableau and related technologies"
      },
      {
        "title": "Project/Position 2",
        "duration_years": 2.4,
        "skills_used": [
          "GraphQL",
          "Git",
          "PostgreSQL",
          "Tableau",
          "NLP"
        ],
        "description": "Worked on GraphQL, Git and related technologies"
      }
    ],
    "raw_text": "CV ID: CV_061\n\nPROFESSIONAL SUMMARY:\nJunior professional with 1 years of experience in tech. \nExpertise in Git, GraphQL, PostgreSQL and related technologies.\n\nEDUCATION:\n- BS Data Science\n\nSKILLS:\nGit, GraphQL, PostgreSQL, NLP, Forecasting, Tableau\n\nEXPERIENCE:\n\n- Project/Position 1 (0.9 years)\n  Skills: NLP, Tableau, GraphQL, Git\n  Worked on NLP, Tableau and related technologies\n\n- Project/Position 2 (2.4 years)\n  Skills: GraphQL, Git, PostgreSQL, Tableau, NLP\n  Worked on GraphQL, Git and related technologies\n"
  },
  {
    "cv_id": "CV_062",
    "skills": [
      "Budgeting",
      "Business Analysis",
      "Market Research",
      "Power BI",
      "Excel",
      "NLP",
      "PyTorch",
      "CI/CD"
    ],
    "experience_years": 3,
    "education": [
      "BS Mathematics",
      "MS Statistics"
    ],
    "seniority": "mid",
    "domain": "business",
    "experiences": [
      {
        "title": "Project/Position 1",
        "duration_years": 2.3,
        "skills_used": [
          "Budgeting",
          "Market Research",
          "Business Analysis",
          "PyTorch"
        ],
        "description": "Worked on Budgeting, Market Research and related technologies"
      },
      {
        "title": "Project/Position 2",
        "duration_years": 1.2,
        "skills_used": [
          "Power BI",
          "NLP",
          "Excel",
          "CI/CD",
          "Budgeting"
        ],
        "description": "Worked on Power BI, NLP and related technologies"
      }
    ],
    "raw_text": "CV ID: CV_062\n\nPROFESSIONAL SUMMARY:\nMid professional with 3 years of experience in business. \nExpertise in Budgeting, Business Analysis, Market Research and related technologies.\n\nEDUCATION:\n- BS Mathematics\n- MS Statistics\n\nSKILLS:\nBudgeting, Business Analysis, Market Research, Power BI, Excel, NLP, PyTorch, CI/CD\n\nEXPERIENCE:\n\n- Project/Position 1 (2.3 years)\n  Skills: Budgeting, Market Research, Business Analysis, PyTorch\n  Worked on Budgeting, Market Research and related technologies\n\n- Project/Position 2 (1.2 years)\n  Skills: Power BI, NLP, Excel, CI/CD, Budgeting\n  Worked on Power BI, NLP and related technologies\n"
  },
  {
    "cv_id": "CV_063",
    "skills": [
      "Forecasting",
      "Leadership",
      "CRM",
      "Marketing",
      "Financial Analysis",
      "SQL",
      "GraphQL"
    ],
    "experience_years": 2,
    "education": [
      "BS Mathematics"
    ],
    "seniority": "junior",
    "domain": "business",
    "experiences": [
      {
        "title": "Project/Position 1",
        "duration_years": 2.7,
        "skills_used": [
          "CRM",
          "GraphQL",
          "Forecasting",
          "Marketing"
        ],
        "description": "Worked on CRM, GraphQL and related technologies"
      },
      {
        "title": "Project/Position 2",
        "duration_years": 2.5,
        "skills_used": [
          "Financial Analysis",
          "GraphQL",
          "Leadership"
        ],
        "description": "Worked on Financial Analysis, GraphQL and related technologies"
      }
    ],
    "raw_text": "CV ID: CV_063\n\nPROFESSIONAL SUMMARY:\nJunior professional with 2 years of experience in business. \nExpertise in Forecasting, Leadership, CRM and related technologies.\n\nEDUCATION:\n- BS Mathematics\n\nSKILLS:\nForecasting, Leadership, CRM, Marketing, Financial Analysis, SQL, GraphQL\n\nEXPERIENCE:\n\n- Project/Position 1 (2.7 years)\n  Skills: CRM, GraphQL, Forecasting, Marketing\n  Worked on CRM, GraphQL and related technologies\n\n- Project/Position 2 (2.5 years)\n  Skills: Financial Analysis, GraphQL, Leadership\n  Worked on Financial Analysis, GraphQL and related technologies\n"
  },
  {
    "cv_id": "CV_064",
    "skills": [
      "Go",
      "Agile",
      "SQL",
      "Rust",
      "CRM",
      "Project Management",
      "Excel"
    ],
    "experience_years": 7,
    "education": [
      "BS Physics",
      "MS Machine Learning"
    ],
    "seniority": "mid",
    "domain": "tech",
    "experiences": [
      {
        "title": "Project/Position 1",
        "duration_years": 1.3,
        "skills_used": [
          "Agile",
          "Go"
        ],
        "description": "Worked on Agile, Go and related technologies"
      },
      {
        "title": "Project/Position 2",
        "duration_years": 0.7,
        "skills_used": [
          "Go",
          "Project Management",
          "CRM",
          "Excel",
          "Rust"
        ],
        "description": "Worked on Go, Project Management and related technologies"
      },
      {
        "title": "Project/Position 3",
        "duration_years": 1.7,
        "skills_used": [
          "Project Management",
          "Excel",
          "Go",
          "Rust"
        ],
        "description": "Worked on Project Management, Excel and related technologies"
      }
    ],
    "raw_text": "CV ID: CV_064\n\nPROFESSIONAL SUMMARY:\nMid professional with 7 years of experience in tech. \nExpertise in Go, Agile, SQL and related technologies.\n\nEDUCATION:\n- BS Physics\n- MS Machine Learning\n\nSKILLS:\nGo, Agile, SQL, Rust, CRM, Project Management, Excel\n\nEXPERIENCE:\n\n- Project/Position 1 (1.3 years)\n  Skills: Agile, Go\n  Worked on Agile, Go and related technologies\n\n- Project/Position 2 (0.7 years)\n  Skills: Go, Project Management, CRM, Excel, Rust\n  Worked on Go, Project Management and related technologies\n\n- Project/Position 3 (1.7 years)\n  Skills: Project Management, Excel, Go, Rust\n  Worked on Project Management, Excel and related technologies\n"
  },
  {
    "cv_id": "CV_065",
    "skills": [
      "Risk Management",
      "Budgeting",
      "Sales",
      "Market Research",
      "Tableau",
      "Django",
      "PostgreSQL",
      "GraphQL"
    ],
    "experience_years": 6,
    "education": [
      "BS Physics",
      "MS Machine Learning"
    ],
    "seniority": "mid",
    "domain": "business",
    "experiences": [
      {
        "title": "Project/Position 1",
        "duration_years": 1.1,
        "skills_used": [
          "Sales",
          "Market Research",
          "PostgreSQL"
        ],
        "description": "Worked on Sales, Market Research and related technologies"
      },
      {
        "title": "Project/Position 2",
        "duration_years": 1.0,
        "skills_used": [
          "Django",
          "GraphQL",
          "Risk Management",
          "Sales"
        ],
        "description": "Worked on Django, GraphQL and related technologies"
      },
      {
        "title": "Project/Position 3",
        "duration_years": 2.0,
        "skills_used": [
          "Market Research",
          "Budgeting",
          "PostgreSQL",
          "Sales"
        ],
        "description": "Worked on Market Research, Budgeting and related technologies"
      }
    ],
    "raw_text": "CV ID: CV_065\n\nPROFESSIONAL SUMMARY:\nMid professional with 6 years of experience in business. \nExpertise in Risk Management, Budgeting, Sales and related technologies.\n\nEDUCATION:\n- BS Physics\n- MS Machine Learning\n\nSKILLS:\nRisk Management, Budgeting, Sales, Market Research, Tableau, Django, PostgreSQL, GraphQL\n\nEXPERIENCE:\n\n- Project/Position 1 (1.1 years)\n  Skills: Sales, Market Research, PostgreSQL\n  Worked on Sales, Market Research and related technologies\n\n- Project/Position 2 (1.0 years)\n  Skills: Django, GraphQL, Risk Management, Sales\n  Worked on Django, GraphQL and related technologies\n\n- Project/Position 3 (2.0 years)\n  Skills: Market Research, Budgeting, PostgreSQL, Sales\n  Worked on Market Research, Budgeting and related technologies\n"
  },
  {
    "cv_id": "CV_066",
    "skills": [
      "React",
      "PostgreSQL",
      "SQL",
      "R",
      "Docker",
      "Node.js",
      "Forecasting",
      "Communication",
      "Budgeting"
    ],
    "experience_years": 4,
    "education": [
      "BS Computer Science",
      "MS Data Science"
    ],
    "seniority": "mid",
    "domain": "tech",
    "experiences": [
      {
        "title": "Project/Position 1",
        "duration_years": 1.2,
        "skills_used": [
          "PostgreSQL",
          "React",
          "Docker",
          "Forecasting",
          "Node.js"
        ],
        "description": "Worked on PostgreSQL, React and related technologies"
      },
      {
        "title": "Project/Position 2",
        "duration_years": 1.5,
        "skills_used": [
          "Node.js",
          "Budgeting",
          "PostgreSQL",
          "Forecasting"
        ],
        "description": "Worked on Node.js, Budgeting and related technologies"
      }
    ],
    "raw_text": "CV ID: CV_066\n\nPROFESSIONAL SUMMARY:\nMid professional with 4 years of experience in tech. \nExpertise in React, PostgreSQL, SQL and related technologies.\n\nEDUCATION:\n- BS Computer Science\n- MS Data Science\n\nSKILLS:\nReact, PostgreSQL, SQL, R, Docker, Node.js, Forecasting, Communication, Budgeting\n\nEXPERIENCE:\n\n- Project/Position 1 (1.2 years)\n  Skills: PostgreSQL, React, Docker, Forecasting, Node.js\n  Worked on PostgreSQL, React and related technologies\n\n- Project/Position 2 (1.5 years)\n  Skills: Node.js, Budgeting, PostgreSQL, Forecasting\n  Worked on Node.js, Budgeting and related technologies\n"
  },
  {
    "cv_id": "CV_067",
    "skills": [
      "Academic Writing",
      "Publication",
      "Survey Design",
      "Grant Writing",
      "Data Collection",
      "Go",
      "Data Analysis"
    ],
    "experience_years": 4,
    "education": [
      "BS Business",
      "MBA"
    ],
    "seniority": "mid",
    "domain": "research",
    "experiences": [
      {
        "title": "Project/Position 1",
        "duration_years": 1.1,
        "skills_used": [
          "Academic Writing",
          "Survey Design",
          "Grant Writing",
          "Publication",
          "Data Analysis"
        ],
        "description": "Worked on Academic Writing, Survey Design and related technologies"
      },
      {
        "title": "Project/Position 2",
        "duration_years": 1.6,
        "skills_used": [
          "Go",
          "Survey Design"
        ],
        "description": "Worked on Go, Survey Design and related technologies"
      }
    ],
    "raw_text": "CV ID: CV_067\n\nPROFESSIONAL SUMMARY:\nMid professional with 4 years of experience in research. \nExpertise in Academic Writing, Publication, Survey Design and related technologies.\n\nEDUCATION:\n- BS Business\n- MBA\n\nSKILLS:\nAcademic Writing, Publication, Survey Design, Grant Writing, Data Collection, Go, Data Analysis\n\nEXPERIENCE:\n\n- Project/Position 1 (1.1 years)\n  Skills: Academic Writing, Survey Design, Grant Writing, Publication, Data Analysis\n  Worked on Academic Writing, Survey Design and related technologies\n\n- Project/Position 2 (1.6 years)\n  Skills: Go, Survey Design\n  Worked on Go, Survey Design and related technologies\n"
  },
  {
    "cv_id": "CV_068",
    "skills": [
      "Quantitative Research",
      "Survey Design",
      "Data Collection",
      "Academic Writing",
      "REST APIs",
      "Data Analysis",
      "PostgreSQL"
    ],
    "experience_years": 6,
    "education": [
      "BS Engineering",
      "MS Computer Science"
    ],
    "seniority": "mid",
    "domain": "research",
    "experiences": [
      {
        "title": "Project/Position 1",
        "duration_years": 0.7,
        "skills_used": [
          "PostgreSQL",
          "Academic Writing",
          "Data Collection",
          "Data Analysis",
          "Quantitative Research"
        ],
        "description": "Worked on PostgreSQL, Academic Writing and related technologies"
      },
      {
        "title": "Project/Position 2",
        "duration_years": 2.0,
        "skills_used": [
          "Academic Writing",
          "Data Analysis",
          "REST APIs",
          "Survey Design",
          "Quantitative Research"
        ],
        "description": "Worked on Academic Writing, Data Analysis and related technologies"
      },
      {
        "title": "Project/Position 3",
        "duration_years": 1.2,
        "skills_used": [
          "Quantitative Research",
          "Survey Design"
        ],
        "description": "Worked on Quantitative Research, Survey Design and related technologies"
      }
    ],
    "raw_text": "CV ID: CV_068\n\nPROFESSIONAL SUMMARY:\nMid professional with 6 years of experience in research. \nExpertise in Quantitative Research, Survey Design, Data Collection and related technologies.\n\nEDUCATION:\n- BS Engineering\n- MS Computer Science\n\nSKILLS:\nQuantitative Research, Survey Design, Data Collection, Academic Writing, REST APIs, Data Analysis, PostgreSQL\n\nEXPERIENCE:\n\n- Project/Position 1 (0.7 years)\n  Skills: PostgreSQL, Academic Writing, Data Collection, Data Analysis, Quantitative Research\n  Worked on PostgreSQL, Academic Writing and related technologies\n\n- Project/Position 2 (2.0 years)\n  Skills: Academic Writing, Data Analysis, REST APIs, Survey Design, Quantitative Research\n  Worked on Academic Writing, Data Analysis and related technologies\n\n- Project/Position 3 (1.2 years)\n  Skills: Quantitative Research, Survey Design\n  Worked on Quantitative Research, Survey Design and related technologies\n"
  },
  {
    "cv_id": "CV_069",
    "skills": [
      "Leadership",
      "Risk Management",
      "Project Management",
      "Financial Analysis",
      "Tableau",
      "Market Research",
      "MongoDB",
      "Machine Learning",
      "Git"
    ],
    "experience_years": 8,
    "education": [
      "BS Physics",
      "MS Machine Learning"
    ],
    "seniority": "mid",
    "domain": "business",
    "experiences": [
      {
        "title": "Project/Position 1",
        "duration_years": 1.8,
        "skills_used": [
          "Risk Management",
          "Market Research",
          "Leadership",
          "Tableau"
        ],
        "description": "Worked on Risk Management, Market Research and related technologies"
      },
      {
        "title": "Project/Position 2",
        "duration_years": 1.5,
        "skills_used": [
          "Tableau",
          "Risk Management",
          "Git",
          "Leadership"
        ],
        "description": "Worked on Tableau, Risk Management and related technologies"
      },
      {
        "title": "Project/Position 3",
        "duration_years": 1.0,
        "skills_used": [
          "Machine Learning",
          "Market Research",
          "MongoDB",
          "Risk Management"
        ],
        "description": "Worked on Machine Learning, Market Research and related technologies"
      },
      {
        "title": "Project/Position 4",
        "duration_years": 2.3,
        "skills_used": [
          "Git",
          "Leadership",
          "Machine Learning",
          "MongoDB",
          "Risk Management"
        ],
        "description": "Worked on Git, Leadership and related technologies"
      }
    ],
    "raw_text": "CV ID: CV_069\n\nPROFESSIONAL SUMMARY:\nMid professional with 8 years of experience in business. \nExpertise in Leadership, Risk Management, Project Management and related technologies.\n\nEDUCATION:\n- BS Physics\n- MS Machine Learning\n\nSKILLS:\nLeadership, Risk Management, Project Management, Financial Analysis, Tableau, Market Research, MongoDB, Machine Learning, Git\n\nEXPERIENCE:\n\n- Project/Position 1 (1.8 years)\n  Skills: Risk Management, Market Research, Leadership, Tableau\n  Worked on Risk Management, Market Research and related technologies\n\n- Project/Position 2 (1.5 years)\n  Skills: Tableau, Risk Management, Git, Leadership\n  Worked on Tableau, Risk Management and related technologies\n\n- Project/Position 3 (1.0 years)\n  Skills: Machine Learning, Market Research, MongoDB, Risk Management\n  Worked on Machine Learning, Market Research and related technologies\n\n- Project/Position 4 (2.3 years)\n  Skills: Git, Leadership, Machine Learning, MongoDB, Risk Management\n  Worked on Git, Leadership and related technologies\n"
  },
  {
    "cv_id": "CV_070",
    "skills": [
      "Node.js",
      "MongoDB",
      "Django",
      "SQL",
      "Data Analysis",
      "PostgreSQL",
      "Communication",
      "Sales",
      "PowerPoint"
    ],
    "experience_years": 3,
    "education": [
      "BS Business",
      "MBA"
    ],
    "seniority": "mid",
    "domain": "tech",
    "experiences": [
      {
        "title": "Project/Position 1",
        "duration_years": 2.9,
        "skills_used": [
          "Node.js",
          "MongoDB",
          "SQL",
          "Sales",
          "PowerPoint"
        ],
        "description": "Worked on Node.js, MongoDB and related technologies"
      },
      {
        "title": "Project/Position 2",
        "duration_years": 1.2,
        "skills_used": [
          "MongoDB",
          "Node.js",
          "PostgreSQL",
          "Data Analysis"
        ],
        "description": "Worked on MongoDB, Node.js and related technologies"
      }
    ],
    "raw_text": "CV ID: CV_070\n\nPROFESSIONAL SUMMARY:\nMid professional with 3 years of experience in tech. \nExpertise in Node.js, MongoDB, Django and related technologies.\n\nEDUCATION:\n- BS Business\n- MBA\n\nSKILLS:\nNode.js, MongoDB, Django, SQL, Data Analysis, PostgreSQL, Communication, Sales, PowerPoint\n\nEXPERIENCE:\n\n- Project/Position 1 (2.9 years)\n  Skills: Node.js, MongoDB, SQL, Sales, PowerPoint\n  Worked on Node.js, MongoDB and related technologies\n\n- Project/Position 2 (1.2 years)\n  Skills: MongoDB, Node.js, PostgreSQL, Data Analysis\n  Worked on MongoDB, Node.js and related technologies\n"
  },
  {
    "cv_id": "CV_071",
    "skills": [
      "Statistical Analysis",
      "Grant Writing",
      "Academic Writing",
      "Quantitative Research",
      "SPSS",
      "Survey Design",
      "Regression Analysis",
      "Rust",
      "Java",
      "React"
    ],
    "experience_years": 13,
    "education": [
      "BS Computer Science",
      "MS Data Science",
      "Executive MBA"
    ],
    "seniority": "senior",
    "domain": "research",
    "experiences": [
      {
        "title": "Project/Position 1",
        "duration_years": 2.3,
        "skills_used": [
          "Survey Design",
          "React",
          "Java",
          "Rust",
          "Regression Analysis"
        ],
        "description": "Worked on Survey Design, React and related technologies"
      },
      {
        "title": "Project/Position 2",
        "duration_years": 1.9,
        "skills_used": [
          "Rust",
          "React",
          "Quantitative Research"
        ],
        "description": "Worked on Rust, React and related technologies"
      },
      {
        "title": "Project/Position 3",
        "duration_years": 1.6,
        "skills_used": [
          "SPSS",
          "React",
          "Rust",
          "Academic Writing",
          "Grant Writing"
        ],
        "description": "Worked on SPSS, React and related technologies"
      },
      {
        "title": "Project/Position 4",
        "duration_years": 2.4,
        "skills_used": [
          "React",
          "Java",
          "Survey Design",
          "Rust"
        ],
        "description": "Worked on React, Java and related technologies"
      },
      {
        "title": "Project/Position 5",
        "duration_years": 1.2,
        "skills_used": [
          "Regression Analysis",
          "Java",
          "Quantitative Research",
          "Grant Writing"
        ],
        "description": "Worked on Regression Analysis, Java and related technologies"
      },
      {
        "title": "Project/Position 6",
        "duration_years": 1.2,
        "skills_used": [
          "Academic Writing",
          "SPSS",
          "Survey Design",
          "Rust"
        ],
        "description": "Worked on Academic Writing, SPSS and related technologies"
      }
    ],
    "raw_text": "CV ID: CV_071\n\nPROFESSIONAL SUMMARY:\nSenior professional with 13 years of experience in research. \nExpertise in Statistical Analysis, Grant Writing, Academic Writing and related technologies.\n\nEDUCATION:\n- BS Computer Science\n- MS Data Science\n- Executive MBA\n\nSKILLS:\nStatistical Analysis, Grant Writing, Academic Writing, Quantitative Research, SPSS, Survey Design, Regression Analysis, Rust, Java, React\n\nEXPERIENCE:\n\n- Project/Position 1 (2.3 years)\n  Skills: Survey Design, React, Java, Rust, Regression Analysis\n  Worked on Survey Design, React and related technologies\n\n- Project/Position 2 (1.9 years)\n  Skills: Rust, React, Quantitative Research\n  Worked on Rust, React and related technologies\n\n- Project/Position 3 (1.6 years)\n  Skills: SPSS, React, Rust, Academic Writing, Grant Writing\n  Worked on SPSS, React and related technologies\n\n- Project/Position 4 (2.4 years)\n  Skills: React, Java, Survey Design, Rust\n  Worked on React, Java and related technologies\n\n- Project/Position 5 (1.2 years)\n  Skills: Regression Analysis, Java, Quantitative Research, Grant Writing\n  Worked on Regression Analysis, Java and related technologies\n\n- Project/Position 6 (1.2 years)\n  Skills: Academic Writing, SPSS, Survey Design, Rust\n  Worked on Academic Writing, SPSS and related technologies\n"
  },
  {
    "cv_id": "CV_072",
    "skills": [
      "Regression Analysis",
      "Grant Writing",
      "Qualitative Research",
      "Experiment Design",
      "Python",
      "Statistical Analysis",
      "React",
      "Docker",
      "Flask"
    ],
    "experience_years": 6,
    "education": [
      "BS Engineering",
      "MS Computer Science"
    ],
    "seniority": "mid",
    "domain": "research",
    "experiences": [
      {
        "title": "Project/Position 1",
        "duration_years": 2.8,
        "skills_used": [
          "Experiment Design",
          "React"
        ],
        "description": "Worked on Experiment Design, React and related technologies"
      },
      {
        "title": "Project/Position 2",
        "duration_years": 2.6,
        "skills_used": [
          "Python",
          "Flask",
          "Grant Writing",
          "Docker"
        ],
        "description": "Worked on Python, Flask and related technologies"
      },
      {
        "title": "Project/Position 3",
        "duration_years": 2.0,
        "skills_used": [
          "Regression Analysis",
          "Statistical Analysis",
          "Qualitative Research",
          "Grant Writing"
        ],
        "description": "Worked on Regression Analysis, Statistical Analysis and related technologies"
      }
    ],
    "raw_text": "CV ID: CV_072\n\nPROFESSIONAL SUMMARY:\nMid professional with 6 years of experience in research. \nExpertise in Regression Analysis, Grant Writing, Qualitative Research and related technologies.\n\nEDUCATION:\n- BS Engineering\n- MS Computer Science\n\nSKILLS:\nRegression Analysis, Grant Writing, Qualitative Research, Experiment Design, Python, Statistical Analysis, React, Docker, Flask\n\nEXPERIENCE:\n\n- Project/Position 1 (2.8 years)\n  Skills: Experiment Design, React\n  Worked on Experiment Design, React and related technologies\n\n- Project/Position 2 (2.6 years)\n  Skills: Python, Flask, Grant Writing, Docker\n  Worked on Python, Flask and related technologies\n\n- Project/Position 3 (2.0 years)\n  Skills: Regression Analysis, Statistical Analysis, Qualitative Research, Grant Writing\n  Worked on Regression Analysis, Statistical Analysis and related technologies\n"
  },
  {
    "cv_id": "CV_073",
    "skills": [
      "Peer Review",
      "Data Collection",
      "MATLAB",
      "Statistical Analysis",
      "Grant Writing",
      "TensorFlow",
      "Data Analysis",
      "Kubernetes"
    ],
    "experience_years": 11,
    "education": [
      "BS Computer Science",
      "MS Data Science",
      "Executive MBA"
    ],
    "seniority": "senior",
    "domain": "research",
    "experiences": [
      {
        "title": "Project/Position 1",
        "duration_years": 2.4,
        "skills_used": [
          "Grant Writing",
          "Data Analysis",
          "Statistical Analysis",
          "Kubernetes",
          "Data Collection"
        ],
        "description": "Worked on Grant Writing, Data Analysis and related technologies"
      },
      {
        "title": "Project/Position 2",
        "duration_years": 2.8,
        "skills_used": [
          "Statistical Analysis",
          "MATLAB",
          "Kubernetes",
          "Peer Review"
        ],
        "description": "Worked on Statistical Analysis, MATLAB and related technologies"
      },
      {
        "title": "Project/Position 3",
        "duration_years": 1.9,
        "skills_used": [
          "MATLAB",
          "Data Analysis"
        ],
        "description": "Worked on MATLAB, Data Analysis and related technologies"
      },
      {
        "title": "Project/Position 4",
        "duration_years": 1.5,
        "skills_used": [
          "Data Analysis",
          "Data Collection"
        ],
        "description": "Worked on Data Analysis, Data Collection and related technologies"
      },
      {
        "title": "Project/Position 5",
        "duration_years": 2.5,
        "skills_used": [
          "Data Collection",
          "Peer Review",
          "Grant Writing"
        ],
        "description": "Worked on Data Collection, Peer Review and related technologies"
      }
    ],
    "raw_text": "CV ID: CV_073\n\nPROFESSIONAL SUMMARY:\nSenior professional with 11 years of experience in research. \nExpertise in Peer Review, Data Collection, MATLAB and related technologies.\n\nEDUCATION:\n- BS Computer Science\n- MS Data Science\n- Executive MBA\n\nSKILLS:\nPeer Review, Data Collection, MATLAB, Statistical Analysis, Grant Writing, TensorFlow, Data Analysis, Kubernetes\n\nEXPERIENCE:\n\n- Project/Position 1 (2.4 years)\n  Skills: Grant Writing, Data Analysis, Statistical Analysis, Kubernetes, Data Collection\n  Worked on Grant Writing, Data Analysis and related technologies\n\n- Project/Position 2 (2.8 years)\n  Skills: Statistical Analysis, MATLAB, Kubernetes, Peer Review\n  Worked on Statistical Analysis, MATLAB and related technologies\n\n- Project/Position 3 (1.9 years)\n  Skills: MATLAB, Data Analysis\n  Worked on MATLAB, Data Analysis and related technologies\n\n- Project/Position 4 (1.5 years)\n  Skills: Data Analysis, Data Collection\n  Worked on Data Analysis, Data Collection and related technologies\n\n- Project/Position 5 (2.5 years)\n  Skills: Data Collection, Peer Review, Grant Writing\n  Worked on Data Collection, Peer Review and related technologies\n"
  },
  {
    "cv_id": "CV_074",
    "skills": [
      "PostgreSQL",
      "Deep Learning",
      "Java",
      "Python",
      "MongoDB",
      "React",
      "Node.js",
      "Financial Analysis",
      "Communication"
    ],
    "experience_years": 5,
    "education": [
      "BS Engineering",
      "MS Computer Science"
    ],
    "seniority": "mid",
    "domain": "tech",
    "experiences": [
      {
        "title": "Project/Position 1",
        "duration_years": 1.3,
        "skills_used": [
          "Java",
          "MongoDB",
          "Financial Analysis",
          "PostgreSQL"
        ],
        "description": "Worked on Java, MongoDB and related technologies"
      },
      {
        "title": "Project/Position 2",
        "duration_years": 2.3,
        "skills_used": [
          "Deep Learning",
          "React",
          "Node.js",
          "Java",
          "PostgreSQL"
        ],
        "description": "Worked on Deep Learning, React and related technologies"
      }
    ],
    "raw_text": "CV ID: CV_074\n\nPROFESSIONAL SUMMARY:\nMid professional with 5 years of experience in tech. \nExpertise in PostgreSQL, Deep Learning, Java and related technologies.\n\nEDUCATION:\n- BS Engineering\n- MS Computer Science\n\nSKILLS:\nPostgreSQL, Deep Learning, Java, Python, MongoDB, React, Node.js, Financial Analysis, Communication\n\nEXPERIENCE:\n\n- Project/Position 1 (1.3 years)\n  Skills: Java, MongoDB, Financial Analysis, PostgreSQL\n  Worked on Java, MongoDB and related technologies\n\n- Project/Position 2 (2.3 years)\n  Skills: Deep Learning, React, Node.js, Java, PostgreSQL\n  Worked on Deep Learning, React and related technologies\n"
  },
  {
    "cv_id": "CV_075",
    "skills": [
      "Go",
      "R",
      "Node.js",
      "AWS",
      "Computer Vision",
      "TensorFlow",
      "ERP",
      "Communication",
      "Strategic Planning"
    ],
    "experience_years": 7,
    "education": [
      "BS Mathematics",
      "MS Statistics"
    ],
    "seniority": "mid",
    "domain": "tech",
    "experiences": [
      {
        "title": "Project/Position 1",
        "duration_years": 2.4,
        "skills_used": [
          "TensorFlow",
          "Communication",
          "R",
          "AWS"
        ],
        "description": "Worked on TensorFlow, Communication and related technologies"
      },
      {
        "title": "Project/Position 2",
        "duration_years": 1.9,
        "skills_used": [
          "Computer Vision",
          "TensorFlow",
          "Strategic Planning",
          "ERP"
        ],
        "description": "Worked on Computer Vision, TensorFlow and related technologies"
      },
      {
        "title": "Project/Position 3",
        "duration_years": 0.7,
        "skills_used": [
          "Go",
          "ERP",
          "Strategic Planning",
          "Node.js"
        ],
        "description": "Worked on Go, ERP and related technologies"
      }
    ],
    "raw_text": "CV ID: CV_075\n\nPROFESSIONAL SUMMARY:\nMid professional with 7 years of experience in tech. \nExpertise in Go, R, Node.js and related technologies.\n\nEDUCATION:\n- BS Mathematics\n- MS Statistics\n\nSKILLS:\nGo, R, Node.js, AWS, Computer Vision, TensorFlow, ERP, Communication, Strategic Planning\n\nEXPERIENCE:\n\n- Project/Position 1 (2.4 years)\n  Skills: TensorFlow, Communication, R, AWS\n  Worked on TensorFlow, Communication and related technologies\n\n- Project/Position 2 (1.9 years)\n  Skills: Computer Vision, TensorFlow, Strategic Planning, ERP\n  Worked on Computer Vision, TensorFlow and related technologies\n\n- Project/Position 3 (0.7 years)\n  Skills: Go, ERP, Strategic Planning, Node.js\n  Worked on Go, ERP and related technologies\n"
  },
  {
    "cv_id": "CV_076",
    "skills": [
      "Quantitative Research",
      "Peer Review",
      "Hypothesis Testing",
      "R",
      "Regression Analysis",
      "PostgreSQL",
      "Deep Learning",
      "NLP"
    ],
    "experience_years": 4,
    "education": [
      "BS Computer Science",
      "MS Data Science"
    ],
    "seniority": "mid",
    "domain": "research",
    "experiences": [
      {
        "title": "Project/Position 1",
        "duration_years": 2.4,
        "skills_used": [
          "Quantitative Research",
          "Deep Learning",
          "PostgreSQL",
          "Regression Analysis",
          "Hypothesis Testing"
        ],
        "description": "Worked on Quantitative Research, Deep Learning and related technologies"
      },
      {
        "title": "Project/Position 2",
        "duration_years": 1.6,
        "skills_used": [
          "Hypothesis Testing",
          "PostgreSQL"
        ],
        "description": "Worked on Hypothesis Testing, PostgreSQL and related technologies"
      }
    ],
    "raw_text": "CV ID: CV_076\n\nPROFESSIONAL SUMMARY:\nMid professional with 4 years of experience in research. \nExpertise in Quantitative Research, Peer Review, Hypothesis Testing and related technologies.\n\nEDUCATION:\n- BS Computer Science\n- MS Data Science\n\nSKILLS:\nQuantitative Research, Peer Review, Hypothesis Testing, R, Regression Analysis, PostgreSQL, Deep Learning, NLP\n\nEXPERIENCE:\n\n- Project/Position 1 (2.4 years)\n  Skills: Quantitative Research, Deep Learning, PostgreSQL, Regression Analysis, Hypothesis Testing\n  Worked on Quantitative Research, Deep Learning and related technologies\n\n- Project/Position 2 (1.6 years)\n  Skills: Hypothesis Testing, PostgreSQL\n  Worked on Hypothesis Testing, PostgreSQL and related technologies\n"
  },
  {
    "cv_id": "CV_077",
    "skills": [
      "Financial Analysis",
      "Business Analysis",
      "Risk Management",
      "ERP",
      "Marketing",
      "Market Research",
      "R",
      "Data Analysis"
    ],
    "experience_years": 12,
    "education": [
      "BS Mathematics",
      "MS Statistics",
      "PhD Statistics"
    ],
    "seniority": "senior",
    "domain": "business",
    "experiences": [
      {
        "title": "Project/Position 1",
        "duration_years": 0.8,
        "skills_used": [
          "Risk Management",
          "Marketing"
        ],
        "description": "Worked on Risk Management, Marketing and related technologies"
      },
      {
        "title": "Project/Position 2",
        "duration_years": 2.2,
        "skills_used": [
          "Marketing",
          "ERP",
          "Market Research",
          "Financial Analysis",
          "Data Analysis"
        ],
        "description": "Worked on Marketing, ERP and related technologies"
      },
      {
        "title": "Project/Position 3",
        "duration_years": 1.1,
        "skills_used": [
          "R",
          "Market Research",
          "Financial Analysis",
          "ERP"
        ],
        "description": "Worked on R, Market Research and related technologies"
      },
      {
        "title": "Project/Position 4",
        "duration_years": 1.0,
        "skills_used": [
          "ERP",
          "R"
        ],
        "description": "Worked on ERP, R and related technologies"
      },
      {
        "title": "Project/Position 5",
        "duration_years": 1.6,
        "skills_used": [
          "Business Analysis",
          "Financial Analysis"
        ],
        "description": "Worked on Business Analysis, Financial Analysis and related technologies"
      },
      {
        "title": "Project/Position 6",
        "duration_years": 3.0,
        "skills_used": [
          "Market Research",
          "Marketing"
        ],
        "description": "Worked on Market Research, Marketing and related technologies"
      }
    ],
    "raw_text": "CV ID: CV_077\n\nPROFESSIONAL SUMMARY:\nSenior professional with 12 years of experience in business. \nExpertise in Financial Analysis, Business Analysis, Risk Management and related technologies.\n\nEDUCATION:\n- BS Mathematics\n- MS Statistics\n- PhD Statistics\n\nSKILLS:\nFinancial Analysis, Business Analysis, Risk Management, ERP, Marketing, Market Research, R, Data Analysis\n\nEXPERIENCE:\n\n- Project/Position 1 (0.8 years)\n  Skills: Risk Management, Marketing\n  Worked on Risk Management, Marketing and related technologies\n\n- Project/Position 2 (2.2 years)\n  Skills: Marketing, ERP, Market Research, Financial Analysis, Data Analysis\n  Worked on Marketing, ERP and related technologies\n\n- Project/Position 3 (1.1 years)\n  Skills: R, Market Research, Financial Analysis, ERP\n  Worked on R, Market Research and related technologies\n\n- Project/Position 4 (1.0 years)\n  Skills: ERP, R\n  Worked on ERP, R and related technologies\n\n- Project/Position 5 (1.6 years)\n  Skills: Business Analysis, Financial Analysis\n  Worked on Business Analysis, Financial Analysis and related technologies\n\n- Project/Position 6 (3.0 years)\n  Skills: Market Research, Marketing\n  Worked on Market Research, Marketing and related technologies\n"
  },
  {
    "cv_id": "CV_078",
    "skills": [
      "TensorFlow",
      "R",
      "CI/CD",
      "SQL",
      "AWS",
      "Process Improvement",
      "Tableau",
      "Excel"
    ],
    "experience_years": 6,
    "education": [
      "BS Computer Science",
      "MS Data Science"
    ],
    "seniority": "mid",
    "domain": "tech",
    "experiences": [
      {
        "title": "Project/Position 1",
        "duration_years": 1.5,
        "skills_used": [
          "R",
          "TensorFlow",
          "CI/CD",
          "Process Improvement"
        ],
        "description": "Worked on R, TensorFlow and related technologies"
      },
      {
        "title": "Project/Position 2",
        "duration_years": 2.6,
        "skills_used": [
          "AWS",
          "Tableau",
          "R"
        ],
        "description": "Worked on AWS, Tableau and related technologies"
      },
      {
        "title": "Project/Position 3",
        "duration_years": 1.7,
        "skills_used": [
          "CI/CD",
          "SQL"
        ],
        "description": "Worked on CI/CD, SQL and related technologies"
      }
    ],
    "raw_text": "CV ID: CV_078\n\nPROFESSIONAL SUMMARY:\nMid professional with 6 years of experience in tech. \nExpertise in TensorFlow, R, CI/CD and related technologies.\n\nEDUCATION:\n- BS Computer Science\n- MS Data Science\n\nSKILLS:\nTensorFlow, R, CI/CD, SQL, AWS, Process Improvement, Tableau, Excel\n\nEXPERIENCE:\n\n- Project/Position 1 (1.5 years)\n  Skills: R, TensorFlow, CI/CD, Process Improvement\n  Worked on R, TensorFlow and related technologies\n\n- Project/Position 2 (2.6 years)\n  Skills: AWS, Tableau, R\n  Worked on AWS, Tableau and related technologies\n\n- Project/Position 3 (1.7 years)\n  Skills: CI/CD, SQL\n  Worked on CI/CD, SQL and related technologies\n"
  },
  {
    "cv_id": "CV_079",
    "skills": [
      "Customer Relations",
      "Process Improvement",
      "Power BI",
      "Excel",
      "Market Research",
      "Negotiation",
      "Go",
      "PostgreSQL"
    ],
    "experience_years": 7,
    "education": [
      "BS Physics",
      "MS Machine Learning"
    ],
    "seniority": "mid",
    "domain": "business",
    "experiences": [
      {
        "title": "Project/Position 1",
        "duration_years": 2.0,
        "skills_used": [
          "PostgreSQL",
          "Customer Relations"
        ],
        "description": "Worked on PostgreSQL, Customer Relations and related technologies"
      },
      {
        "title": "Project/Position 2",
        "duration_years": 2.4,
        "skills_used": [
          "Power BI",
          "Negotiation",
          "Go",
          "Customer Relations",
          "Process Improvement"
        ],
        "description": "Worked on Power BI, Negotiation and related technologies"
      },
      {
        "title": "Project/Position 3",
        "duration_years": 2.4,
        "skills_used": [
          "Market Research",
          "Excel",
          "Process Improvement",
          "Negotiation",
          "Go"
        ],
        "description": "Worked on Market Research, Excel and related technologies"
      }
    ],
    "raw_text": "CV ID: CV_079\n\nPROFESSIONAL SUMMARY:\nMid professional with 7 years of experience in business. \nExpertise in Customer Relations, Process Improvement, Power BI and related technologies.\n\nEDUCATION:\n- BS Physics\n- MS Machine Learning\n\nSKILLS:\nCustomer Relations, Process Improvement, Power BI, Excel, Market Research, Negotiation, Go, PostgreSQL\n\nEXPERIENCE:\n\n- Project/Position 1 (2.0 years)\n  Skills: PostgreSQL, Customer Relations\n  Worked on PostgreSQL, Customer Relations and related technologies\n\n- Project/Position 2 (2.4 years)\n  Skills: Power BI, Negotiation, Go, Customer Relations, Process Improvement\n  Worked on Power BI, Negotiation and related technologies\n\n- Project/Position 3 (2.4 years)\n  Skills: Market Research, Excel, Process Improvement, Negotiation, Go\n  Worked on Market Research, Excel and related technologies\n"
  },
  {
    "cv_id": "CV_080",
    "skills": [
      "Deep Learning",
      "Rust",
      "REST APIs",
      "Budgeting",
      "Communication"
    ],
    "experience_years": 2,
    "education": [
      "BS Computer Science"
    ],
    "seniority": "junior",
    "domain": "tech",
    "experiences": [
      {
        "title": "Project/Position 1",
        "duration_years": 1.3,
        "skills_used": [
          "Budgeting",
          "Rust",
          "Communication"
        ],
        "description": "Worked on Budgeting, Rust and related technologies"
      },
      {
        "title": "Project/Position 2",
        "duration_years": 2.1,
        "skills_used": [
          "Rust",
          "REST APIs"
        ],
        "description": "Worked on Rust, REST APIs and related technologies"
      }
    ],
    "raw_text": "CV ID: CV_080\n\nPROFESSIONAL SUMMARY:\nJunior professional with 2 years of experience in tech. \nExpertise in Deep Learning, Rust, REST APIs and related technologies.\n\nEDUCATION:\n- BS Computer Science\n\nSKILLS:\nDeep Learning, Rust, REST APIs, Budgeting, Communication\n\nEXPERIENCE:\n\n- Project/Position 1 (1.3 years)\n  Skills: Budgeting, Rust, Communication\n  Worked on Budgeting, Rust and related technologies\n\n- Project/Position 2 (2.1 years)\n  Skills: Rust, REST APIs\n  Worked on Rust, REST APIs and related technologies\n"
  },
  {
    "cv_id": "CV_081",
    "skills": [
      "Qualitative Research",
      "Quantitative Research",
      "Peer Review",
      "Regression Analysis",
      "LaTeX",
      "Literature Review",
      "Survey Design",
      "SQL",
      "Deep Learning",
      "Computer Vision"
    ],
    "experience_years": 13,
    "education": [
      "BS Physics",
      "PhD Physics"
    ],
    "seniority": "senior",
    "domain": "research",
    "experiences": [
      {
        "title": "Project/Position 1",
        "duration_years": 1.1,
        "skills_used": [
          "LaTeX",
          "SQL",
          "Peer Review",
          "Regression Analysis",
          "Quantitative Research"
        ],
        "description": "Worked on LaTeX, SQL and related technologies"
      },
      {
        "title": "Project/Position 2",
        "duration_years": 1.4,
        "skills_used": [
          "Qualitative Research",
          "Peer Review",
          "Deep Learning",
          "SQL"
        ],
        "description": "Worked on Qualitative Research, Peer Review and related technologies"
      },
      {
        "title": "Project/Position 3",
        "duration_years": 1.4,
        "skills_used": [
          "Regression Analysis",
          "Qualitative Research",
          "Literature Review"
        ],
        "description": "Worked on Regression Analysis, Qualitative Research and related technologies"
      },
      {
        "title": "Project/Position 4",
        "duration_years": 1.0,
        "skills_used": [
          "Literature Review",
          "Quantitative Research"
        ],
        "description": "Worked on Literature Review, Quantitative Research and related technologies"
      },
      {
        "title": "Project/Position 5",
        "duration_years": 2.7,
        "skills_used": [
          "Computer Vision",
          "SQL",
          "Regression Analysis"
        ],
        "description": "Worked on Computer Vision, SQL and related technologies"
      },
      {
        "title": "Project/Position 6",
        "duration_years": 2.8,
        "skills_used": [
          "Survey Design",
          "LaTeX",
          "Qualitative Research",
          "Quantitative Research"
        ],
        "description": "Worked on Survey Design, LaTeX and related technologies"
      }
    ],
    "raw_text": "CV ID: CV_081\n\nPROFESSIONAL SUMMARY:\nSenior professional with 13 years of experience in research. \nExpertise in Qualitative Research, Quantitative Research, Peer Review and related technologies.\n\nEDUCATION:\n- BS Physics\n- PhD Physics\n\nSKILLS:\nQualitative Research, Quantitative Research, Peer Review, Regression Analysis, LaTeX, Literature Review, Survey Design, SQL, Deep Learning, Computer Vision\n\nEXPERIENCE:\n\n- Project/Position 1 (1.1 years)\n  Skills: LaTeX, SQL, Peer Review, Regression Analysis, Quantitative Research\n  Worked on LaTeX, SQL and related technologies\n\n- Project/Position 2 (1.4 years)\n  Skills: Qualitative Research, Peer Review, Deep Learning, SQL\n  Worked on Qualitative Research, Peer Review and related technologies\n\n- Project/Position 3 (1.4 years)\n  Skills: Regression Analysis, Qualitative Research, Literature Review\n  Worked on Regression Analysis, Qualitative Research and related technologies\n\n- Project/Position 4 (1.0 years)\n  Skills: Literature Review, Quantitative Research\n  Worked on Literature Review, Quantitative Research and related technologies\n\n- Project/Position 5 (2.7 years)\n  Skills: Computer Vision, SQL, Regression Analysis\n  Worked on Computer Vision, SQL and related technologies\n\n- Project/Position 6 (2.8 years)\n  Skills: Survey Design, LaTeX, Qualitative Research, Quantitative Research\n  Worked on Survey Design, LaTeX and related technologies\n"
  },
  {
    "cv_id": "CV_082",
    "skills": [
      "CRM",
      "Customer Relations",
      "Marketing",
      "PowerPoint",
      "Forecasting",
      "Communication",
      "Risk Management",
      "Deep Learning",
      "Computer Vision"
    ],
    "experience_years": 7,
    "education": [
      "BS Computer Science",
      "MS Data Science"
    ],
    "seniority": "mid",
    "domain": "business",
    "experiences": [
      {
        "title": "Project/Position 1",
        "duration_years": 1.5,
        "skills_used": [
          "Forecasting",
          "Risk Management",
          "Customer Relations",
          "Marketing",
          "Computer Vision"
        ],
        "description": "Worked on Forecasting, Risk Management and related technologies"
      },
      {
        "title": "Project/Position 2",
        "duration_years": 1.2,
        "skills_used": [
          "CRM",
          "PowerPoint",
          "Customer Relations"
        ],
        "description": "Worked on CRM, PowerPoint and related technologies"
      },
      {
        "title": "Project/Position 3",
        "duration_years": 1.1,
        "skills_used": [
          "Customer Relations",
          "Communication",
          "Marketing",
          "Deep Learning",
          "PowerPoint"
        ],
        "description": "Worked on Customer Relations, Communication and related technologies"
      }
    ],
    "raw_text": "CV ID: CV_082\n\nPROFESSIONAL SUMMARY:\nMid professional with 7 years of experience in business. \nExpertise in CRM, Customer Relations, Marketing and related technologies.\n\nEDUCATION:\n- BS Computer Science\n- MS Data Science\n\nSKILLS:\nCRM, Customer Relations, Marketing, PowerPoint, Forecasting, Communication, Risk Management, Deep Learning, Computer Vision\n\nEXPERIENCE:\n\n- Project/Position 1 (1.5 years)\n  Skills: Forecasting, Risk Management, Customer Relations, Marketing, Computer Vision\n  Worked on Forecasting, Risk Management and related technologies\n\n- Project/Position 2 (1.2 years)\n  Skills: CRM, PowerPoint, Customer Relations\n  Worked on CRM, PowerPoint and related technologies\n\n- Project/Position 3 (1.1 years)\n  Skills: Customer Relations, Communication, Marketing, Deep Learning, PowerPoint\n  Worked on Customer Relations, Communication and related technologies\n"
  },
  {
    "cv_id": "CV_083",
    "skills": [
      "Process Improvement",
      "Communication",
      "Negotiation",
      "CRM",
      "Risk Management",
      "PyTorch",
      "R",
      "Git"
    ],
    "experience_years": 15,
    "education": [
      "BS Computer Science",
      "MS Data Science",
      "Executive MBA"
    ],
    "seniority": "senior",
    "domain": "business",
    "experiences": [
      {
        "title": "Project/Position 1",
        "duration_years": 2.6,
        "skills_used": [
          "Git",
          "R"
        ],
        "description": "Worked on Git, R and related technologies"
      },
      {
        "title": "Project/Position 2",
        "duration_years": 0.5,
        "skills_used": [
          "Negotiation",
          "Git"
        ],
        "description": "Worked on Negotiation, Git and related technologies"
      },
      {
        "title": "Project/Position 3",
        "duration_years": 1.1,
        "skills_used": [
          "Process Improvement",
          "Git",
          "R"
        ],
        "description": "Worked on Process Improvement, Git and related technologies"
      },
      {
        "title": "Project/Position 4",
        "duration_years": 1.8,
        "skills_used": [
          "CRM",
          "Process Improvement",
          "Communication"
        ],
        "description": "Worked on CRM, Process Improvement and related technologies"
      },
      {
        "title": "Project/Position 5",
        "duration_years": 2.8,
        "skills_used": [
          "Risk Management",
          "Process Improvement",
          "PyTorch",
          "R"
        ],
        "description": "Worked on Risk Management, Process Improvement and related technologies"
      },
      {
        "title": "Project/Position 6",
        "duration_years": 0.5,
        "skills_used": [
          "R",
          "Process Improvement",
          "Git",
          "Risk Management",
          "CRM"
        ],
        "description": "Worked on R, Process Improvement and related technologies"
      }
    ],
    "raw_text": "CV ID: CV_083\n\nPROFESSIONAL SUMMARY:\nSenior professional with 15 years of experience in business. \nExpertise in Process Improvement, Communication, Negotiation and related technologies.\n\nEDUCATION:\n- BS Computer Science\n- MS Data Science\n- Executive MBA\n\nSKILLS:\nProcess Improvement, Communication, Negotiation, CRM, Risk Management, PyTorch, R, Git\n\nEXPERIENCE:\n\n- Project/Position 1 (2.6 years)\n  Skills: Git, R\n  Worked on Git, R and related technologies\n\n- Project/Position 2 (0.5 years)\n  Skills: Negotiation, Git\n  Worked on Negotiation, Git and related technologies\n\n- Project/Position 3 (1.1 years)\n  Skills: Process Improvement, Git, R\n  Worked on Process Improvement, Git and related technologies\n\n- Project/Position 4 (1.8 years)\n  Skills: CRM, Process Improvement, Communication\n  Worked on CRM, Process Improvement and related technologies\n\n- Project/Position 5 (2.8 years)\n  Skills: Risk Management, Process Improvement, PyTorch, R\n  Worked on Risk Management, Process Improvement and related technologies\n\n- Project/Position 6 (0.5 years)\n  Skills: R, Process Improvement, Git, Risk Management, CRM\n  Worked on R, Process Improvement and related technologies\n"
  },
  {
    "cv_id": "CV_084",
    "skills": [
      "Hypothesis Testing",
      "Research Design",
      "Peer Review",
      "Survey Design",
      "Quantitative Research",
      "SPSS",
      "C++",
      "PostgreSQL",
      "Django"
    ],
    "experience_years": 4,
    "education": [
      "BS Physics",
      "MS Machine Learning"
    ],
    "seniority": "mid",
    "domain": "research",
    "experiences": [
      {
        "title": "Project/Position 1",
        "duration_years": 1.9,
        "skills_used": [
          "Hypothesis Testing",
          "Peer Review",
          "Survey Design",
          "Quantitative Research",
          "C++"
        ],
        "description": "Worked on Hypothesis Testing, Peer Review and related technologies"
      },
      {
        "title": "Project/Position 2",
        "duration_years": 2.6,
        "skills_used": [
          "PostgreSQL",
          "Quantitative Research",
          "SPSS"
        ],
        "description": "Worked on PostgreSQL, Quantitative Research and related technologies"
      }
    ],
    "raw_text": "CV ID: CV_084\n\nPROFESSIONAL SUMMARY:\nMid professional with 4 years of experience in research. \nExpertise in Hypothesis Testing, Research Design, Peer Review and related technologies.\n\nEDUCATION:\n- BS Physics\n- MS Machine Learning\n\nSKILLS:\nHypothesis Testing, Research Design, Peer Review, Survey Design, Quantitative Research, SPSS, C++, PostgreSQL, Django\n\nEXPERIENCE:\n\n- Project/Position 1 (1.9 years)\n  Skills: Hypothesis Testing, Peer Review, Survey Design, Quantitative Research, C++\n  Worked on Hypothesis Testing, Peer Review and related technologies\n\n- Project/Position 2 (2.6 years)\n  Skills: PostgreSQL, Quantitative Research, SPSS\n  Worked on PostgreSQL, Quantitative Research and related technologies\n"
  },
  {
    "cv_id": "CV_085",
    "skills": [
      "Process Improvement",
      "Business Analysis",
      "Strategic Planning",
      "PowerPoint",
      "Risk Management",
      "Computer Vision",
      "Flask"
    ],
    "experience_years": 1,
    "education": [
      "BS Computer Science"
    ],
    "seniority": "junior",
    "domain": "business",
    "experiences": [
      {
        "title": "Project/Position 1",
        "duration_years": 2.8,
        "skills_used": [
          "Strategic Planning",
          "Flask",
          "PowerPoint",
          "Process Improvement",
          "Computer Vision"
        ],
        "description": "Worked on Strategic Planning, Flask and related technologies"
      },
      {
        "title": "Project/Position 2",
        "duration_years": 1.7,
        "skills_used": [
          "Flask",
          "Business Analysis",
          "Risk Management"
        ],
        "description": "Worked on Flask, Business Analysis and related technologies"
      }
    ],
    "raw_text": "CV ID: CV_085\n\nPROFESSIONAL SUMMARY:\nJunior professional with 1 years of experience in business. \nExpertise in Process Improvement, Business Analysis, Strategic Planning and related technologies.\n\nEDUCATION:\n- BS Computer Science\n\nSKILLS:\nProcess Improvement, Business Analysis, Strategic Planning, PowerPoint, Risk Management, Computer Vision, Flask\n\nEXPERIENCE:\n\n- Project/Position 1 (2.8 years)\n  Skills: Strategic Planning, Flask, PowerPoint, Process Improvement, Computer Vision\n  Worked on Strategic Planning, Flask and related technologies\n\n- Project/Position 2 (1.7 years)\n  Skills: Flask, Business Analysis, Risk Management\n  Worked on Flask, Business Analysis and related technologies\n"
  },
  {
    "cv_id": "CV_086",
    "skills": [
      "Negotiation",
      "Risk Management",
      "Budgeting",
      "Business Analysis",
      "Sales",
      "PostgreSQL",
      "GraphQL"
    ],
    "experience_years": 7,
    "education": [
      "BS Computer Science",
      "MS Data Science"
    ],
    "seniority": "mid",
    "domain": "business",
    "experiences": [
      {
        "title": "Project/Position 1",
        "duration_years": 0.9,
        "skills_used": [
          "PostgreSQL",
          "Budgeting"
        ],
        "description": "Worked on PostgreSQL, Budgeting and related technologies"
      },
      {
        "title": "Project/Position 2",
        "duration_years": 2.2,
        "skills_used": [
          "Business Analysis",
          "PostgreSQL",
          "Sales"
        ],
        "description": "Worked on Business Analysis, PostgreSQL and related technologies"
      },
      {
        "title": "Project/Position 3",
        "duration_years": 1.8,
        "skills_used": [
          "GraphQL",
          "Business Analysis",
          "Risk Management",
          "Negotiation"
        ],
        "description": "Worked on GraphQL, Business Analysis and related technologies"
      }
    ],
    "raw_text": "CV ID: CV_086\n\nPROFESSIONAL SUMMARY:\nMid professional with 7 years of experience in business. \nExpertise in Negotiation, Risk Management, Budgeting and related technologies.\n\nEDUCATION:\n- BS Computer Science\n- MS Data Science\n\nSKILLS:\nNegotiation, Risk Management, Budgeting, Business Analysis, Sales, PostgreSQL, GraphQL\n\nEXPERIENCE:\n\n- Project/Position 1 (0.9 years)\n  Skills: PostgreSQL, Budgeting\n  Worked on PostgreSQL, Budgeting and related technologies\n\n- Project/Position 2 (2.2 years)\n  Skills: Business Analysis, PostgreSQL, Sales\n  Worked on Business Analysis, PostgreSQL and related technologies\n\n- Project/Position 3 (1.8 years)\n  Skills: GraphQL, Business Analysis, Risk Management, Negotiation\n  Worked on GraphQL, Business Analysis and related technologies\n"
  },
  {
    "cv_id": "CV_087",
    "skills": [
      "Rust",
      "REST APIs",
      "JavaScript",
      "Communication",
      "Forecasting"
    ],
    "experience_years": 0,
    "education": [
      "BS Mathematics"
    ],
    "seniority": "junior",
    "domain": "tech",
    "experiences": [
      {
        "title": "Project/Position 1",
        "duration_years": 1.4,
        "skills_used": [
          "JavaScript",
          "Forecasting",
          "REST APIs",
          "Rust"
        ],
        "description": "Worked on JavaScript, Forecasting and related technologies"
      },
      {
        "title": "Project/Position 2",
        "duration_years": 2.4,
        "skills_used": [
          "Rust",
          "Forecasting",
          "REST APIs",
          "JavaScript",
          "Communication"
        ],
        "description": "Worked on Rust, Forecasting and related technologies"
      }
    ],
    "raw_text": "CV ID: CV_087\n\nPROFESSIONAL SUMMARY:\nJunior professional with 0 years of experience in tech. \nExpertise in Rust, REST APIs, JavaScript and related technologies.\n\nEDUCATION:\n- BS Mathematics\n\nSKILLS:\nRust, REST APIs, JavaScript, Communication, Forecasting\n\nEXPERIENCE:\n\n- Project/Position 1 (1.4 years)\n  Skills: JavaScript, Forecasting, REST APIs, Rust\n  Worked on JavaScript, Forecasting and related technologies\n\n- Project/Position 2 (2.4 years)\n  Skills: Rust, Forecasting, REST APIs, JavaScript, Communication\n  Worked on Rust, Forecasting and related technologies\n"
  },
  {
    "cv_id": "CV_088",
    "skills": [
      "SPSS",
      "Experiment Design",
      "Python",
      "Quantitative Research",
      "Qualitative Research",
      "Agile",
      "AWS"
    ],
    "experience_years": 6,
    "education": [
      "BS Mathematics",
      "MS Statistics"
    ],
    "seniority": "mid",
    "domain": "research",
    "experiences": [
      {
        "title": "Project/Position 1",
        "duration_years": 2.9,
        "skills_used": [
          "Qualitative Research",
          "SPSS"
        ],
        "description": "Worked on Qualitative Research, SPSS and related technologies"
      },
      {
        "title": "Project/Position 2",
        "duration_years": 0.7,
        "skills_used": [
          "SPSS",
          "Quantitative Research",
          "AWS",
          "Experiment Design",
          "Qualitative Research"
        ],
        "description": "Worked on SPSS, Quantitative Research and related technologies"
      },
      {
        "title": "Project/Position 3",
        "duration_years": 0.6,
        "skills_used": [
          "AWS",
          "Quantitative Research",
          "Qualitative Research",
          "Agile",
          "SPSS"
        ],
        "description": "Worked on AWS, Quantitative Research and related technologies"
      }
    ],
    "raw_text": "CV ID: CV_088\n\nPROFESSIONAL SUMMARY:\nMid professional with 6 years of experience in research. \nExpertise in SPSS, Experiment Design, Python and related technologies.\n\nEDUCATION:\n- BS Mathematics\n- MS Statistics\n\nSKILLS:\nSPSS, Experiment Design, Python, Quantitative Research, Qualitative Research, Agile, AWS\n\nEXPERIENCE:\n\n- Project/Position 1 (2.9 years)\n  Skills: Qualitative Research, SPSS\n  Worked on Qualitative Research, SPSS and related technologies\n\n- Project/Position 2 (0.7 years)\n  Skills: SPSS, Quantitative Research, AWS, Experiment Design, Qualitative Research\n  Worked on SPSS, Quantitative Research and related technologies\n\n- Project/Position 3 (0.6 years)\n  Skills: AWS, Quantitative Research, Qualitative Research, Agile, SPSS\n  Worked on AWS, Quantitative Research and related technologies\n"
  },
  {
    "cv_id": "CV_089",
    "skills": [
      "Regression Analysis",
      "Quantitative Research",
      "Research Design",
      "Hypothesis Testing",
      "TensorFlow",
      "Computer Vision",
      "CI/CD"
    ],
    "experience_years": 0,
    "education": [
      "BS Mathematics"
    ],
    "seniority": "junior",
    "domain": "research",
    "experiences": [
      {
        "title": "Project/Position 1",
        "duration_years": 1.2,
        "skills_used": [
          "Hypothesis Testing",
          "Quantitative Research",
          "CI/CD",
          "Research Design",
          "Computer Vision"
        ],
        "description": "Worked on Hypothesis Testing, Quantitative Research and related technologies"
      },
      {
        "title": "Project/Position 2",
        "duration_years": 1.6,
        "skills_used": [
          "CI/CD",
          "Regression Analysis",
          "Quantitative Research"
        ],
        "description": "Worked on CI/CD, Regression Analysis and related technologies"
      }
    ],
    "raw_text": "CV ID: CV_089\n\nPROFESSIONAL SUMMARY:\nJunior professional with 0 years of experience in research. \nExpertise in Regression Analysis, Quantitative Research, Research Design and related technologies.\n\nEDUCATION:\n- BS Mathematics\n\nSKILLS:\nRegression Analysis, Quantitative Research, Research Design, Hypothesis Testing, TensorFlow, Computer Vision, CI/CD\n\nEXPERIENCE:\n\n- Project/Position 1 (1.2 years)\n  Skills: Hypothesis Testing, Quantitative Research, CI/CD, Research Design, Computer Vision\n  Worked on Hypothesis Testing, Quantitative Research and related technologies\n\n- Project/Position 2 (1.6 years)\n  Skills: CI/CD, Regression Analysis, Quantitative Research\n  Worked on CI/CD, Regression Analysis and related technologies\n"
  },
  {
    "cv_id": "CV_090",
    "skills": [
      "Strategic Planning",
      "Excel",
      "Negotiation",
      "Customer Relations",
      "Git",
      "AWS"
    ],
    "experience_years": 2,
    "education": [
      "BS Data Science"
    ],
    "seniority": "junior",
    "domain": "business",
    "experiences": [
      {
        "title": "Project/Position 1",
        "duration_years": 2.9,
        "skills_used": [
          "Negotiation",
          "Customer Relations",
          "Strategic Planning"
        ],
        "description": "Worked on Negotiation, Customer Relations and related technologies"
      },
      {
        "title": "Project/Position 2",
        "duration_years": 1.6,
        "skills_used": [
          "Strategic Planning",
          "AWS",
          "Git",
          "Negotiation"
        ],
        "description": "Worked on Strategic Planning, AWS and related technologies"
      }
    ],
    "raw_text": "CV ID: CV_090\n\nPROFESSIONAL SUMMARY:\nJunior professional with 2 years of experience in business. \nExpertise in Strategic Planning, Excel, Negotiation and related technologies.\n\nEDUCATION:\n- BS Data Science\n\nSKILLS:\nStrategic Planning, Excel, Negotiation, Customer Relations, Git, AWS\n\nEXPERIENCE:\n\n- Project/Position 1 (2.9 years)\n  Skills: Negotiation, Customer Relations, Strategic Planning\n  Worked on Negotiation, Customer Relations and related technologies\n\n- Project/Position 2 (1.6 years)\n  Skills: Strategic Planning, AWS, Git, Negotiation\n  Worked on Strategic Planning, AWS and related technologies\n"
  },
  {
    "cv_id": "CV_091",
    "skills": [
      "Market Research",
      "Leadership",
      "Communication",
      "Marketing",
      "CRM",
      "Budgeting",
      "Strategic Planning",
      "Computer Vision",
      "Data Analysis"
    ],
    "experience_years": 4,
    "education": [
      "BS Business",
      "MBA"
    ],
    "seniority": "mid",
    "domain": "business",
    "experiences": [
      {
        "title": "Project/Position 1",
        "duration_years": 2.0,
        "skills_used": [
          "Market Research",
          "Communication",
          "Budgeting",
          "Data Analysis"
        ],
        "description": "Worked on Market Research, Communication and related technologies"
      },
      {
        "title": "Project/Position 2",
        "duration_years": 1.7,
        "skills_used": [
          "Strategic Planning",
          "Market Research",
          "Budgeting"
        ],
        "description": "Worked on Strategic Planning, Market Research and related technologies"
      }
    ],
    "raw_text": "CV ID: CV_091\n\nPROFESSIONAL SUMMARY:\nMid professional with 4 years of experience in business. \nExpertise in Market Research, Leadership, Communication and related technologies.\n\nEDUCATION:\n- BS Business\n- MBA\n\nSKILLS:\nMarket Research, Leadership, Communication, Marketing, CRM, Budgeting, Strategic Planning, Computer Vision, Data Analysis\n\nEXPERIENCE:\n\n- Project/Position 1 (2.0 years)\n  Skills: Market Research, Communication, Budgeting, Data Analysis\n  Worked on Market Research, Communication and related technologies\n\n- Project/Position 2 (1.7 years)\n  Skills: Strategic Planning, Market Research, Budgeting\n  Worked on Strategic Planning, Market Research and related technologies\n"
  },
  {
    "cv_id": "CV_092",
    "skills": [
      "Strategic Planning",
      "Tableau",
      "CRM",
      "Market Research",
      "Leadership",
      "Customer Relations",
      "Risk Management",
      "Docker",
      "SQL"
    ],
    "experience_years": 5,
    "education": [
      "BS Engineering",
      "MS Engineering",
      "MBA"
    ],
    "seniority": "senior",
    "domain": "business",
    "experiences": [
      {
        "title": "Project/Position 1",
        "duration_years": 2.0,
        "skills_used": [
          "Docker",
          "Strategic Planning",
          "Risk Management",
          "CRM",
          "Leadership"
        ],
        "description": "Worked on Docker, Strategic Planning and related technologies"
      },
      {
        "title": "Project/Position 2",
        "duration_years": 2.4,
        "skills_used": [
          "Tableau",
          "CRM"
        ],
        "description": "Worked on Tableau, CRM and related technologies"
      }
    ],
    "raw_text": "CV ID: CV_092\n\nPROFESSIONAL SUMMARY:\nSenior professional with 5 years of experience in business. \nExpertise in Strategic Planning, Tableau, CRM and related technologies.\n\nEDUCATION:\n- BS Engineering\n- MS Engineering\n- MBA\n\nSKILLS:\nStrategic Planning, Tableau, CRM, Market Research, Leadership, Customer Relations, Risk Management, Docker, SQL\n\nEXPERIENCE:\n\n- Project/Position 1 (2.0 years)\n  Skills: Docker, Strategic Planning, Risk Management, CRM, Leadership\n  Worked on Docker, Strategic Planning and related technologies\n\n- Project/Position 2 (2.4 years)\n  Skills: Tableau, CRM\n  Worked on Tableau, CRM and related technologies\n"
  },
  {
    "cv_id": "CV_093",
    "skills": [
      "Statistical Analysis",
      "Quantitative Research",
      "Regression Analysis",
      "Agile",
      "TensorFlow"
    ],
    "experience_years": 2,
    "education": [
      "BS Mathematics"
    ],
    "seniority": "junior",
    "domain": "research",
    "experiences": [
      {
        "title": "Project/Position 1",
        "duration_years": 1.4,
        "skills_used": [
          "Regression Analysis",
          "Quantitative Research",
          "TensorFlow"
        ],
        "description": "Worked on Regression Analysis, Quantitative Research and related technologies"
      },
      {
        "title": "Project/Position 2",
        "duration_years": 0.8,
        "skills_used": [
          "Quantitative Research",
          "Regression Analysis",
          "TensorFlow",
          "Statistical Analysis",
          "Agile"
        ],
        "description": "Worked on Quantitative Research, Regression Analysis and related technologies"
      }
    ],
    "raw_text": "CV ID: CV_093\n\nPROFESSIONAL SUMMARY:\nJunior professional with 2 years of experience in research. \nExpertise in Statistical Analysis, Quantitative Research, Regression Analysis and related technologies.\n\nEDUCATION:\n- BS Mathematics\n\nSKILLS:\nStatistical Analysis, Quantitative Research, Regression Analysis, Agile, TensorFlow\n\nEXPERIENCE:\n\n- Project/Position 1 (1.4 years)\n  Skills: Regression Analysis, Quantitative Research, TensorFlow\n  Worked on Regression Analysis, Quantitative Research and related technologies\n\n- Project/Position 2 (0.8 years)\n  Skills: Quantitative Research, Regression Analysis, TensorFlow, Statistical Analysis, Agile\n  Worked on Quantitative Research, Regression Analysis and related technologies\n"
  },
  {
    "cv_id": "CV_094",
    "skills": [
      "Market Research",
      "Excel",
      "Leadership",
      "Data Analysis",
      "PyTorch"
    ],
    "experience_years": 2,
    "education": [
      "BS Data Science"
    ],
    "seniority": "junior",
    "domain": "business",
    "experiences": [
      {
        "title": "Project/Position 1",
        "duration_years": 2.3,
        "skills_used": [
          "Market Research",
          "PyTorch"
        ],
        "description": "Worked on Market Research, PyTorch and related technologies"
      },
      {
        "title": "Project/Position 2",
        "duration_years": 2.5,
        "skills_used": [
          "Leadership",
          "Data Analysis",
          "Market Research",
          "Excel",
          "PyTorch"
        ],
        "description": "Worked on Leadership, Data Analysis and related technologies"
      }
    ],
    "raw_text": "CV ID: CV_094\n\nPROFESSIONAL SUMMARY:\nJunior professional with 2 years of experience in business. \nExpertise in Market Research, Excel, Leadership and related technologies.\n\nEDUCATION:\n- BS Data Science\n\nSKILLS:\nMarket Research, Excel, Leadership, Data Analysis, PyTorch\n\nEXPERIENCE:\n\n- Project/Position 1 (2.3 years)\n  Skills: Market Research, PyTorch\n  Worked on Market Research, PyTorch and related technologies\n\n- Project/Position 2 (2.5 years)\n  Skills: Leadership, Data Analysis, Market Research, Excel, PyTorch\n  Worked on Leadership, Data Analysis and related technologies\n"
  },
  {
    "cv_id": "CV_095",
    "skills": [
      "Process Improvement",
      "Financial Analysis",
      "Sales",
      "PostgreSQL",
      "Git"
    ],
    "experience_years": 2,
    "education": [
      "BS Computer Science"
    ],
    "seniority": "junior",
    "domain": "business",
    "experiences": [
      {
        "title": "Project/Position 1",
        "duration_years": 2.5,
        "skills_used": [
          "PostgreSQL",
          "Git",
          "Financial Analysis",
          "Process Improvement"
        ],
        "description": "Worked on PostgreSQL, Git and related technologies"
      },
      {
        "title": "Project/Position 2",
        "duration_years": 2.1,
        "skills_used": [
          "Process Improvement",
          "Sales",
          "PostgreSQL"
        ],
        "description": "Worked on Process Improvement, Sales and related technologies"
      }
    ],
    "raw_text": "CV ID: CV_095\n\nPROFESSIONAL SUMMARY:\nJunior professional with 2 years of experience in business. \nExpertise in Process Improvement, Financial Analysis, Sales and related technologies.\n\nEDUCATION:\n- BS Computer Science\n\nSKILLS:\nProcess Improvement, Financial Analysis, Sales, PostgreSQL, Git\n\nEXPERIENCE:\n\n- Project/Position 1 (2.5 years)\n  Skills: PostgreSQL, Git, Financial Analysis, Process Improvement\n  Worked on PostgreSQL, Git and related technologies\n\n- Project/Position 2 (2.1 years)\n  Skills: Process Improvement, Sales, PostgreSQL\n  Worked on Process Improvement, Sales and related technologies\n"
  },
  {
    "cv_id": "CV_096",
    "skills": [
      "MongoDB",
      "Go",
      "PyTorch",
      "Budgeting",
      "Tableau"
    ],
    "experience_years": 3,
    "education": [
      "BS Data Science"
    ],
    "seniority": "junior",
    "domain": "tech",
    "experiences": [
      {
        "title": "Project/Position 1",
        "duration_years": 2.5,
        "skills_used": [
          "Go",
          "Budgeting",
          "Tableau"
        ],
        "description": "Worked on Go, Budgeting and related technologies"
      },
      {
        "title": "Project/Position 2",
        "duration_years": 2.5,
        "skills_used": [
          "Tableau",
          "MongoDB"
        ],
        "description": "Worked on Tableau, MongoDB and related technologies"
      }
    ],
    "raw_text": "CV ID: CV_096\n\nPROFESSIONAL SUMMARY:\nJunior professional with 3 years of experience in tech. \nExpertise in MongoDB, Go, PyTorch and related technologies.\n\nEDUCATION:\n- BS Data Science\n\nSKILLS:\nMongoDB, Go, PyTorch, Budgeting, Tableau\n\nEXPERIENCE:\n\n- Project/Position 1 (2.5 years)\n  Skills: Go, Budgeting, Tableau\n  Worked on Go, Budgeting and related technologies\n\n- Project/Position 2 (2.5 years)\n  Skills: Tableau, MongoDB\n  Worked on Tableau, MongoDB and related technologies\n"
  },
  {
    "cv_id": "CV_097",
    "skills": [
      "Marketing",
      "Power BI",
      "Financial Analysis",
      "Machine Learning",
      "Docker"
    ],
    "experience_years": 2,
    "education": [
      "BS Information Technology"
    ],
    "seniority": "junior",
    "domain": "business",
    "experiences": [
      {
        "title": "Project/Position 1",
        "duration_years": 2.0,
        "skills_used": [
          "Marketing",
          "Power BI",
          "Financial Analysis",
          "Machine Learning",
          "Docker"
        ],
        "description": "Worked on Marketing, Power BI and related technologies"
      },
      {
        "title": "Project/Position 2",
        "duration_years": 1.3,
        "skills_used": [
          "Power BI",
          "Marketing",
          "Machine Learning",
          "Docker"
        ],
        "description": "Worked on Power BI, Marketing and related technologies"
      }
    ],
    "raw_text": "CV ID: CV_097\n\nPROFESSIONAL SUMMARY:\nJunior professional with 2 years of experience in business. \nExpertise in Marketing, Power BI, Financial Analysis and related technologies.\n\nEDUCATION:\n- BS Information Technology\n\nSKILLS:\nMarketing, Power BI, Financial Analysis, Machine Learning, Docker\n\nEXPERIENCE:\n\n- Project/Position 1 (2.0 years)\n  Skills: Marketing, Power BI, Financial Analysis, Machine Learning, Docker\n  Worked on Marketing, Power BI and related technologies\n\n- Project/Position 2 (1.3 years)\n  Skills: Power BI, Marketing, Machine Learning, Docker\n  Worked on Power BI, Marketing and related technologies\n"
  },
  {
    "cv_id": "CV_098",
    "skills": [
      "Qualitative Research",
      "Python",
      "Peer Review",
      "Quantitative Research",
      "Literature Review",
      "Node.js",
      "SQL",
      "React"
    ],
    "experience_years": 10,
    "education": [
      "BS Engineering",
      "MS Computer Science"
    ],
    "seniority": "mid",
    "domain": "research",
    "experiences": [
      {
        "title": "Project/Position 1",
        "duration_years": 2.6,
        "skills_used": [
          "Literature Review",
          "Peer Review",
          "Python",
          "SQL",
          "React"
        ],
        "description": "Worked on Literature Review, Peer Review and related technologies"
      },
      {
        "title": "Project/Position 2",
        "duration_years": 1.4,
        "skills_used": [
          "Qualitative Research",
          "React"
        ],
        "description": "Worked on Qualitative Research, React and related technologies"
      },
      {
        "title": "Project/Position 3",
        "duration_years": 0.8,
        "skills_used": [
          "Peer Review",
          "Literature Review"
        ],
        "description": "Worked on Peer Review, Literature Review and related technologies"
      },
      {
        "title": "Project/Position 4",
        "duration_years": 2.2,
        "skills_used": [
          "Node.js",
          "Literature Review",
          "React",
          "Quantitative Research",
          "SQL"
        ],
        "description": "Worked on Node.js, Literature Review and related technologies"
      },
      {
        "title": "Project/Position 5",
        "duration_years": 0.7,
        "skills_used": [
          "React",
          "Node.js",
          "Quantitative Research",
          "SQL",
          "Python"
        ],
        "description": "Worked on React, Node.js and related technologies"
      }
    ],
    "raw_text": "CV ID: CV_098\n\nPROFESSIONAL SUMMARY:\nMid professional with 10 years of experience in research. \nExpertise in Qualitative Research, Python, Peer Review and related technologies.\n\nEDUCATION:\n- BS Engineering\n- MS Computer Science\n\nSKILLS:\nQualitative Research, Python, Peer Review, Quantitative Research, Literature Review, Node.js, SQL, React\n\nEXPERIENCE:\n\n- Project/Position 1 (2.6 years)\n  Skills: Literature Review, Peer Review, Python, SQL, React\n  Worked on Literature Review, Peer Review and related technologies\n\n- Project/Position 2 (1.4 years)\n  Skills: Qualitative Research, React\n  Worked on Qualitative Research, React and related technologies\n\n- Project/Position 3 (0.8 years)\n  Skills: Peer Review, Literature Review\n  Worked on Peer Review, Literature Review and related technologies\n\n- Project/Position 4 (2.2 years)\n  Skills: Node.js, Literature Review, React, Quantitative Research, SQL\n  Worked on Node.js, Literature Review and related technologies\n\n- Project/Position 5 (0.7 years)\n  Skills: React, Node.js, Quantitative Research, SQL, Python\n  Worked on React, Node.js and related technologies\n"
  },
  {
    "cv_id": "CV_099",
    "skills": [
      "Negotiation",
      "Customer Relations",
      "Risk Management",
      "Deep Learning",
      "R"
    ],
    "experience_years": 3,
    "education": [
      "BS Computer Science"
    ],
    "seniority": "junior",
    "domain": "business",
    "experiences": [
      {
        "title": "Project/Position 1",
        "duration_years": 2.4,
        "skills_used": [
          "Customer Relations",
          "Deep Learning"
        ],
        "description": "Worked on Customer Relations, Deep Learning and related technologies"
      },
      {
        "title": "Project/Position 2",
        "duration_years": 1.9,
        "skills_used": [
          "Negotiation",
          "Customer Relations",
          "Deep Learning",
          "Risk Management"
        ],
        "description": "Worked on Negotiation, Customer Relations and related technologies"
      }
    ],
    "raw_text": "CV ID: CV_099\n\nPROFESSIONAL SUMMARY:\nJunior professional with 3 years of experience in business. \nExpertise in Negotiation, Customer Relations, Risk Management and related technologies.\n\nEDUCATION:\n- BS Computer Science\n\nSKILLS:\nNegotiation, Customer Relations, Risk Management, Deep Learning, R\n\nEXPERIENCE:\n\n- Project/Position 1 (2.4 years)\n  Skills: Customer Relations, Deep Learning\n  Worked on Customer Relations, Deep Learning and related technologies\n\n- Project/Position 2 (1.9 years)\n  Skills: Negotiation, Customer Relations, Deep Learning, Risk Management\n  Worked on Negotiation, Customer Relations and related technologies\n"
  }
]